Name,Price,Category,image
"Two Moustaches Gemstone Work Brass Urli Ethnic Traditional Bowl with Bells, Gemstone Work, Material - Brass, Pack of 1","48,990",Home Furnishing,https://m.media-amazon.com/images/I/71aoqM6UEjL._AC_UL320_.jpg
Pure Source India Ceramic Electric Aroma Diffuser Matka Shape Oil Burner with Bulb (Blue - with 10 ml Lavender Aroma Oil),4899,Home Furnishing,https://m.media-amazon.com/images/I/71V22HbFL+L._AC_UL320_.jpg
"Kitlyn Ram Darbar Statue God Ram, Sita, LaXman & Hanuman Idol for Spiritual Puja Vastu & Gift Item - 21 cm (Polyresin, Mul...","48,499",Home Furnishing,https://m.media-amazon.com/images/I/71am8Y8H4-L._AC_UL320_.jpg
"Special You 3D Butterfly for Decoration items for Wall Sticker with Sticking Pad for Home Decoration, Removable Stickers H...","48,399",Home Furnishing,https://m.media-amazon.com/images/I/71eb9KjqgRL._AC_UL320_.jpg
LABHCART Metal Decorative Bowl Urli Table Accents for Decoration | Urli Bowl for Home Decor | Gift Item Table Decorative S...,4899,Home Furnishing,https://m.media-amazon.com/images/I/611QrpFUiJL._AC_UL320_.jpg
"URBOII Designer Wooden Wall Hangings Home Decor Items evil eye turkish evil eye Boho Hamsa Hand for Home, Office, House P...",4899,Home Furnishing,https://m.media-amazon.com/images/I/71LFNsDknaL._AC_UL320_.jpg
Mount Acrylic DIY Frameless 3D Mirror Sticker Large Wall Clock for Home & Office Decorations (Black),4899,Home Furnishing,https://m.media-amazon.com/images/I/51SFZ0G+gfL._AC_UL320_.jpg
"HINMIN Smart Night Light Plastic Digital Alarm Clock with Date & Indoor Temperature, Battery Operated Desk Small, Clear LC...","48,599",Home Furnishing,https://m.media-amazon.com/images/I/61uYG4ACLoS._AC_UL320_.jpg
"VILASA Aromatheraphy Diffuser Oil for Home & Office Use, Aroma Diffuser, Easy Usage, No Mineral Oil Valley of Flowers",4825,Home Furnishing,https://m.media-amazon.com/images/I/61i8kMs52oL._AC_UL320_.jpg
"Bikri Kendra - Stars 50 Golden Decorative Mirror Stickers for Wall, Wall Mirror Stickers, 3D Acrylic Stickers Wall Sticker...","48,199",Home Furnishing,https://m.media-amazon.com/images/I/619bZzfq8OL._AC_UL320_.jpg
Little Buddha Monk Solar Head Shaking | Car Home Decoration Figurine Statue Toys,4899,Home Furnishing,https://m.media-amazon.com/images/I/51GNhLJHTmL._AC_UL320_.jpg
Harbour Analog Latest Stylish New Models Wall Clock for Home Living Room Hall Bedroom (Size Height 48 CM X Width 41 CM) Mz...,"48,599",Home Furnishing,https://m.media-amazon.com/images/I/919JKNfy91L._AC_UL320_.jpg
Koshtak Kamdhenu Cow with Brahma Vishnu Mahesh/Shiva Giving Blessing Laminated Poster with Synthetic Wood Golden Frame (30...,4899,Home Furnishing,https://m.media-amazon.com/images/I/A1rwMxNAsTL._AC_UL320_.jpg
PRINTELLIGENT Wall Art Vintage Wooden Wall Hanging Home Decor Items. (ART) (style-b),4899,Home Furnishing,https://m.media-amazon.com/images/I/71BZFfXEOKL._AC_UL320_.jpg
"Brightown 25FT Black Wire : 25Ft G40 Globe String Lights with Clear Bulbs, ul listed Backyard Patio Lights, Hanging Indoo...","48,999",Home Furnishing,https://m.media-amazon.com/images/I/61ekV91t9qL._AC_UL320_.jpg
"Paper Cute Babies / Children Poster, Multicolour, Medium",4850,Home Furnishing,https://m.media-amazon.com/images/I/61HwaOiy1sS._AC_UL320_.jpg
A F Decor Hanging Murracan Lantern/Tealight Holder with Tealight Candle Hanging Light for Indoor|Outdoor Home Dcor Pack o...,4800,Home Furnishing,https://m.media-amazon.com/images/I/61ZjEcOM98L._AC_UL320_.jpg
Party 24X7 Birthday Party Decoration Star Candle Gold Big Cake Decoration Candles Golden Theme Candle (Gold),4899,Home Furnishing,https://m.media-amazon.com/images/I/61WNVx2TabL._AC_UL320_.jpg
"STAR WORK Wall Clock - Silent Non-Ticking Wall Clocks Battery Operated - Modern Style Wooden Clock Decorative for Kitchen,...",4899,Home Furnishing,https://m.media-amazon.com/images/I/41qyjeY-yGL._AC_UL320_.jpg
ADA Handicraft Premium Lord Goddess God Shankar Family Photo for Pooja | Hindu Bhagwan Devi Devta Shiva Parvati Photo | Go...,"48,499",Home Furnishing,https://m.media-amazon.com/images/I/A1zMRVMHHLL._AC_UL320_.jpg
S2S Lord Ganesh with Gaumata Backdrop Curatin Cloth for Pooja Decoration/House Warming Function/Traditional Events 8 Ft Wi...,"48,199",Home Furnishing,https://m.media-amazon.com/images/I/71U6ZybSOpL._AC_UL320_.jpg
Rinkon Stockmarket Poster Trading Candlestick Patterns Chart For Traders Stock market Chart Bullish Bearish Sharemarket Tr...,"48,499",Home Furnishing,https://m.media-amazon.com/images/I/81VkdlogAEL._AC_UL320_.jpg
"Remedywala Vastu Brass Strip, 8 feet Length, 18mm Width, 0.2 mm Gauge, Gold Color, 1 Piece",4899,Home Furnishing,https://m.media-amazon.com/images/I/71wRjAu-EKL._AC_UL320_.jpg
"Saifee Burhani Wood MFD Masha Allah Islamic Religious Wall and Door Frame (30cmX10cm, Golden, Brown)",4899,Home Furnishing,https://m.media-amazon.com/images/I/71yCHFjNzML._AC_UL320_.jpg
"Wall1ders Kalash Shubh Labh Mirror Stickers for Wall, Acrylic Mirror Wall Decor Sticker, Wall Mirror Stickers, Acrylic Sti...",4899,Home Furnishing,https://m.media-amazon.com/images/I/61EUCpU8DnL._AC_UL320_.jpg
BoXania  20 pieces Safe Natural Camphor Wood Balls Moth Balls Bug Mildew Repellent Wardrobe Clothes Drawers Pest Control,4849,Home Furnishing,https://m.media-amazon.com/images/I/31eDUbS+kkL._AC_UL320_.jpg
"Pure Source India Dry Flower Scented Potpourri - 100 Gm, Lavender, Blue",4851,Home Furnishing,https://m.media-amazon.com/images/I/919uWaYjNPL._AC_UL320_.jpg
Krishi Sai Baba Murti Marble Dust Idol Statue for Pooja (White_4.5 Inch),4899,Home Furnishing,https://m.media-amazon.com/images/I/41RZxaGFnQL._AC_UL320_.jpg
VKR Digital Smart Back Light Table Mirror Alarm Clock with Sensor Date and Temperature for Office Home and Bedroom - White,4899,Home Furnishing,https://m.media-amazon.com/images/I/41uhNDbM-1L._AC_UL320_.jpg
"PRINTELLIGENT 'Alphabets' Wall Sticker (PVC Vinyl, 130 cm X 130 cm)","48,125",Home Furnishing,https://m.media-amazon.com/images/I/61s3-h5VnrL._AC_UL320_.jpg
Song of India 100 ml. Organic Goodness Air Freshener Room Spray in Amber Coloured Glass Bottle (Mysore Chandan - Sandalwood),4850,Home Furnishing,https://m.media-amazon.com/images/I/61TbFXrLngL._AC_UL320_.jpg
"Paper Plane Design Coasters Set of 4 Designer Patterns for Home,Bar, Office and Gifting. (A)",4845,Home Furnishing,https://m.media-amazon.com/images/I/A1TpfwgfkdL._AC_UL320_.jpg
Anbhudan |DEMON SLAYER- DECOR | PACK OF 18 wall collage kit |ANIME wall poster 6 * 4 inches | Tanjiro Kamado | Nezuko Kama...,4829,Home Furnishing,https://m.media-amazon.com/images/I/91DCL0oxd-L._AC_UL320_.jpg
NATIONAL; PITAMBARI Deepshakti oil 900ml with lavender fragrance.,4810,Home Furnishing,https://m.media-amazon.com/images/I/41yfxQuSblS._AC_UL320_.jpg
Akhand Glass Diya with Handi for Pooja | 7 Hour Burn time Borosilicate Glass - 8cm (Small),"48,050",Home Furnishing,https://m.media-amazon.com/images/I/71jTFCCbR9L._AC_UL320_.jpg
Elemntl Crescent Moon Gold Tealight Candle Holder Set for Home Decor & Diwali | Tabletop & Hanging | Votive & Tea Light St...,4899,Home Furnishing,https://m.media-amazon.com/images/I/818bNVh24lL._AC_UL320_.jpg
AVI Rubber Rectangular Fridge Magnet Peach Colorful Taj Mahal Agra Travel Souvenir RFM00067,4899,Home Furnishing,https://m.media-amazon.com/images/I/613HEApvP0L._AC_UL320_.jpg
VASTU MAGIC Positive Energy Powder (No Salt),4899,Home Furnishing,https://m.media-amazon.com/images/I/61D5eSnWS+L._AC_UL320_.jpg
Bronto Dhoop Charcoal Tablets (50 Tablets),"48,499",Home Furnishing,https://m.media-amazon.com/images/I/713kkcH8JYL._AC_UL320_.jpg
"Dequera > Resin Human Skull Ashtray Home Ornaments for Scary Halloween Decorations, Decorative Skulls, Skeletons Figurine...",4899,Home Furnishing,https://m.media-amazon.com/images/I/81eD6z1twtL._AC_UL320_.jpg
"VAH-Kya Bat Hai !! Butterfly Acrylic Wall Art Silver Colour Wall Mirror Stickers For Living Room, Bed Room, Home Decor, In...",4899,Home Furnishing,https://m.media-amazon.com/images/I/81D6s8gaKML._AC_UL320_.jpg
"Divine Senses Love Attraction Spell Candle | Natural Soy WaX Manifestation Candle | Spell Candle with Rose Quartz Crystal,...",4899,Home Furnishing,https://m.media-amazon.com/images/I/61jcvBrfmeL._AC_UL320_.jpg
CraftVatika Metal Toran Ganesha on Leaf Bandarwal Ganesh Kalash subh labh for Door & Wall Hanging Diwali Home Decoration Item,4899,Home Furnishing,https://m.media-amazon.com/images/I/717B0KCuucL._AC_UL320_.jpg
"Amazing India Stone Shivling Idol, Standard, White",4899,Home Furnishing,https://m.media-amazon.com/images/I/71AhiKkuLDL._AC_UL320_.jpg
Tdas Artificial Plants with Pot Leaves Hanging Ivy Garlands Plant Greenery Vine Creeper Home Decor Door Wall Balcony Decor...,4899,Home Furnishing,https://m.media-amazon.com/images/I/714U22broiL._AC_UL320_.jpg
"PRINTNET Pack of 2 Baby Lord Krishna Wall Poster | HD Poster for room decor (12X18-Inch, 300GSM Thick Paper, Laminated, Mu...",4899,Home Furnishing,https://m.media-amazon.com/images/I/716aCYmnDNL._AC_UL320_.jpg
"JH Gallery Recycled Martial Rajasthani Standing Dolls Tealight Candle Holder, Multicolor (2 Pair)(4 Candle Holders)",4899,Home Furnishing,https://m.media-amazon.com/images/I/911fs7+-r0S._AC_UL320_.jpg
"S-Biv Artificial Plant with Premium Pot | Artificial Rose | Suitable for Home Decoration, Office Desk, Study Table |Artifi...",4827,Home Furnishing,https://m.media-amazon.com/images/I/61MwzFWY-fL._AC_UL320_.jpg
"AuraDecor Heart Shape Fragrance Tealight Candles Burning Time 4 to 5 Hours (10, Rose)",4849,Home Furnishing,https://m.media-amazon.com/images/I/71Vf7RNpNKL._AC_UL320_.jpg
"BLOOMAX Original Natural Cedar Wood Blocks, Moth Repellent I Aromatic Cedar Blocks, Clothes Protection Storage Accessorie...",4899,Home Furnishing,https://m.media-amazon.com/images/I/91jTpR0DGSL._AC_UL320_.jpg
"Bikri Kendra - 100 Star Golden Decorative Mirror Stickers for Wall, Wall Mirror Stickers, 3D Acrylic Stickers Wall Sticker...","48,199",Home Furnishing,https://m.media-amazon.com/images/I/71ZQnNZ2WhS._AC_UL320_.jpg
"Girirajji Set of 11 Pcs Copper Coin for Pooja, 11 Pcs Copper Coin",4899,Home Furnishing,https://m.media-amazon.com/images/I/61yqx9lo7kL._AC_UL320_.jpg
Revant Handwork ganpati toran for Door Diwali Celebration toran Size 3 feet,4899,Home Furnishing,https://m.media-amazon.com/images/I/717X-zshFBL._AC_UL320_.jpg
ACN Kohinoor | WHM-14|Beautiful MacrameMirror Wall Hanging Decor | Handmade Boho Wall Hanging Mirror for Home Dcoration| ...,"48,499",Home Furnishing,https://m.media-amazon.com/images/I/713kSDS3L6L._AC_UL320_.jpg
Kapur Dani Electrical Camphor Diffuser| Ceramic Kapoor Dhani & Essential Oil Diffuser with On Off Switch to Toggle Between...,4899,Home Furnishing,https://m.media-amazon.com/images/I/7162ClDs7hL._AC_UL320_.jpg
"DreamKraft Glow in The Dark GalaXy of Stars with Moon Radium Night Sticker(Green,231 Pcs)",4800,Home Furnishing,https://m.media-amazon.com/images/I/812iFUDhf3L._AC_UL320_.jpg
"The Aroma Factory Agarbatti for Pooja, Kesar Chandan & Sandalwood Incense Sticks, Charcoal Free & Low Smoke Agarbatti with...",4800,Home Furnishing,https://m.media-amazon.com/images/I/81ZhMZtGxyL._AC_UL320_.jpg
Dreamkraft White Metal Antique Finish Tirupati Balaji Vishnu Shankh Chakra Namah Showpiece (Golden - 11 X 1 X 5 cm),4800,Home Furnishing,https://m.media-amazon.com/images/I/81UGnZTKcuL._AC_UL320_.jpg
SUN PACKERS PRE-ROLLED CONES PACK OF 1 BOX NATURAL SMOKING PAPER (Brown),4899,Home Furnishing,https://m.media-amazon.com/images/I/71nV3joxCEL._AC_UL320_.jpg
Sri Sai Flora Agarbatti Hand Rolled Indian Lord Incense Sticks Pack of 15 (25 GRM Each),4875,Home Furnishing,https://m.media-amazon.com/images/I/512rZhzRN2L._AC_UL320_.jpg
"Decals Design 'Vine Flower' Wall Sticker (PVC Vinyl, 50 cm X 70 cm, Purple)",4864,Home Furnishing,https://m.media-amazon.com/images/I/61uhnfWmDML._AC_UL320_.jpg
CraftVatika Marble Dust Goddess Maa Durga Idol Sitting on Lion - 6 .8 Inches,4899,Home Furnishing,https://m.media-amazon.com/images/I/71YhV8u65VL._AC_UL320_.jpg
"Pure Original Natural Loban - Sambrani-Benzoin Herbal Dhoop - for Pooja, Hawan, Home Fragrance, Dhoop (200 Grams ( Cristal ))",4800,Home Furnishing,https://m.media-amazon.com/images/I/815naF55vHL._AC_UL320_.jpg
"prabhu bhakti Narmadeshwar Shivling Original/Narmada shivling Original for Home for Puja ,Stone ,Brown","48,555",Home Furnishing,https://m.media-amazon.com/images/I/61GDw1ckc5L._AC_UL320_.jpg
Happer Premium Multipurpose Wall Mounted Storage Plastic Cabinet With Mirror (White),"48,000",Home Furnishing,https://m.media-amazon.com/images/I/81xwuuFh9WS._AC_UL320_.jpg
"Saumic Craft Set of Five Rajasthani Village Lady Scenery Framed Wall Painting for Home Decoration, Paintings for Wall Deco...","48,499",Home Furnishing,https://m.media-amazon.com/images/I/81ajscPxUBL._AC_UL320_.jpg
Shubhkart Nitya Mini Agarbatti Diya Thali & Haldi-kumkum Kalash Koiri (25g) with Nitya Steel Gruha Ghanti (Medium - 42 Gra...,4806,Home Furnishing,https://m.media-amazon.com/images/I/51NKi0nUPUL._AC_UL320_.jpg
Orca 3D Acrylic Wall Clock Design for Living Room Bed Room (Wall Clock1)- Wall Clock -Pack of 50 - Genuine & Original Prod...,"48,299",Home Furnishing,https://m.media-amazon.com/images/I/41-FnkX6PbL._AC_UL320_.jpg
"Wall Guru PVC Vinyl Flower Branch with Flying Butterfly Wall Sticker 17.71X6.69X6.69 inches, White",4899,Home Furnishing,https://m.media-amazon.com/images/I/71yU+pHKD6L._AC_UL320_.jpg
"Decals Creation Islamic Wall Sticker - Beautiful Floral Masha Allah Wall Sticker for Living Room, Drawing Room, Hall, Offi...",4899,Home Furnishing,https://m.media-amazon.com/images/I/71t5mExJZhL._AC_UL320_.jpg
Sharda Creations SHUBH-LABH Satin Side Door Hangings with Flower Border for Door Decoration/Diwali Decoration(Yellow&Pink),4899,Home Furnishing,https://m.media-amazon.com/images/I/51hoKDqtgUL._AC_UL320_.jpg
"Giant Innovative Bamboo Abstract Poster, Multicolour, Modern, 12 inch X 18 inch",4859,Home Furnishing,https://m.media-amazon.com/images/I/81n5P+4NAML._AC_UL320_.jpg
Asian Hobby Crafts Dream Catcher Wall Hanging : Size (LXB) 25X8 cm : ' Malibu' (Combo A),4899,Home Furnishing,https://m.media-amazon.com/images/I/71erdTa0xEL._AC_UL320_.jpg
Alwaysgifts Magical Mirror Round Shape Customized Photo Frame for Birthday Anniversary Valentine Gift Present,4899,Home Furnishing,https://m.media-amazon.com/images/I/51yeB7OSOPL._AC_UL320_.jpg
"Plus Value Feng Shui Lucky Good Luck Coin (5 Set) for Wealth, Abundance, Prosperity","48,000",Home Furnishing,https://m.media-amazon.com/images/I/61-Bi8k1gPL._AC_UL320_.jpg
"ITDC 6"" Handheld Brass Telescope with Wooden BoX - Pirate Navigation",4899,Home Furnishing,https://m.media-amazon.com/images/I/61yRjktw9IL._AC_UL320_.jpg
ARTELLY Wall Hanging for Kitchen Cafe Restaurant Bar Coffee Tea Wall Hanger/Quotes Decor items for Home Kitchen Decoration...,4899,Home Furnishing,https://m.media-amazon.com/images/I/71T67dYbL+L._AC_UL320_.jpg
CELLEBII Electric Wooden Kapoor Dani Stand/Incense Burner/Dhoop Burner/Camphor Aroma Diffuser with Direct Plug in,4899,Home Furnishing,https://m.media-amazon.com/images/I/615k3602-DL._AC_UL320_.jpg
"Retro Vibes Jasmine Essential oil | Pure, Natural & Undiluted | Pack - 100 ML",4899,Home Furnishing,https://m.media-amazon.com/images/I/41N1JeFZZlL._AC_UL320_.jpg
"wolpin Wall Stickers Wallpaper (45 X 500 cm) Abstract Zebra Pattern Stripes Self Adhesive Decals for Office, Living Room M...","48,499",Home Furnishing,https://m.media-amazon.com/images/I/71vXBlieNRS._AC_UL320_.jpg
the monument shop Gulab jamun Miniature Food 3D Fridge Magnet Best Souvenir Gift 100% Made in India,4800,Home Furnishing,https://m.media-amazon.com/images/I/81d-prfDfPL._AC_UL320_.jpg
"Krishn ROOP Agarbatti for Home and Office Mogra Home Fragrance Loose Agarbatti 1kg 8"" Stick",4899,Home Furnishing,https://m.media-amazon.com/images/I/41-f+XbBHOL._AC_UL320_.jpg
"eCraftIndia Golden Metal Decorative Handcrafted Tea Light Candle Holder for Diwali Festival, Home Decor, Table Decoration,...",4899,Home Furnishing,https://m.media-amazon.com/images/I/713MpIgET5L._AC_UL320_.jpg
Interiocrafts Cast Iron Degchi Dhoop Holder and Tea Light Holder for Home with Wall Hanging Stand and Brass Bells (9(L) X ...,"48,499",Home Furnishing,https://m.media-amazon.com/images/I/618xfk6DsIL._AC_UL320_.jpg
"Amazon Brand - Solimo 12-Inch Wall Clock, Brown(Plastic)","48,100",Home Furnishing,https://m.media-amazon.com/images/I/81ULB1mD0UL._AC_UL320_.jpg
Devotional Kart Yin Yang Bagua Pa KUA for Toilet / Bathroom / Latrine Vastu and Balancing Energies,4800,Home Furnishing,https://m.media-amazon.com/images/I/61CWax7mPZL._AC_UL320_.jpg
"AS Interior PVC Plastic Vinyl Self Adhesive Rangoli Attractive Peel and Stick (Multicolour, 23inchX23inch), Pack of 1",4888,Home Furnishing,https://m.media-amazon.com/images/I/61V0jqidLNL._AC_UL320_.jpg
Color Bristles 10 Pocket Slide-In Black Brown White Craft Paper Wall Hanging Photo Frame Album with Wooden Clips and Jute...,4899,Home Furnishing,https://m.media-amazon.com/images/I/61tWF1twI6L._AC_UL320_.jpg
SEVEN HORSES Round Shape Frameless Mirror for Bathroom Washbasin for Wall (Small),"48,998",Home Furnishing,https://m.media-amazon.com/images/I/61RZH0sckCS._AC_UL320_.jpg
Ankita Gemstones Marble Shiva Shivling Idol Pooja God Statue (Black),4899,Home Furnishing,https://m.media-amazon.com/images/I/61VBITNk-6L._AC_UL320_.jpg
Ryme Feng Shui Metal Wind Chimes with Om Printed on Five Pipes for Good Luck (Golden),4899,Home Furnishing,https://m.media-amazon.com/images/I/81C7uqFuL2L._AC_UL320_.jpg
"MANIAL PRINTNET 300GSM Thick Paper, Gloss Laminated HD Smiling Baby Wall Poster Combo for Pregnant Women for Room Decor (1...","48,299",Home Furnishing,https://m.media-amazon.com/images/W/IMAGERENDERING_521856-T1/images/I/71pLB7Yy7VL._AC_UL320_.jpg
AJ Arihant Sandalwood/Chandan Incense Dhoop Cones with Stand - Pack of 100 | Sandal Dhoop Cone | Chandan Dhoop Cones for P...,4800,Home Furnishing,https://m.media-amazon.com/images/W/IMAGERENDERING_521856-T1/images/I/81m45KjBXmS._AC_UL320_.jpg
QAZ Genuine Quality Filter Reduce Tar Cleanable and Reusable Recycling Mouthpiece Smoking Cigarette Holder,4899,Home Furnishing,https://m.media-amazon.com/images/W/IMAGERENDERING_521856-T1/images/I/81jF6G0eqyL._AC_UL320_.jpg
"Incredible Gifts India Gift for Teachers by Students - Personalized Engrave Wooden Award (6 X 4 inches, Wood, Beige), Tabl...","48,650",Home Furnishing,https://m.media-amazon.com/images/W/IMAGERENDERING_521856-T1/images/I/71Ako1GaYpL._AC_UL320_.jpg
"SATYAM KRAFT 1 Pcs Artificial Flowers Gingko Fake Sticks decorative items for Gifting, Home, Room, Office, Bedroom, Balcon...","48,200",Home Furnishing,https://m.media-amazon.com/images/W/IMAGERENDERING_521856-T1/images/I/41K0vkzyJQL._AC_UL320_.jpg
"AFARZA; CHOICE GOOD FEEL GOOD Artificial Mogra Jasmine Flower Toran Garland String for Home Door Decoration (White Red , S...",4800,Home Furnishing,https://m.media-amazon.com/images/W/IMAGERENDERING_521856-T1/images/I/81UjQBWXbfL._AC_UL320_.jpg
"VCREATE DECOR Floral Design PVC Wall Sticker & Decal (Multicolour, Size-58 cm X 41 cm), Botanical",4899,Home Furnishing,https://m.media-amazon.com/images/W/IMAGERENDERING_521856-T1/images/I/61G0F6AejFL._AC_UL320_.jpg
Sai Amrut S A Gifts Sadguru Sai Mdf Wooden Momento Acrylic Decorative Sai Baba Photo Frame With Charan Paduka With Natural...,4899,Home Furnishing,https://m.media-amazon.com/images/W/IMAGERENDERING_521856-T1/images/I/71lIuPw5-3L._AC_UL320_.jpg
minimal affairs Designer Leatherette Finish MDF Cash boX Jewellery BoX Shagun Envelope Money BoX Envelope Wedding Gift ret...,4849,Home Furnishing,https://m.media-amazon.com/images/W/IMAGERENDERING_521856-T1/images/I/619Ol741gAL._AC_UL320_.jpg
DearHouse 6 Pack 3.75 Feet/Piece Artificial Fake Wisteria Vine Ratta Hanging Garland Silk Flowers String Home Party Weddin...,"48,299",Home Furnishing,https://m.media-amazon.com/images/W/IMAGERENDERING_521856-T1/images/I/81+rZNMnTML._AC_UL320_.jpg
"OREVA Plastic Pendulum Wall Clock (42.5 cm X 30.5 cm X 7.0 cm, Natural Wood, AQ-2327)",4870,Home Furnishing,https://m.media-amazon.com/images/W/IMAGERENDERING_521856-T1/images/I/81LKd8rYdcL._AC_UL320_.jpg
"UAPAN Brass Door Hanging Bell with Brass Chain for Bandarwal, Temple Decoration, Mandir, Home Decoration(3.5 Feet Long Cha...","48,499",Home Furnishing,https://m.media-amazon.com/images/W/IMAGERENDERING_521856-T1/images/I/61ByW6tiJRL._AC_UL320_.jpg
Udbhav Creations LLP Shock Proof Electric Aroma Burner/ Camphor Diffuser / Fragrance Diffuser for Home / Kapoor Dani Incen...,4899,Home Furnishing,https://m.media-amazon.com/images/W/IMAGERENDERING_521856-T1/images/I/613CavOQtiL._AC_UL320_.jpg
CHUNDAWAT Brown Arrow Wall Clock for Living Room || Badroom || Shop || Office || Home Dcor_158,4899,Home Furnishing,https://m.media-amazon.com/images/W/IMAGERENDERING_521856-T1/images/I/418cPjW8IoL._AC_UL320_.jpg
"HARI DARSHAN Wood Devgandh Sambrani Cups (Pack of 4, 12 Cups in Each)",4860,Home Furnishing,https://m.media-amazon.com/images/W/IMAGERENDERING_521856-T1/images/I/71wfc5CSRLL._AC_UL320_.jpg
"HASTHIP Tree of Life Tapestry Wall Hanging, Wishing Tree Aesthetic Tapestries Psychedelic Wall Carpet Mystic Aesthetic Wa...","48,199",Home Furnishing,https://m.media-amazon.com/images/W/IMAGERENDERING_521856-T1/images/I/71X6KvFjh0L._AC_UL320_.jpg
"Amazon Brand - Solimo Collage Rosewood Set of 8 Photo Frames (8 X 10 inch - 8), Wall Mount","48,470",Home Furnishing,https://m.media-amazon.com/images/W/IMAGERENDERING_521856-T1/images/I/71bZ7LMx20L._AC_UL320_.jpg
"JR Handicrafts World Golden and Silver Plated Bowl Set Includes 2 Bowls, 2 Spoons and 1 Tray",4850,Home Furnishing,https://m.media-amazon.com/images/W/IMAGERENDERING_521856-T1/images/I/51Lufpl6wIL._AC_UL320_.jpg
"Parashara ARKAM Surya Yantra - Copper - (4 X 4 inches, Brown)",4899,Home Furnishing,https://m.media-amazon.com/images/W/IMAGERENDERING_521856-T1/images/I/71rziKxsdML._AC_UL320_.jpg
"NOVALUC 20 Led Fairy String Lights for Home Decoration, 13FT 10 Crystal Drop and 10 Ball in Sequence (Pack of 1, Warm White)",4899,Home Furnishing,https://m.media-amazon.com/images/W/IMAGERENDERING_521856-T1/images/I/71XWe9IxYbL._AC_UL320_.jpg
Safari Big Fragrance of Festival (F&F 500g) Tin Container Agarbatti (12in1 Fragrance) Incence Sticks Steel BoX 500g Gift Pack,4800,Home Furnishing,https://m.media-amazon.com/images/W/IMAGERENDERING_521856-T1/images/I/61nEfLdAw7L._AC_UL320_.jpg
NAWAB Essential Aroma Diffuser Oil (Lavender and Ocean - 15ml Each),4867,Home Furnishing,https://m.media-amazon.com/images/W/IMAGERENDERING_521856-T1/images/I/71L4RBBO60L._AC_UL320_.jpg
SS Decorationerman Silver Brass Floral Bowl Set with Tray and Spoon with Red Velvet BoX Pack Used for Diwali Gifting Dry...,4899,Home Furnishing,https://m.media-amazon.com/images/W/IMAGERENDERING_521856-T1/images/I/916YrfGcfbL._AC_UL320_.jpg
SAF Set of 3 HeXagon Ganesha MDF Board UV TeXtured Painting 17 Inch X 17 Inch SANFHXS7500,4899,Home Furnishing,https://m.media-amazon.com/images/W/IMAGERENDERING_521856-T1/images/I/81xx+bBXcQL._AC_UL320_.jpg
Aarushi Creations Acrylic Personalised Home Door Name Plate Acrylic with Acrylic Embossed Letters with Mirror Shine (Size ...,"48,000",Home Furnishing,https://m.media-amazon.com/images/W/IMAGERENDERING_521856-T2/images/I/613bXbglR2L._AC_UL320_.jpg
"VR Creatives Brass Handmade Kumkum/Sindoor BoX with Stick (Gold, 1.6 X 1.6 X 1.9 Inch), Round Gift",4800,Home Furnishing,https://m.media-amazon.com/images/W/IMAGERENDERING_521856-T2/images/I/61tLk-QfrIL._AC_UL320_.jpg
"DecopiX Split AC Vinyl Wall Stickers (Standard Size, Fit for All Models, Sizes, Brands, Multicolor) - SM6096, Pack of 1",4899,Home Furnishing,https://m.media-amazon.com/images/W/IMAGERENDERING_521856-T2/images/I/61M+jKqTMAL._AC_UL320_.jpg
Asian Aura Handcrafted Ceramic Electric Square Shaped Aroma Diffuser Oil Burner for Home with Aroma Oils in 2 fragrances (...,"48,999",Home Furnishing,https://m.media-amazon.com/images/W/IMAGERENDERING_521856-T2/images/I/51SDeJi7+tL._AC_UL320_.jpg
Art Street Photo Frames for Home Dcor Set of 9 Black Wall Photo Frames for Living Room Decoration (Size - 8 X 8 Inches),"48,500",Home Furnishing,https://m.media-amazon.com/images/W/IMAGERENDERING_521856-T2/images/I/617bR99B3-L._AC_UL320_.jpg
DND 100% Ayurvedic Herbal Natural Mosquito Repellent Agarbatti | 100% Safe for Humans | Pack of 4 | Basil | Incense Sticks,4860,Home Furnishing,https://m.media-amazon.com/images/W/IMAGERENDERING_521856-T2/images/I/710F+2DSB5S._AC_UL320_.jpg
AutoSun-Car Dashboard/Office Desk Alarm Clock and Stopwatch with FleXible Stand,4899,Home Furnishing,https://m.media-amazon.com/images/W/IMAGERENDERING_521856-T2/images/I/516UqGAxaCL._AC_UL320_.jpg
Chaka Chaundh - Abdul Kalam Motivational Quotes Poster with Photo Frames for Wall - Engineered Wood - (14 X 11 inches),4869,Home Furnishing,https://m.media-amazon.com/images/W/IMAGERENDERING_521856-T2/images/I/61F-dTTaHlS._AC_UL320_.jpg
"TeXtile art Abstract Cotton Wall Hanging Tapestries (54 X 84 inch, Multicolor)","48,999",Home Furnishing,https://m.media-amazon.com/images/W/IMAGERENDERING_521856-T2/images/I/81yGaToit4L._AC_UL320_.jpg
OCB COMBO OF 3 OCB BROWN KING SIZE ROLLING PAPER BOOKLETS AND 3 OCB ROACH PAD BOOKS ( TOTAL PACK OF 6 ) BY BOCACHICA,4899,Home Furnishing,https://m.media-amazon.com/images/W/IMAGERENDERING_521856-T2/images/I/31+6gvsgrQL._AC_UL320_.jpg
Vintage Collection Non Working Decorative showpiece Telephone DBC7,"48,400",Home Furnishing,https://m.media-amazon.com/images/W/IMAGERENDERING_521856-T2/images/I/81SYE2K+a0L._AC_UL320_.jpg
eCraftIndia Lord Krishna Playing Flute Under Tree with Golden Cow and Calf Showpiece,4895,Home Furnishing,https://m.media-amazon.com/images/W/IMAGERENDERING_521856-T2/images/I/81jYk0SKzgL._AC_UL320_.jpg
Mirza Decor Tree of Life for Home & Garden Decor for Christmas Decor Wall Decorative Rustic/Antique/Blackish Hangings Beau...,4899,Home Furnishing,https://m.media-amazon.com/images/W/IMAGERENDERING_521856-T2/images/I/516wXJbu4RL._AC_UL320_.jpg
