Rank,Name,Ratings,Price
418,Gifts IslandÂ® Set of 5 Cream & Beige Polyester Silk Gold-Tone Striped Square Cushion Covers 16 inch x 16 inch (40.64 x 40....,4.2,4599
419,"Huesland by Ahmedabad Cotton 144 TC Cotton King Size Bedsheet with 2 Pillow Covers - Orange, Green & Brown(9ft x 9ft)",4.2,"45,995"
420,Trance Home Linen Pure Cotton Soft and Skin Friendly 200 TC King Fitted Printed Elastic Bedsheet with 2 Pillow Covers - (7...,4,"45,599"
421,"Click to Open expanded View Home Deco Curtain Bracket Maroon Color Temple Rod Rail Bracket (Pack of 8) 1 Inch , with Royal...",3.8,"45,699"
422,"Shri Uma Enterprises - Foldable Picnic Mat, Thin and Durable; Beach mat; Waterproof and Sand Proof Picnic Blanket; Picnic ...",3.5,"45,100"
423,"Bless Kraft Decor Waterproof PVC Plastic Clear 4 Seater Square Table Cover (Transparent, Golden Lace, (48 x48 cm) Thicknes...",4,4569
424,"vihs Sparkel Sofa Cushion Cover for Sofa Bedroom Bedroom, Living Room, Office Diwali Decoration Set (Pack of 5, 16x16 iche...",3.7,4599
425,"Amazon Brand â€?Umi Super Soft Brushed Microfiber Cotton Printed Lightweight Single Dohar,57X87(Inches) 144X220 (CM) Flanne...",4,4599
426,PRAKARTIK BY INDUARTS 100% Cotton Rose Flower & Leaves Rectangular Dining Table mat with Runner . Red & Yellow ( Set of 6...,4.1,"45,699"
427,Cortina Corporate Office Chair Covers | Removable Chair Protector | Executive Rotating Chair Seat Case | Stretch Elastic P...,3.8,4598
428,GRIVAN Stainless Steel & ABS Curtain Bracket Parda Holder with Support 1 Inch Rod Pocket Finials Designer Door and Window ...,3.9,"45,799"
429,BONA SORT Waterproof Plastic (Polyvinyl Chloride) Bed Sheet Cover -Plastic Sheet Cover for Babies Kids and Adult - (Double...,3.3,4549
430,"F2L Cotton Hand Towel 500 GSM, Size - 16x30 Inch (Set of 6 pc White )",3.9,"45,499"
431,Kradyl Kroft New Born Baby Pillow for Preventing Flat Head | Head Shaping Pillow with 100% Cotton RemovableCover (Cool),4.1,"45,699"
432,AIRWILL Cotton Floral Pattern 6 Seater Table Cloth Pack of 1 pc (Maroon),4.1,4545
433,"YaAK Cotton Designer Diwan Set (8 Pieces, Multicolor, Standard Size)",3.6,"45,099"
434,"Ikea Cotton Strandkrypa Floral Double Bedsheet and 2 Pillowcase, White, 240x260/50x80 cm (94x102/20x32)",4.4,"45,499"
435,"Heart Home Microfiber Square Chair Pad/Cushion for Office, Home or Car Sitting, Pack of 2 (Maroon)",3.7,4599
436,"Ikea TSSP Tea Towel, White/Dark grey/patterned45x60 cm (18x24 )(Pack of 4)",4.5,4599
437,"STITCHNEST Ikat Digital Printed 4 Seater Table Runner and Bed Runner, 13 x 60 Inches, Yellow Grey",4,4599
438,Soniasaa Prime Collection 200 TC Soft Cotton-Blend Pillow Covers 6 Pieces 17 x27 Inches(Standard Size) for Home and Hotel use,4,"45,560"
439,SoniasaaÂ® Prime Collection 315 TC Combo Pack of 2 Single Sized (90x60) Satin Striped Bedsheet with 2 Pillow Cover Long Las...,5,"45,680"
440,"Sashaa World Striped Super Soft &BreathableCotton Throw Blanket | Throw Blanket for Living Room, Bed, Sofa & Chiar | Mul...",4.2,"45,500"
441,"Kuber Industries 35 Artificial Grass for Balcony Or Doormat, Soft and Durable Plastic Turf Carpet Mat, Artificial Grass 1 ...",3,4599
442,"Hush Slim Pillow (16 x 24 x 6 Inch) I Imported Softex Filling I Anti-Sag Technology I Medium Soft Feel, Cotton, White",3.5,4575
443,"Livpure Smart All Weather Microfiber Reversible | Super Soft | Antibacterial | Lightweight 200 GSM Comforter, Double Size ...",4.1,"45,000"
444,"Huesland by Ahmedabad Cotton 144 TC Cotton Bedsheet for Double Bed with 2 Pillow Covers - Blue, White & Green",3.8,"45,295"
445,tclpvc Bamboo Roll Up Curtain for Top Floor High Pressure Balcony 4/7 ft Pack of 1,4.2,"45,000"
446,BeyBee Waterproof Quick Dry Sheet for Baby| Bed Pad Anti-Piling Fleece Extra Absorbent Washable Matress Protector| Baby Be...,4.3,4599
447,"Story@Home Bohemian 100% CottonCanvas Curtain Thermal Insulated Floral Pattern Door Eyelet Curtains for Bedroom (7 Feet, P...",4,"45,699"
448,"SKYTRENDS Happy Birthday to You Gift for Wife | Gift for Wife | Birthday Combo Gift Pack of 12 x 12"" Cushion Cover with Fi...",4,4599
449,SOFTSPUN Microfiber High Loop Hair & Face Care Bath Towel 1 pc 70x140cm 380 GSM Black Ultra Absorbent Super Soft & Comfort...,3.8,4599
450,"PINK PARROT Dopian Silk Throw Pillow Covers/Cushion Covers ( Multicolour, 16X16 Inches) - Set Of 5(200.0)",4.2,4599
451,"Galaxy Home Decor Solid Plain Polyester Curtains for Window 5 Feet, Pack of 1, Blue (Blue, Window 5 Feet (1-Pc)), Blackout",3.9,"45,999"
452,TheYaYaCafe Birthday Gifts for Mom to Be 12 x 12 Inches Mommy to Be Please Wait Printed Velvet Cushion with Filler Throw P...,4,4599
453,BSB HOME Premium Forever Modern Style Glace Cotton Floral Luxurious Beautiful Soft Comfort Designer Floral Pattern 1 Singl...,4..1,4599
454,BREEZEWAY New Born Baby Cotton Cloth Langot U shaped washable and Reusable Nappies (0-6 Month Multicolour) Pack of 10,4,"45,330"
455,Shopclix Double Bed Blanket Mink Blanket for Heavy Winter Ac Solid Double Bed Blanket Super Soft Light Winter Blanket (Bro...,3.3,"45,999"
456,"SARAL HOME EASY LIVING Saral Home Soft Cotton Tufted 1 Seater Sofa Cover Throw Set of 2 (Ivory, 140x125 cm)",3.6,"45,999"
457,VParents Perry Baby Bedding Set / Baby Bedding Mattress Set with Mosquito Net / Baby Bed Set and Baby Play Gym with Mosqui...,3.2,"45,499"
458,RD TREND Glace Cotton Single Bedsheet ( 90 x 60 ) Without Pillow Cover- Solid Green,3.9,4595
459,"Gamcha Assamese Japi Design Bath Towel 180 GSM Polycotton Gamcha, White",4.1,4500
460,"RED CRUSH Plastic Chatai Floor Mat (6 ft x 9ft, Multi Color)",3.2,4599
461,"BSB HOME 100% Cotton Geometric Print Mix N Match Single Bed Sheet with 1 Pillow Covers for Single Bed/Coat/Diwan, Blue and...",3.5,4599
462,"PrettyKrafts dustproof Printed LPG Gas Cylinder Cover Full size, (Pack of 1) Brown",3.7,4599
463,"DESI DHANG White Cotton Single Bedsheet, 140 cm X 220 cm Without Pillow Cover, Normal Quality, Pack of 1",3.9,4599
464,"TheOne Solapur Chaddar Cotton Blanket, 5 X 7.5ft, Blue",4.2,4549
465,Yellow Weaves 6 Piece Dining Table Placemats - Copper Gray,3.9,"45,249"
466,KARP Pair of 1 Silicone Gloves,4.2,"45,599"
467,"MAHASETH Fasion 12""X20"" Inch Cotton Boho Shaggy Geomtrical with Tassle for Decor Living Room Bedroom Indoor Outdoor Sofa C...",4.5,4599
468,"LuvLap Instadry Extra Absorbent Quick Dry Sheet for Baby, Baby Bed Protector, Waterproof Baby Sheet - Royal Blue, 0m+ - La...",4.3,4549
469,"RANGBHAR Handloom Cotton Striped Bedsheet for Double Bed, Organic Woven Bedsheet with 2 Pillow Covers, Red, 90 x 100 inch",3.9,"45,599"
470,HASTHIPÂ® Bed Sheet Holder Straps | Adjustable Bed Sheet Fastener and 3 Way Mattress Cover Holder Fasteners | The Triangle ...,4,4574
471,KUNKUN Foldable Mosquito Net for Single Bed ( Large Size 7x4x4 Feet ) :: Standard Quality (Black),3.7,"45,499"
472,"TipTop Decoration Premium Metal Rings for Dream Catchers and MacramÃ© (Stainless Steel) (Standard Sizes, 4 Pcs Each Size)",4.3,4500
473,"Cloth Fusion 210 TC 100% Cotton Pillow Covers Set of 2 | Ultra Soft Satin Striped Pillow Case | 18 x 27 Inches, Mustard, 2...",4.1,4599
474,HOMELAXX Super Soft Glace Cotton King Size AC Comforter/Blanket/Duvet with 1 Flat Bedsheet and 2 Pillow Cover for Double B...,4,"45,999"
475,"Wobbox Big 3Ft X 6Ft Silver Color Tinsel Metallic Square Foil Curtain Backdrop Door Window Curtain Party Decoration, Foil ...",4.5,4599
476,BSB HOME Premium Cotton Elastic Fitted Embossed Linen Bedsheets with 2 King Size Pillow Covers | Double Bed With All Aroun...,3.8,"45,299"
477,"Kuber Industries Checkered Design PVC Wardrobe Kitchen Drawer Cupboard Cabinet Shelf Mat, Shelf Liner 10 Mtr (Blue), Polyv...",4.3,4549
478,"StyleWorth Polyester Digital Printed Curtain (4 X 7 Feet, Yellow)- Pack Of 2(Material: Faux Shiny Polyester , Colour: Yell...",4.2,"45,199"
479,ME & YOU Gift for Wife Special Romantic Birthday | Unique Gift for Wife | Lovely Birthday Gift Hamper-Printed Cushion with...,4.1,4599
480,"JY Coccyx Seat Cushion for Office Chair, Desk Chair Seat Cushion for Tailbone Pain, Orthopedic Memory Foam Coccyx Seat Cus...",3.6,"45,999"
481,DECOREZA Home Kids Cartoon Cotton Elastic Fitted Bedsheets with 2 King Size Pillow Covers | Double Bed with All Around Ela...,4.3,"45,499"
482,"Mee Mee Reusable Water Proof Cotton Bed Protector Sheet/Extra Absorbent Mat/Dry Sheets/Urine Sheet/Dry Mat(Pink and Blue, ...",4.1,4598
483,Kuber Industries Kitchen Drawer/Cabinet Shelf Mat|Checks Design With PVC Material|Adjustable Size 10 Mtr Roll (Grey)-CTKTC...,4,4599
484,"Fernish Decor Jute Cotton Round Rug (Multicolour, 120 cm)",4.2,"45,299"
485,Flooring India Co FI Home Newman Microfiber Anti-Skid Water Absorbent/Soaking Washable Mat for Bathroom/Entrance/Kitchen/B...,4,"45,299"
486,DECOREZA Home Premium Cotton Elastic Fitted Bedsheets with 2 King Size Pillow Covers | Double Bed with All Around Elastic ...,4.4,"45,499"
487,"Fun Homes Polyester Reversible 1 Seater Polyester Sofa Cover (HS_36_FUNHOMES018997, Brown and Ivory, Standard)",3.4,"45,399"
488,JY Microfiber Soft White Pillows16 x 24 Inches Or 40 x 60 cm Well-Filled Pillows for Sleeping(Set of 4),4..1,4599
489,"Jovial Creations 300TC Heavy Glace Cotton King Size Double Bedsheet with 2 Pillow Covers, Bedsheet for King Size Bed, Supe...",3.7,"45,999"
490,"MY BABY TOWN Floral Umbrella Design Blue Mosquito Net for Born Baby's, Kids",3.9,4599
491,Arena Zinc Alloy Chrome Finish Jaguar Designer Heavy Curtain Supports for Door and Window Curtain Brackets/Holders for 1 I...,4.3,"45,499"
492,"Kuber Industries Plastic AC Door Curtain, 1 mm 7 Feet, White, 1 Piece",3.8,"45,099"
493,"IDITRI EXPORT Cervical Contour Memory Foam Pillow for Sleeping,Orthopedic Pillow for Neck Pain, Support for Back,Stomach,S...",3.6,4599
494,"Ikea Paper Napkin, Dark Red, 40x40 cm (15 Â¾x15 Â¾), 50 Pcs",4.1,4599
495,"BRICK HOME Feather Printed Cotton Canvas Cushion Cover Set of 2, ( 12 x 18 Inches )",3.5,4599
496,CLUZE Microfiber Hand Wash Towel for Washbasin Rabbit Theme |wash Basin Hanging Hand Kitchen Towel Napkin Set of 2,4,4599
497,Chhaap Ultra Soft Pillows Cushion Filler (18x18 Inches White) for Set of 2(FFLR-02),3.6,4599
498,"ADOGO Dry Hair Towel 2 Pack,Microfiber Towel Cap Twist Wrap Absorbent Quickly Dry Hair Turban for Kids and Women (Pink+Pur...",4.6,4599
499,Trending Home Collection Cotton Fabric with Geometrical Chenille Manual Embroidery Stitched Zippered Lumbar Tassel Cushion...,4.3,4599
500,Cortina Pack of 8 Plain Dining Chairs Cover Stretchable Slipcover Seat Protector Removable 8pc Polycotton Dining Chairs Co...,4,"45,998"
501,Roseate Luxury Super Soft (40x60 cm) Microfibre Striped 2000 GSM Bath Mat Super Absorbent Anti Skid Mats for Bathroom/ Bed...,4.2,4599
502,Cambik Authentic Boho Style Organic Cotton Knitted odhne wali Chadar Cozy Lightweight AC Summer Blanket Khadi Khes - Rando...,4..1,"45,699"
503,"Kuber Industries Checkered PVC Rectangular Wardrobe Kitchen Drawer Shelf Mat 10 Mtr Roll(Multicolour), Polyvinyl Chloride",4.1,4599
504,"Onlymat Coir Doormat Long-Lasting, Heavy-Duty, Weather Resistant Entryway Rug Coco Coir with Vinyl Backing for Indoor & Co...",3.8,"45,100"
505,Khillayox Cotton Bath Gamcha Towel 400 GSM ( Set of 4 Pieces),4.1,4599
506,"YAMUNGA Polyester Anti Skid Backing Kitchen Mats Runner (Grey, 40 x 120 & 40 x 60 cm) -Set of 2",3.5,4599
507,RD TREND Eyelet Polyester 7 Feet Door Curtain Set of 2 - Solid (White),4.1,4599
508,Kuber Industries 4 Pieces Cotton Luxurious Pillow Cover|Ultra Soft Satin Striped Pillow Case|Breathable & Wrinkle Free (Wh...,3.4,4598
509,Home Decor Stainless Steel Curtain Rod Length: 5 feet Color: Silver Diameter: 25 mm,3.7,"45,200"
510,"Beybee Waterproof Bed Protector Dry Sheet Gifts Pack, Medium (Pack Of 2, Royal Blue/Maroon)",4.3,4525
511,"Trance Home Linen 200TC Diwan Set Cotton 6 Piece | Deewan Printed Bedsheet Sets (Set of 6 Pc,1 Bed Sheet 54x88 Inch | 2-Bo...",3.6,"45,499"
512,Status Polypropylene Door Mat (Pack of 2) - 58 cm x 38 cm (Blue Brown),4.1,"45,199"
513,Garden Of Arts Stainless Steel Set of 2 Tissue Paper Holder Useful for Office Kitchen Dining Table Travel,4.3,4599
514,Bombay Dyeing 104 GSM Microfiber Blue Double Bedsheet with 2 Pillow Covers,Get,"45,399"
515,"Kuber Industries Carpet|Water Absorption Kalamkari Paisley Pattern Floor Mat|Velvet Sitting Carpet for Hall, Living Room, ...",4.1,"45,399"
516,"YANCIÂ® Wiping Hands Apron, Adjustable Bib Waterproof Velvet Stitched Apron with Pockets Cooking Kitchen Chef Women Aprons ...",4.1,4599
517,"MEGA CART HOME Polypropylene Anti-Skid Rubber Door Mat, Rectangular, Grey",4.2,"45,299"
518,"Pix Art Satin Customized Anniversary Cushions for Couple - White, 12x12.",4.1,"45,050"
519,"HOKIPO PVC Set of 6 Dining Table Mats with Runner (AR2310), Polyvinyl Chloride",4.1,"45,399"
520,"OYO BABY Baby Blankets New Born Combo Pack of Super Soft Baby Wrapper Baby Sleeping Bag for Baby Boys, Baby Girls, Babies...",4.4,4575
521,"Suzec Silicone Pot Holder Heat Resistant, Oven Mitts Glove Cooking Pinch Grips Glove Hand Clip Convenient Pot Holder Kitch...",2.9,4599
522,Ferio Zinc Antique Brass Finish Heavy Curtain Supports for Door and Window Curtain Brackets/Holder Set for 1 Inch Rod (Pac...,4.4,"45,599"
523,"STITCHNEST Beige Geometrical Ikat Ethnic Printed Canvas Cotton Cushion Covers, Beige Set of 5 (12 X 12 Inches)",4.2,4599
524,"Bedspun - Double Bedsheets with 150 TC, Double - Queen Size Bedsheet & 2 Pillow Covers, Floral Pattern, Mustard",3.3,4599
525,Khillayox Microfiber Rico Large Size Bath Towel 400 GSM | for Men & Women Set of 1 (140x70 CM_Brown),3.7,4599
526,"Sleepwell Synthetic Pillow, Single, White, 2 Pieces",3.6,
527,"RajasthaniKart Pure Cotton 144 TC Single Size Bed Sheet with 1 Pillow Cover - Bedsheet for Single Bed (Black, Single Bedsh...",3.5,4529
528,"HOKIPO Faux Fur 18x18 Inch Pillow Cover Set of 2, White (AR-4532-WHT*2)",4.2,4599
529,"AmazonBasics Easy-Wash Microfiber Kid's Comforter and Pillow Cover Set (Pillow not included) - Single, Multi-Color Zoo Ani...",4.5,"45,700"
530,"HOMEMONDE Solid Sheer Curtain Set for Door 8 Feet, Faux Linen Textured Plain Sheer Door Curtain for Home Decor, Hangs Eleg...",4.1,"45,199"
531,"Onlymat Natural Coco Coir Black & Brown Tree Printed Anti-Slip with PVC Back Doormat for Indoor, Outdoor, Patio, Home and ...",4.4,"45,099"
532,"Urban Space 100% Cotton Curtains for Door, Set of 2 Curtains, Cotton Curtains with Stainless Steel Rings (Door- 7 feet x 5...",4.4,"45,499"
533,"Sleepwell Microfibre Pillow - 21X20X17 Cm, Pack Of 2, Multicolour(Microfiber)",3.9,"45,500"
534,"Tranquebar Curtain Co. Cotton Floral Curtains, Window (5 Feet), Grey, Lavender Pink, Set Of 2(Room Darkening;Back Tab;Wash...",4.5,"45,000"
535,Wytomah Satin Fabric Stripes Bedsheet Single Bed 60x90 inch with 1 Pillow Cover (Black),4..1,4599
536,"STITCHNEST Abstract Printed Cotton Canvas Rectangular Cushion Covers, Set of 2 (12 x 18 Inches)",3.9,4599
537,"abracadabra Cotton Head Shaping Mustard Seed Rai Pillow with Lavender Essential Oil (Size: 30 cm X 22 cm, 650 Grams, Bambi...",4.2,4599
538,Urbano Homz Dining Table Cover 4 Seater| 4 Seater Dining Table Cover | Dining Table Cover 4 Seater Cotton | Cotton Dining ...,4,4599
539,Story@home 120 TC Candy Motif Cotton Double Flat Bedsheet with 2 Pillow Cover - Blue & Yellow,3.6,4599
540,"Dormyo Junior Memory Foam Baby Crib Half Wedge Pillow for Acid Reflux, Anti Vomiting, Relieving Congestion, Scientific Hig...",4.1,"45,999"
541,Kuber Industries Wooden Flower Design PVC 6 Piece Dining Table Placemat Set with Tea Coasters (Brown)-CTKTC32178,3.5,4519
542,"FAPBADRI Plastic Curtain Rings for Windows Curtains, Door Curtains, Bathroom Curtains and Other Multipurpose Usage - Colou...",4.3,4500
543,"Napkins and Hand Towels-Set of 6 Cotton Napkin / Hand Towels ( 14 X 24 inch) 100 % Cotton , Multi Color",4,4500
544,"Kuber Industries Bolster Cover|Soft Bolster Pillow Cover For Bedroom, Living Room|Bolster Cover Set of 2|MAGENTA & GREY",4.2,4549
545,Status Contract 3 x 5 Feet Multi Printed Vintage Persian Carpet Rug Runner for Bedroom/Living Area/Home with Anti Slip Bac...,3.7,"45,999"
546,"SHAULA Curtain Rod Brackets No Drilling, Self Adhesive White Sticky Wall Hooks for Nail Free Adjustable Curtain Rod Bracke...",4..1,4599
547,Soniasaa Prime Collection 222 TC Soft Cotton-Blend Pillow Covers 10 Pieces 17 x27 Inches(Standard Size) for Home and Hotel...,1,"45,526"
548,Fresh From Loom Velvet Abstract Design Single Bedsheet Size - 58x90 inch Maroon with 1 Pillow Covers,3.8,"45,999"
549,Salona Bichona 100% Cotton Green 120 TC Bolster Cover (Set of 2),3.6,4599
550,"AAZEEM Floral Heavy Net 5 Seater Sofa Cover Set -1 Long Back & 1 Long Seat Cover for 3 Seater Sofa, 2 Back & 2 seat Covers...",5,"45,999"
551,"FOVERA Foot Rest Memory Foam Under Desk Pillow Ergonomic Raindrop Design - Removable Cover with Anti-Skid Bottom (Medium, ...",4.3,"45,590"
552,"Saral Home Easy Living Cotton Shaggy Anti-Skid Bath Mat (Turquoise, 40X60 CM)",4,4599
553,"Zesture Home Luxurious Jacquard Weaved Checkered Bricks Design 6 Piece Protective Sofa Cover and Chair Cover Set,slipcove...",3.8,"45,199"
554,CANWAY Â® Soft Silicone 3.5 mm Bathroom Mat Water Soaking Diatomite Door Mat Anti-Slip Bath Mat Quick Drying Absorbent Mat ...,5,4599
555,"GOYTEX Premium Polyester Door Curtains 7 feet Long Set of 3 (Aqua Blue, 4 feet x 7 feet)",4.1,"45,099"
556,Hn'K Doilies Paper for Platter Decoration | Doyley Paper(Pack of 100) |Lace Doileys Paper Reactangle Decorative Paper Plac...,4.4,4599
557,Sharma Clothing Pure Soft Cotton Baby Boys and Baby Girls 3 in 1 Multi Usage Sleeping Bag and Carry Bag and Bed kam/Baby O...,4.1,4599
558,Home Tex Life Printed Folding Kora Grass Foam Cotton Mat (2 X 6 ft),3.8,"45,119"
559,"Velve Bath Towel | Made from 100% Bamboo Fiber | Dyed Using Certified Non-Toxic Colors | Ultra Soft, Absorbent, Light Weig...",4.6,4599
560,"SRP Craft Cotton Needlework Fabric,100% Cotton Monks Cloth for Punch Needle,Embroidery Rug Punch Needle Cloth,Tufting Gun ...",4.5,4550
561,"Styleys Polyester Geometric Washable Elastic Dining Chair Cover Slipcovers (Set of 6, Black Square Prism, SLMC175)",4.1,"45,999"
562,"Syga Bed Rail Guard for Baby/Kids Safety, Portable & Foldable for King/Queen Size Bed - (200 CM)",4.3,"45,000"
563,Kuber Industries Microfiber Square Chair Pad/Cushion for Office|Home or Car Sitting|Size 45 x 45 x 7 CM|Pack of 2 (Brown),3.7,4599
564,Amazon Brand â€?Umi Super Soft Brushed Microfiber Cotton bedsheet with 1 Pillow Cover - Printed Single Bedsheet (60x90(Inches),3.8,4599
565,"Infantbond Baby's Plastic, Cotton Super Soft Bed Mattress with Net Bedding Set (Star & Moon Grey, 0-6 Months)",3.9,4599
566,"Amazon Brand - Solimo Lily Bloom 144 TC 100% Cotton King Size Bedsheet with 2 Pillow Covers, Green",4.5,"45,000"
567,Sharda Velvet Home Decor Export Quality Anti-Skid Washable Kitchen Home Living Office Entrance Area Runner Floor Kitchen S...,3.9,"45,649"
568,Tabletext Rectangular PVC Woven Vinyl Washable Heat and Stain Resistant Dining Table Placemats for Home Restaurant Party D...,4.3,4599
569,"SATYAM SATYAM Mackintosh Rubber Sheet /Macintosh Rubber Sheet Ideal for Baby/Adult Beds, for Labor Rooms, Hospital Rooms. ...",4,4599
570,Huesland by Ahmedabad Cotton 144 TC Cotton Bedsheet for Double Bed with 2 Pillow Covers - Turquoise,4.1,4595
571,"Divine Casa Microfibre Mild Winter 110 GSM Reversible Single Bed Quilt Comforter Blanket - (Black and Grey, Abstract)",4.3,"45,999"
572,Kuber Industries Multicheck Printed PVC Anti Slip Skid Shelf Mat|Water Proof DustProof||5 MTR Roll & Easy to Cut|Size 500 ...,3.9,4599
573,Kuber Industries Silky Soft Microfiber Disney Printed Toddler Kids Pillow|Size 12 x18 inch|Pack of 2 (Sky Blue & Pink)-KUB...,3.7,4599
574,"AMRO Beautility Needs Online Mat And Home Decor Store Pvc Heavy Quality Thick Doormat For Outdoor, Home, Offices -12Mm Thi...",3.9,4599
575,"BSB HOME Cotton Bedsheets Combo Set of 7 Double Bedsheets with 14 Pillow Cover, Multicolour,Floral",3.3,"45,699"
576,"Kuber Industries Bed Server|PVC Rose Floral & Lines Print Both Sided Food Mat|Waterproof Mattress Protector, 35x35 Inch (M...",4.2,4599
577,BLOCKS OF INDIA Cotton Duvet / Quilt / Comforter / RAJAI Cover (Twin),4.1,"45,199"
578,MY NEWBORN Designer Baby AC Blanket -Pack of 1 (White Unicorn) | Sleeping Bag | New Born Wrapper | 0-12 Months | Skin-Frie...,4,4500
579,"Manan high Density Kitchen Napkin, Kitchen Towel in Pure Cotton 50x50cm (Pack of 6, Multicolour)",3.8,4500
580,"AmazonBasics Microfiber Sheet Set - (Includes 1 bedsheet, 1 Fitted Sheet with Elastic, 2 Pillow Covers) King, Light Grey",4.1,"45,000"
581,"MORADOÂ® Premium Glace Cotton Cartoon Print 130 GSM Double Bedsheet with 2 King Size Pillow Covers (90X100 Inch, Off White)",3.9,4599
582,Kuber Industries Cotton Flower Design Shining 4 Seater Center Table Cover|Waterproof/OilProof|Size 150 x 100 x 1 CM (Gold)...,4,4549
583,LORETO 180 TC Cotton King Bedsheet with 2 Pillow Covers - White & Grey,3.8,"45,999"
584,"Hair Cutting Waterproof Apron (Salon, Parlour, Barber, spa Unisex) for Women, Men (Color Black) Free Size",3.9,4522
585,"IF INDUSTRIES Super Plastic Chatai Mat (Multicolour, 6 x 9)",3.8,4599
586,Tribecca 100% Cotton 2 Piece 500 GSM Large Cotton Bath Towel Set :: 140 x 70 cm (Grey Grey),4.3,"45,499"
587,"HOKIPO PVC Extra Large Waterproof Picnic Mat for Beach, Garden, Yoga, Indoors, 6.5x6.5 Feet, Floral Blue (AR3921)",3.7,"45,799"
588,KANAHIYA Traders Foldable Mosquito Net Flexible for Single Bed Blue for Baby and Adult Protection,3.1,"45,099"
589,BzcartsÂ® Best Range Collection Stainless Steel Glossy Matte Series Curtain Bracket Support 10 Set Door and Window Fitting ...,4,"45,499"
590,"Aspire Cotton Turbie Towel (Pack of 2, Maroon & Navy Blue)",4.1,4599
591,"haus & kinder 100% Cotton Reversible Dohar Double Bed, Soft Lightweight Bed Blanket, AC Dohar Blanket for Summers/Winter (...",4.7,"45,999"
592,Stylista Center Transparent Table Cover Round Shaped WxL 30x30 inches 0.15 mm Thickness with White Lace,3.4,4539
593,Stylista Transparent Waterproof Table Cover 4 Seater 40x60 inches .25mm Thick with Golden Border Laces,4,4599
594,"Dreamfactory Knitted Fabric Fiber Pillow (27 x 17"", White) -Set of 2",4.1,"45,999"
595,Toddylon New Born Baby Bedding Set Mattress with Net & Sleeping Bag Combo (0-6 Months) Blue,4.1,"45,199"
596,Cortina Computer Desk Seat Covers | Stretchable Elastic Polyester Spandex Cover | Removable Revolving Chair Protector | Of...,3.7,4598
597,Cazimo Soft 100% Cotton Throws for Sofa - 50 * 60 inches (Wine),4,"45,299"
598,Milano Home Kids Denim Apron with Pockets Apron for Girls Boys Bag for Cooking Baking Art Painting Adjustable Fit Machine ...,4.6,"45,200"
599,JAW Beautiful Digital Printed Grommet Window Curtain for Kidâ€™s Room/ Classroom/ Activity Room Panel Curtains. Light Blocki...,4.3,"45,199"
600,"The White Willow Memory Foam Small Size Travel Lumbar Back Support Chair Cushion Pillow for Car, Airplane , Long Drive wit...",3.9,"45,699"
601,"JMAM 2 PCS Self Adhesive Curtain Holders Brackets Without Drilling, Curtain Rod Bracket, Adhesive Curtain Rod Holder Hook...",3.7,4599
602,"HEAVY DRIVERÂ® Elastic Chair Armrest Covers Office Chair Elbow Arm Rest Protector Coffee,",4,"45,499"
603,R for Rabbit Stretchable and Washable Safeguard Baby Bed Rails Single Side Bed for Kids (Blue),3.9,"45,996"
604,"Fab Theory Origami 144 TC 100% Cotton Double Bedsheet with 2 Pillow Covers, Blue",4.2,"45,200"
605,Yellow Weaves Cotton Placemat - Green (14 X 19 Inches) - 6 Pieces,4.3,4548
606,"Hesch 9 Pack of 25 Ivory Cream Colour Curtain Rings with Hook for Door Curtains, Windows Curtains, Bathroom Curtains, and ...",3.9,4523
607,Keniro Hair Towel Wrap Absorbent Towel Hair-Drying Quick Dry Shower Caps Bathrobe Magic Hair Warp Towel Super Quick-Drying...,3.9,4599
608,"Voix Grilling Gloves, Heat Resistant Gloves BBQ Kitchen Silicone Oven Mitts, Long Waterproof Non-Slip Potholder for Barbec...",3.8,"45,999"
609,"Clary Cotton Bath Towel for Men & Women 250 GSM, Ultra Soft, Absorbent & Quick Dry Towel for Bath, Beach, Pool, Travel, Sp...",3.5,4599
610,"House of Quirk Stretch Recliner Covers, Jacquard Recliner Chair Slipcovers, Polyester Furniture Cover Recliner Sofa Couch ...",4.3,"45,499"
611,Digital Print 5 PCS Set Cushion Cover,4..1,4599
612,"Encasa Homes Fabric by The Metre - Mercerised Dyed Cotton Canvas 100 x 140 cm Width, Natural",3.9,4500
613,Store2508 Microfiber Reversible Dish Drying Mat (Pack of 2) (38 * 51 Cm Each) (Darkgrey),4.4,"45,250"
614,"PINKS & BLUES Full Sleeping 5 Piece Baby Bedding Set with Two Bear Shape Side Pillows (0-48 Months, Camel Chocolate, Smal...",4.5,"45,999"
615,Wesofy Satin Silk Pillow Covers for Hair and Skin-with Satin Scrunchies for Women Stylish|Satin Pillow coves for Hair and ...,4.3,"45,699"
616,ROYAL TREND Door Mat Rugs for Home & Kitchen| Half Sunflower Shape| Bath mat| Pink Color ( 16 X 34 Inches ),3.1,4599
617,"STITCHNEST Vintage Printed Jute Cushion Covers, Set of 5 ( 18 X 18 Inches )",3.6,4599
618,Radhey Exclusive 500 TC Velvet Floral Sofa Cover with Arm for 5 Seater Sofa (Brown) - Set of 16 Pieces,3.7,"45,999"
619,"Cambik Unstitched Plain Cotton Fabric Material for Home Decor, Furnishing, Upholstery, Curtains, Cushions, Pillow and Craf...",4,4599
620,Bella Cotton Wool - 100 g (Pack of 3),4.3,4585
621,"Highly Absorbent Microfiber Printed Hanging Hand/Kitchen, Towel/Napkin with Loop/Tie (Pack of 3), 250 GSM",3.9,4599
622,"BONA SORT PVC Polyvinyl Chloride Waterproof Bed Sheet , Plastic Sheet, Mattress Protector Cover for Babies Kids Girl and A...",3.2,4549
623,"100% Muslin Cotton 4 Layer Baby Quilt | Baby Duvet for Newborn to 5 Years, Soft Dream Blanket, Baby Blankets for Girls & B...",4.6,4599
624,Encasa Homes 4 pcs Chair Cushions 40x40 cm - Rich Maroon - Dyed Canvas Square Seat Cushions with Thick Cotton Filler & Tie...,3.9,"45,200"
625,PRAKARTIK BY INDUARTS 100% Cotton Nature Retreat Rectangular Dining Table mat. Multicolor Set of 4,4.3,4566
626,"Indigifts Satin 200TC Cushion Cover with Filler , 12x12 Inch, Multicolour, Cushion Cover",4.3,4599
