Name,Price,Category,image
STARDOM MART Lord Buddha Smoke Back Flow Cone Incense Holder (Blue) / Fog Fountain Buddha Decorative 15 Smoke Backflow Con...,4849,Home Furnishing,https://m.media-amazon.com/images/I/51eZPktmEOL._AC_UL320_.jpg
"Royals Plastic Office Desk Clock (Digital Clock 1826), Black",4899,Home Furnishing,https://m.media-amazon.com/images/I/31WMP4TrRhL._AC_UL320_.jpg
"Best Californian White Sage 4 Incense Sticks (100% Pure, 6 Inches, 28-33 Grams Each) Used for Home Cleansing, Removing Neg...",4899,Home Furnishing,https://m.media-amazon.com/images/I/918PBwj-0mL._AC_UL320_.jpg
Ajanta Quartz Digital Red Led Rectangle Wall Clock Olc - 40 (33 Cm X 16 Cm X 3 Cm)(Glass),"48,290",Home Furnishing,https://m.media-amazon.com/images/I/41KthgaeagL._AC_UL320_.jpg
"RIANZ Unicorn Alarm Clock for Girls Kids, Cute Bedroom Decoration, Non Ticking Silent Second Hand, w/Backlight Super Loud ...",4895,Home Furnishing,https://m.media-amazon.com/images/I/61JKRNWdnSL._AC_UL320_.jpg
Jtku Handicraft Book Stand Cover Case Wooden Rehal Holy Quran Bible Gita Office Home Decor Furniture 10 inch Lenght for Ch...,4866,Home Furnishing,https://m.media-amazon.com/images/I/71rw32qy3ZL._AC_UL320_.jpg
"Aarushi Creations Personalised Acrylic Laser Cut Home/Door Name Plate with Lighting (16 X 8 Inch, White)","48,399",Home Furnishing,https://m.media-amazon.com/images/I/81JaULC13+L._AC_UL320_.jpg
HRIDAY Metal Abstract Wall Art Iron Wall Hanging Home Decoration Perfect for Living Room/Hotel/Restaurant/Bedroom/Drawing ...,"48,999",Home Furnishing,https://m.media-amazon.com/images/I/612s5ROPpNL._AC_UL320_.jpg
TenorArts Lionel Messi Poster Argentina World cup 2022 Moment Laminated Poster Framed Painting with Matt Finish Black Fram...,4899,Home Furnishing,https://m.media-amazon.com/images/I/51EDmie8UZL._AC_UL320_.jpg
Aarushi Creations Acrylic Personalized Home Door Name Plate Acrylic with Acrylic Embossed Letters with Mirror Shine (Size ...,"48,000",Home Furnishing,https://m.media-amazon.com/images/I/71KpmNmRZ9L._AC_UL320_.jpg
"KBZONE Multipurpose Ceramic Kapoor Dani Fragnance Night lamp Electric Incense Burner, Aroma Oil Burner with Night Lamp, Ar...",4899,Home Furnishing,https://m.media-amazon.com/images/I/61VPgSEZrxL._AC_UL320_.jpg
"Stoveorama Digital Led Alarm Clock, Mirror Clock for Heavy Sleepers Kids Large Led Display with Snooze Time Temperature Fu...",4899,Home Furnishing,https://m.media-amazon.com/images/I/31Aay5tX3WS._AC_UL320_.jpg
"Gypsy Sandalwood Air Freshener Sachets ?Pack of 10 Perfume Sachet - 10 Grams Each|Fresh Fragrance for Your Wardrobe, Cupb...",4850,Home Furnishing,https://m.media-amazon.com/images/W/IMAGERENDERING_521856-T1/images/I/81P3ZTMSeqL._AC_UL320_.jpg
"Artvibes Motivational Quote Wall Hanger for Home|Office|Living Room|Gift, Wall Decoration (WH_4406N)",4899,Home Furnishing,https://m.media-amazon.com/images/W/IMAGERENDERING_521856-T1/images/I/81hRlfjIAjL._AC_UL320_.jpg
"Pure Source India Ceramic Electric Oil Diffuser, with Lemon Grass, 1 Piece, Off-White",4899,Home Furnishing,https://m.media-amazon.com/images/W/IMAGERENDERING_521856-T1/images/I/71ywCPjYMZL._AC_UL320_.jpg
"Auromin Stylish Wooden Wall Clock for Home Decor, Unique Design Modern Big Size Wall Watch for Living Room, Bedroom, Offic...","48,499",Home Furnishing,https://m.media-amazon.com/images/W/IMAGERENDERING_521856-T1/images/I/515-+MJKNwL._AC_UL320_.jpg
King International Stainless Steel Silver Table Top 3 Side Cut Ash Tray Large 12 cm,4899,Home Furnishing,https://m.media-amazon.com/images/W/IMAGERENDERING_521856-T1/images/I/41R25JZPFSL._AC_UL320_.jpg
Artvibes Cooking Quotes Designer Wooden Wall Hanging for Home Decor | Gifts | Wall Decoration Items for Kitchen | Decorati...,4899,Home Furnishing,https://m.media-amazon.com/images/W/IMAGERENDERING_521856-T1/images/I/61IoA5hppcL._AC_UL320_.jpg
"Stuthi Arts Brown Decorative Wall Mirror Decorative Mirror (Rectangle) Size- 13.4 in. X 10 in (Rectangular,Framed)","48,199",Home Furnishing,https://m.media-amazon.com/images/W/IMAGERENDERING_521856-T1/images/I/61lCbxQ86HL._AC_UL320_.jpg
Rangoli Design PVC Stickers Waterproof Laminated Wall Stickers Stylish Kitchen Art 70or50 cm Size Pack of 1,4899,Home Furnishing,https://m.media-amazon.com/images/W/IMAGERENDERING_521856-T1/images/I/61Z6xo3rD+L._AC_UL320_.jpg
"Art Street Set of 2 Table Photo Frames, Tabletop Picture Frames for Office & Home - 4X6 Inchs- White","48,299",Home Furnishing,https://m.media-amazon.com/images/W/IMAGERENDERING_521856-T1/images/I/617E2XkHKlL._AC_UL320_.jpg
TIED RIBBONS Birthday Wedding Anniversary Gift for Girlfriend Boyfriend Wife Husband Him Her - Special (Heart Shape Teddy ...,4899,Home Furnishing,https://m.media-amazon.com/images/W/IMAGERENDERING_521856-T1/images/I/81RENfrRayL._AC_UL320_.jpg
"PRINTNET Pack of 77 BTS Band Members Photocards collection, HD+ Quality, Multicolour, (4.4 X 3 Inch)",4899,Home Furnishing,https://m.media-amazon.com/images/W/IMAGERENDERING_521856-T1/images/I/91eaVQaL2nL._AC_UL320_.jpg
"Parag Fragrances 5 in 1 Real Dhoop Sticks 250gm (Sandalwood, Rose, Amber, Guggal and Aqua) ",4800,Home Furnishing,https://m.media-amazon.com/images/W/IMAGERENDERING_521856-T1/images/I/914gFveoYML._AC_UL320_.jpg
Art Street Decorative Wall Mirror Block Design Brown Set of 3 Square Shape Mirror for Home Decoration & Wall Decoration- S...,"48,600",Home Furnishing,https://m.media-amazon.com/images/W/IMAGERENDERING_521856-T1/images/I/61Ubn8ffxBL._AC_UL320_.jpg
"PAPERI Hanging Artificial Plant With Plastic Pot For Indoor/Outdoor Home Decor (Green,Pack Of 1)",4850,Home Furnishing,https://m.media-amazon.com/images/W/IMAGERENDERING_521856-T1/images/I/71apoElAjAL._AC_UL320_.jpg
"SWASUM Superhero's Motivational and Inspirational Quotes Wall Posters, (Iron Man, Batman, Dead Pool, Superman, Spiderman, ...",4899,Home Furnishing,https://m.media-amazon.com/images/W/IMAGERENDERING_521856-T1/images/I/71AK5zDd5wL._AC_UL320_.jpg
TIED RIBBONS Lord Shiva Statue Figurine Blessing Idol Sculpture Murti Decorative for Home Bedroom Pooja Room Office Table ...,"48,899",Home Furnishing,https://m.media-amazon.com/images/W/IMAGERENDERING_521856-T1/images/I/81pBGy38txL._AC_UL320_.jpg
BeautifulWalls Artificial Wall Grass for Home Decoration (1 Pc) I Grass Mat for Wall I Vertical Garden Artificial Wall Pla...,4837,Home Furnishing,https://m.media-amazon.com/images/W/IMAGERENDERING_521856-T1/images/I/61RI7BPyRMS._AC_UL320_.jpg
"SAPPHIRE INDIA Retro Style Twin Bell Alarm Clock with Classic Tick-Tock Sound, Night Light, and Battery Operation, Black","48,299",Home Furnishing,https://m.media-amazon.com/images/W/IMAGERENDERING_521856-T1/images/I/61XQ+mI40oL._AC_UL320_.jpg
Stuthi Arts Wall Wood Photo Frames White-A4-(4),4899,Home Furnishing,https://m.media-amazon.com/images/W/IMAGERENDERING_521856-T1/images/I/51CiW9t8yOL._AC_UL320_.jpg
"ILU  Feathers Dream Catcher with Lights, Wall Hangings, Crafts, Home Decor, Handmade for Bedroom, Balcony, Garden, Party,...",4899,Home Furnishing,https://m.media-amazon.com/images/W/IMAGERENDERING_521856-T1/images/I/81W24OwY5pS._AC_UL320_.jpg
"ACS MART vastu pyramid for home positive energy plastic white 4.5"" 91 Pyramid (81+9+1)",4899,Home Furnishing,https://m.media-amazon.com/images/W/IMAGERENDERING_521856-T1/images/I/213jeZ0l09L._AC_UL320_.jpg
Naayaab Craft Pakka Sheesham Wood Agarbatti Incense Stick BoX And Dhoop Stand Ash Catcher Decorative Handicraft Incense Ho...,4899,Home Furnishing,https://m.media-amazon.com/images/W/IMAGERENDERING_521856-T1/images/I/61xKzqPE3lL._AC_UL320_.jpg
"ToyKraft GelWaX Candle Making, DIY Candle Making Kit for Kids, Art and Craft Activity Kit for 8 Years to Adults ( Pack of 1)",4849,Home Furnishing,https://m.media-amazon.com/images/W/IMAGERENDERING_521856-T1/images/I/61Ka+lJfUjL._AC_UL320_.jpg
Vridhi Enterprises Ferrite Ring Magnet/Ceramic Magnet with 17.5mm O.D. X 7.5mm I.D. X 3mm Thickness with 1 Ns Coin- 40 Pcs,4800,Home Furnishing,https://m.media-amazon.com/images/W/IMAGERENDERING_521856-T1/images/I/21E3SEcqhkL._AC_UL320_.jpg
"Colossal Art House Leaf Framed Poster Large Wall Painting for Living Room, Bedroom and Office Wall Decoration Frame (13X17...",4899,Home Furnishing,https://m.media-amazon.com/images/W/IMAGERENDERING_521856-T1/images/I/617UIoaTrsS._AC_UL320_.jpg
Chocozone Couple Hug Resin Showpiece Couple Miniatures Romantic Gifts for Girlfriend (Hug & Propose Combo) Multicolor,4899,Home Furnishing,https://m.media-amazon.com/images/W/IMAGERENDERING_521856-T1/images/I/91HJRCO8hVL._AC_UL320_.jpg
"Seven Chakra Crystals and Gemstones, Seven Chakra Crystal Tree Showpiece for Good Luck Home Decor Item Bonsai Money Tree P...","48,450",Home Furnishing,https://m.media-amazon.com/images/W/IMAGERENDERING_521856-T1/images/I/71RTfCc8U7L._AC_UL320_.jpg
"PILIFE Loud Alarm Clock,4 inches Non-Ticking Analog Twin Bell Alarm Clock with Backlight,No Snooze,Battery Operated for He...",4899,Home Furnishing,https://m.media-amazon.com/images/W/IMAGERENDERING_521856-T1/images/I/71XjImp7IjL._AC_UL320_.jpg
"Craft Village Personalised name trunk (10X7X3.5) (Baby Pink) engineered wood, Rectangular","48,574",Home Furnishing,https://m.media-amazon.com/images/W/IMAGERENDERING_521856-T1/images/I/81IV69DYgJL._AC_UL320_.jpg
Collectible India Diwali Diya Crystal Round Akhand Diya for Puja Brass Small Kamal Deep Jyoti Oil Lamp for Home Temple Poo...,"48,999",Home Furnishing,https://m.media-amazon.com/images/W/IMAGERENDERING_521856-T1/images/I/71lflIcyL+S._AC_UL320_.jpg
"Artizen Essential Oils (Lavender Flavour) Pure Essential Oils Set for Diffuser, Humidifier, Massage, Aromatherapy (30ML. P...",4875,Home Furnishing,https://m.media-amazon.com/images/W/IMAGERENDERING_521856-T1/images/I/71teU001CSL._AC_UL320_.jpg
Pure Source India Natural Wood Bote Shape Incense Holder and Ash Catcher (11 X 3 Inch),4851,Home Furnishing,https://m.media-amazon.com/images/W/IMAGERENDERING_521856-T1/images/I/619VovwN-BL._AC_UL320_.jpg
Trophies TMW for Student Collage Institute Events Award Trophy Gift Home and Office Decoration,4800,Home Furnishing,https://m.media-amazon.com/images/W/IMAGERENDERING_521856-T1/images/I/71dqkQw6rRS._AC_UL320_.jpg
Herbal Strategi ?NatureSpray Lavender | Room Freshener |Lavender Aromatic Fragrance | Disinfectant | Completely Herbal |E...,4822,Home Furnishing,https://m.media-amazon.com/images/W/IMAGERENDERING_521856-T1/images/I/41CxBxSVr2L._AC_UL320_.jpg
Aarushi Creations Wood Personalised Home Door Name Plate Wooden with Golden Acrylic Embossed Letters with Mirror Shine (Si...,"48,800",Home Furnishing,https://m.media-amazon.com/images/W/IMAGERENDERING_521856-T1/images/I/911ftY+CdzL._AC_UL320_.jpg
"pranjals house Metallic Brass Surya Dev Home Decor, Designer Wall Hanging Decoration Sculpture for Living Room| Bedroom| H...",4899,Home Furnishing,https://m.media-amazon.com/images/W/IMAGERENDERING_521856-T1/images/I/81LKOx+PwrL._AC_UL320_.jpg
"Aromahpure Scented Candles (75 hours) (100% Natural WaX )- Handcrafted | Smoke-Free | Joyful lavender, Citrus Grove, Earth...",4819,Home Furnishing,https://m.media-amazon.com/images/W/IMAGERENDERING_521856-T1/images/I/81Zmp8gIhfL._AC_UL320_.jpg
Atulya Arts Offering- 100 Pieces (3 cm Each) Square Mirrors Golden Wall Stickers 3D Acrylic Sticker Decorative Stickers fo...,4899,Home Furnishing,https://m.media-amazon.com/images/W/IMAGERENDERING_521856-T1/images/I/51mNNWcBH3L._AC_UL320_.jpg
S2S Mango Leaves and Flowers Decoration at Home | Easy Simple Backdrop Pack of 12 Pcs (Yellow Flowers),4899,Home Furnishing,https://m.media-amazon.com/images/W/IMAGERENDERING_521856-T1/images/I/71Xb7B+rs7L._AC_UL320_.jpg
Tusmad HTC-2 Plastic Digital Indoor Cum Outdoor Thermo-hygrometer with Temperature Humidity Meter Tester Multiprose (White),"48,299",Home Furnishing,https://m.media-amazon.com/images/W/IMAGERENDERING_521856-T1/images/I/510xbgZW8HL._AC_UL320_.jpg
"Rangoli Vinyl Modern Art Wall Sticker 1.96 X 20.86 X 1.96 Inches, Multicolour (Model Number: Modern Art472),",4899,Home Furnishing,https://m.media-amazon.com/images/W/IMAGERENDERING_521856-T1/images/I/61NJjillgZL._AC_UL320_.jpg
"VITARA Handicraft Wooden Open Rectangular Incense Stick /Agarbatti Holder Stand/Ash Collector Ideal for Home,Office,Templ...",4899,Home Furnishing,https://m.media-amazon.com/images/W/IMAGERENDERING_521856-T1/images/I/51RQn+VC4US._AC_UL320_.jpg
"RJKART Polyresin Handcrafted Cute Child Monk Showpiece Laughing Baby Buddha Set of 1, Multicolor","48,599",Home Furnishing,https://m.media-amazon.com/images/W/IMAGERENDERING_521856-T1/images/I/71me4wHcHHL._AC_UL320_.jpg
"LADECOR Sunboard Religious Split Panel Painting, Multicolor, Printed, 27 X 50 inches","48,900",Home Furnishing,https://m.media-amazon.com/images/W/IMAGERENDERING_521856-T1/images/I/71HvnvGmlML._AC_UL320_.jpg
"Rangoli Making Tools Kit Set of 12 Rangoli Color Powder Bottle Rangoli Making Stencil Set of 3 Rangoli Fillers Stamp, Fill...",4899,Home Furnishing,https://m.media-amazon.com/images/W/IMAGERENDERING_521856-T1/images/I/61oTtaiY98L._AC_UL320_.jpg
"Painting Mantra Floral & Bird Framed Painting / Posters for Room Decoration , Set of 4 Black Frame Art Prints / Posters fo...","48,500",Home Furnishing,https://m.media-amazon.com/images/W/IMAGERENDERING_521856-T1/images/I/71KL7MSuglL._AC_UL320_.jpg
"BS AMOR Dream Catcher Car Hanging White~ Handmade Hanging Wall Hangings, Garden, Car, Outdoor, Bedroom Pack of 1",4899,Home Furnishing,https://m.media-amazon.com/images/W/IMAGERENDERING_521856-T1/images/I/61DqpZBi5ZL._AC_UL320_.jpg
Jelly Bubbles / Water Jelly Beads Soil Jelly Water Balls Magic Crystal Rubber Jelly Beads 100 Grams,4899,Home Furnishing,https://m.media-amazon.com/images/W/IMAGERENDERING_521856-T1/images/I/71wl+dA-aVL._AC_UL320_.jpg
"eCraftIndia 'Golden Bal Gopal Krishna Having Makhan' Decorative Showpiece (Metal, 8 cm X 9 cm, Golden, AGK507)","48,499",Home Furnishing,https://m.media-amazon.com/images/I/71PZHLOiUIL._AC_UL320_.jpg
Indianara 3 Piece Set of Framed Wall Hanging Welcome Home Decor Art (1193) Prints 8.7 inch X 8.7 inch Without Glass-Multic...,"48,200",Home Furnishing,https://m.media-amazon.com/images/I/91BTtBo240L._AC_UL320_.jpg
"CSN - CUTE SHOPPING NETWORK Natraj Series Photo Album with EXtra Clear PVC Film 200 Photos, (Photo Size Supported: 4X6 Inc...",4899,Home Furnishing,https://m.media-amazon.com/images/I/61bOngqbfUL._AC_UL320_.jpg
"ARTISKRITI Evil Eye Hanging for Home Entrance House Door Decoration, Hamsa Hand Nazar Battu for Home Protection, Good Luck...","48,495",Home Furnishing,https://m.media-amazon.com/images/I/71iRMw6Ca4L._AC_UL320_.jpg
"Homesoul Beautiful Plastic Flower Vase for Decoration of Your Home Decorate & Office Room, Pair of 2 (PT-03) Pastel Green",4899,Home Furnishing,https://m.media-amazon.com/images/I/51m81jQudqL._AC_UL320_.jpg
BS AMOR Fancy Artificial Flowers Bouquet Home Wedding Decoration 'Living Room' Dining Table Decor Vase Bunch Vibrant Color...,4899,Home Furnishing,https://m.media-amazon.com/images/I/71Abl9RjfpL._AC_UL320_.jpg
Rangoli Large Wall Sticker Multicolor Vinyl 50 or 70 CM Pack of 1,4899,Home Furnishing,https://m.media-amazon.com/images/I/71f3HeTCWUL._AC_UL320_.jpg
"HOMELOOK-Garden and Outdoor Incense Sticks Citronella, Lemongrass 20 Mosquito Repellent 16 Inch Long and 10mm Thick Pure C...",4899,Home Furnishing,https://m.media-amazon.com/images/I/71MozpBkA0L._AC_UL320_.jpg
"International Gift Silver Finish LaXmi Ganesh Sarswati God Idol With Beautiful Velvet BoX EXclusive Gift For Diwali, Corpo...","48,400",Home Furnishing,https://m.media-amazon.com/images/I/71BXcuY1gOL._AC_UL320_.jpg
A&S Ventures Smoke Fountain Lord Shiva Adiyogi Statue Cone Incense Holder Showpiece with 10 Free Smoke Backflow for Templ...,4899,Home Furnishing,https://m.media-amazon.com/images/I/4171v3KtuML._AC_UL320_.jpg
"R Enterprise Vastu Poster'' 7 Horses Running River beautiful Wall poster, Wall Painting, Home Decor, Office Decor Art (12 ...",4899,Home Furnishing,https://m.media-amazon.com/images/I/61jhVf5wOcL._AC_UL320_.jpg
"999STORE Lord Buddha Painting Blessing with flowers nature with Frame for Living Room buddha wall painting (76X130 cms, Go...","48,999",Home Furnishing,https://m.media-amazon.com/images/I/71IlM9CRfSS._AC_UL320_.jpg
"LWVAX Artificial Flower Plants Dracaena Potted Plant with Black Pot Fake Bonsai Flower for Home, Office, Indoor and Outdoo...","48,899",Home Furnishing,https://m.media-amazon.com/images/I/51H7-56s+2L._AC_UL320_.jpg
"Decordial lippan Art Materials DIY kit with 2 Round MDF Board (1 pcs lippan Art Clay, 2 pcs lippan Art Board, lippan Art M...","48,999",Home Furnishing,https://m.media-amazon.com/images/I/8102r23AKPL._AC_UL320_.jpg
SPHINX Artificial Marigold Fluffy Flowers with Bell and Tuberoses (Rajnigandha) Clustered Garlands Strings for Festive Poo...,"48,299",Home Furnishing,https://m.media-amazon.com/images/I/61cMAwFuKPL._AC_UL320_.jpg
"La Jarden Aum printed on silky satin fabric in Saffron (kesariya), Orange color flag for Yoga, Meditation, Om shanti bhaw...",4889,Home Furnishing,https://m.media-amazon.com/images/I/71ywC4MU7EL._AC_UL320_.jpg
"JK International Himalaya Erina Ep 450ml Fragrance Lemon, orange",4845,Home Furnishing,https://m.media-amazon.com/images/I/31YAEUWFZhL._AC_UL320_.jpg
SPHINX Artificial Jasmine Buds & Rose Strings for Decoration ApproX 2.5 ft/30 Inches (Off White) - Number of Strings- (6),4899,Home Furnishing,https://m.media-amazon.com/images/I/91C8rTlvfGL._AC_UL320_.jpg
"Tej Gifts Stone Nandi Idol, Handcrafted Matt Finish Shiva's Cow Statue for Temple Puja/Home, Nandi Pindi Showpiece, Ideal ...",4899,Home Furnishing,https://m.media-amazon.com/images/I/518rET+hocL._AC_UL320_.jpg
"UAPAN Brass Hanging Bells (Shubh_Labh, Gold)",4899,Home Furnishing,https://m.media-amazon.com/images/I/51rVs+Ww+9L._AC_UL320_.jpg
god & god's Large Wall Sticker JUST Peel & Stick Size 50 or 60 cm Pack of 1 (Code GS183,4899,Home Furnishing,https://m.media-amazon.com/images/I/61FXMSfwiXL._AC_UL320_.jpg
"Sheer Veda Clove Essential Oil 100% Pure, Natural and Undiluted for Skin, Hair and teeth (15 ML)",4809,Home Furnishing,https://m.media-amazon.com/images/I/61cF1Oh-XiL._AC_UL320_.jpg
Plus Value Wealth Abundance Reiki Healing Crystal Bag for Prosperity Vastu Feng Shui (Multicolour),"48,500",Home Furnishing,https://m.media-amazon.com/images/I/51v9sAMDYPL._AC_UL320_.jpg
"Angel Bear Vinyl Waterproof Wall Stickers (7cm by 4cm) - 108 Pieces, White",4899,Home Furnishing,https://m.media-amazon.com/images/I/71jPMJFdjwL._AC_UL320_.jpg
Wallstick Buddha with Quotes wallstickers (Vinyl 110 cm X 100 cm),4899,Home Furnishing,https://m.media-amazon.com/images/I/61wa65t9bPL._AC_UL320_.jpg
Divya Mantra Feng Shui Chinese Lucky Fortune I-Ching Dragon Coin Ornaments Wealth Charm Amulet Three Bronze Metal Coins wi...,4800,Home Furnishing,https://m.media-amazon.com/images/I/61GIN1tLocL._AC_UL320_.jpg
"OVEERA Twin Bell Copper Table Alarm Clock with Night LED Light for Student for Kids Bedroom, Wall Mounte (Copper)",4899,Home Furnishing,https://m.media-amazon.com/images/I/61ZKHU5ySEL._AC_UL320_.jpg
Jaamso Royals Large Elegant Flower Graceful Peach Blossom Birds PVC Vinyl Home Decor Wall Stickers Wall Sticker (90 CM X 6...,4899,Home Furnishing,https://m.media-amazon.com/images/I/71h6I7nNiZL._AC_UL320_.jpg
"MANSAA USB String Lights for Decoration 5 MTR 50 LED USB Operated, Yellow Rice Light, Lights for Diwali Decoration, Diwal...",4898,Home Furnishing,https://m.media-amazon.com/images/I/816sU9Ry8DL._AC_UL320_.jpg
"Indianara Set of 3 Deers Art MDF Art Painting (4064FL) without glass 4.5 X 12, 9 X 12, 4.5 X 12 INCH(Multicolor4064FL)",4899,Home Furnishing,https://m.media-amazon.com/images/I/81QqvCa7GwL._AC_UL320_.jpg
DS ENTERPRISE Kapur Dani Electrical Camphor Diffuser. Glass Kapoor Dani & Essential Oil Diffuser with On Off Switch to Tog...,4899,Home Furnishing,https://m.media-amazon.com/images/I/51BoU+jLVbL._AC_UL320_.jpg
"TIED RIBBONS Resin Krishna Idol, Standard, Multicolour, 1 Piece",4899,Home Furnishing,https://m.media-amazon.com/images/I/81SpZ2Fx4yL._AC_UL320_.jpg
SAF Ram Darbar Framed Acrylic Glass Painting 14 inch X 11 inch SANFR12(Multicolor),4899,Home Furnishing,https://m.media-amazon.com/images/I/81T-s0XjdUL._AC_UL320_.jpg
"PUNZONE Self Adhesive Unbeakable Oval Shape Mirror Sticker For Dcor Wall Kitchen, Bathroom, Bedroom, Living Room and Dini...",4819,Home Furnishing,https://m.media-amazon.com/images/I/31fDQIdm8YL._AC_UL320_.jpg
"Genson Novelty Enterprises Artificial Rose Orchid Flowers Bunch For Home Wall Hanging (Pink, 1)(1.)","48,249",Home Furnishing,https://m.media-amazon.com/images/I/71TxkXC9oqL._AC_UL320_.jpg
"Chalk My Theme Bless This Kitchen Quote Chop Board Wooden Wall Art for Kitchen, Cafe, Restaurant, Dining Table | Kitchen D...",4899,Home Furnishing,https://m.media-amazon.com/images/I/51Wand6QVmL._AC_UL320_.jpg
Airwick Automatic Air Freshener with Refill 250ml White Flowers,4849,Home Furnishing,https://m.media-amazon.com/images/I/71j0rpe1FCL._AC_UL320_.jpg
PAPER PLANE DESIGN Quote and Motivational Posters 12X18 (Poster-A),4895,Home Furnishing,https://m.media-amazon.com/images/I/81a8WFX72LL._AC_UL320_.jpg
"Decals Creation Vinyl Flowers Switch Board Fridge Wall Sticker, 23.62 X 29.92 X 0.39 Inches, Multicolour, Botanical",4849,Home Furnishing,https://m.media-amazon.com/images/I/71JO5kw6zaL._AC_UL320_.jpg
Collectible India Tealight Candle Holder Metal Wall Hanging Wall Art Sconce for Home Living Room Dcor /Christmas Decorati...,4899,Home Furnishing,https://m.media-amazon.com/images/I/714k0XZesEL._AC_UL320_.jpg
"Apka Mart The Online Shop Lord Ganesh Dancing Pose Metal Wall Hanging, Bronze color, 18 Inch Height - for Wall Decor, Home...","48,800",Home Furnishing,https://m.media-amazon.com/images/I/610gVX0b5PL._AC_UL320_.jpg
"Home Genie Unscented, Smokeless, Dripless, Long Burn Time, Paraffin WaX Tealight Candles for Home Dcor, Diwali Diya, Birt...",4884,Home Furnishing,https://m.media-amazon.com/images/I/71YnRWKfAPL._AC_UL320_.jpg
"EXpleasia Ganesha Idol with Wooden Temple for Home mandir, Temple, car Dashboard Temple, Gift Items (Ganesha Temple 2)",4850,Home Furnishing,https://m.media-amazon.com/images/I/51Vc7ND1gKL._AC_UL320_.jpg
Ajanta Wall Clock 14 Inches Vintage Sweep Wall Clock(No TIK TIK),4895,Home Furnishing,https://m.media-amazon.com/images/I/71LVXmWUQ9L._AC_UL320_.jpg
"Decals Design 5785 StickersKart PVC Vinyl Wall Stickers Hanging Lamp and Vines Black, 70cm X 50cm (Multicolour)",4864,Home Furnishing,https://m.media-amazon.com/images/I/51PHyceH5TL._AC_UL320_.jpg
"natureCRAFTS Natural Wood Agarbatti Incense Holder and Ash Catcher for Home ,Wooden Incense Tray for Sticks, Mango Wood St...",4899,Home Furnishing,https://m.media-amazon.com/images/I/61J8GnOUnoL._AC_UL320_.jpg
"Diya Shape Flower Decorative Urli Bowl for Home Handcrafted Bowl for Floating Flowers and Tea Light Candles Home ,Office a...","48,299",Home Furnishing,https://m.media-amazon.com/images/I/61Yza-iUAGL._AC_UL320_.jpg
Kajal Dream Cool Multicolor Printed 32 inches LED TV Cover (PVC) fit For All Brands Every Models P-04,4899,Home Furnishing,https://m.media-amazon.com/images/I/71k2MrhJ-9L._AC_UL320_.jpg
Wallstick Buddha with Quotes wallstickers (Vinyl 110 cm X 100 cm),4899,Home Furnishing,https://m.media-amazon.com/images/W/IMAGERENDERING_521856-T2/images/I/61wa65t9bPL._AC_UL320_.jpg
"OVEERA Twin Bell Copper Table Alarm Clock with Night LED Light for Student for Kids Bedroom, Wall Mounte (Copper)",4899,Home Furnishing,https://m.media-amazon.com/images/W/IMAGERENDERING_521856-T2/images/I/61ZKHU5ySEL._AC_UL320_.jpg
Jaamso Royals Large Elegant Flower Graceful Peach Blossom Birds PVC Vinyl Home Decor Wall Stickers Wall Sticker (90 CM X 6...,4899,Home Furnishing,https://m.media-amazon.com/images/W/IMAGERENDERING_521856-T2/images/I/71h6I7nNiZL._AC_UL320_.jpg
"MANSAA USB String Lights for Decoration 5 MTR 50 LED USB Operated, Yellow Rice Light, Lights for Diwali Decoration, Diwal...",4898,Home Furnishing,https://m.media-amazon.com/images/W/IMAGERENDERING_521856-T2/images/I/816sU9Ry8DL._AC_UL320_.jpg
"Indianara Set of 3 Deers Art MDF Art Painting (4064FL) without glass 4.5 X 12, 9 X 12, 4.5 X 12 INCH(Multicolor4064FL)",4899,Home Furnishing,https://m.media-amazon.com/images/W/IMAGERENDERING_521856-T2/images/I/81QqvCa7GwL._AC_UL320_.jpg
DS ENTERPRISE Kapur Dani Electrical Camphor Diffuser. Glass Kapoor Dani & Essential Oil Diffuser with On Off Switch to Tog...,4899,Home Furnishing,https://m.media-amazon.com/images/W/IMAGERENDERING_521856-T2/images/I/51BoU+jLVbL._AC_UL320_.jpg
"TIED RIBBONS Resin Krishna Idol, Standard, Multicolour, 1 Piece",4899,Home Furnishing,https://m.media-amazon.com/images/W/IMAGERENDERING_521856-T2/images/I/81SpZ2Fx4yL._AC_UL320_.jpg
SAF Ram Darbar Framed Acrylic Glass Painting 14 inch X 11 inch SANFR12(Multicolor),4899,Home Furnishing,https://m.media-amazon.com/images/W/IMAGERENDERING_521856-T2/images/I/81T-s0XjdUL._AC_UL320_.jpg
"PUNZONE Self Adhesive Unbeakable Oval Shape Mirror Sticker For Dcor Wall Kitchen, Bathroom, Bedroom, Living Room and Dini...",4819,Home Furnishing,https://m.media-amazon.com/images/W/IMAGERENDERING_521856-T2/images/I/31fDQIdm8YL._AC_UL320_.jpg
"Genson Novelty Enterprises Artificial Rose Orchid Flowers Bunch For Home Wall Hanging (Pink, 1)(1.)","48,249",Home Furnishing,https://m.media-amazon.com/images/W/IMAGERENDERING_521856-T2/images/I/71TxkXC9oqL._AC_UL320_.jpg
"Chalk My Theme Bless This Kitchen Quote Chop Board Wooden Wall Art for Kitchen, Cafe, Restaurant, Dining Table | Kitchen D...",4899,Home Furnishing,https://m.media-amazon.com/images/W/IMAGERENDERING_521856-T2/images/I/51Wand6QVmL._AC_UL320_.jpg
Airwick Automatic Air Freshener with Refill 250ml White Flowers,4849,Home Furnishing,https://m.media-amazon.com/images/W/IMAGERENDERING_521856-T2/images/I/71j0rpe1FCL._AC_UL320_.jpg
PAPER PLANE DESIGN Quote and Motivational Posters 12X18 (Poster-A),4895,Home Furnishing,https://m.media-amazon.com/images/W/IMAGERENDERING_521856-T2/images/I/81a8WFX72LL._AC_UL320_.jpg
