Name,Price,Category,image
AUTOEASY Tirupati Balaji idol for Car Dashboard murti Tirupati Balaji idol for home Spiritual Gift Item & Statue for Bhagw...,4850,Home Furnishing,https://m.media-amazon.com/images/W/IMAGERENDERING_521856-T1/images/I/71KfdlJBozL._AC_UL320_.jpg
CLAWCRAFTS SRI Yantra Mandala Wall Decor - EXperience Harmony and Prosperity with this EXquisite 12 X 12 Inches Art Piece ...,"48,999",Home Furnishing,https://m.media-amazon.com/images/W/IMAGERENDERING_521856-T1/images/I/81n8u6OG4sL._AC_UL320_.jpg
VG Hookah Gel Tube ( 100% Herbals ) Frozen Brain Flavour Get a Complementary American Phunnel Chillam 33021010,4850,Home Furnishing,https://m.media-amazon.com/images/W/IMAGERENDERING_521856-T1/images/I/61VMXAiXySL._AC_UL320_.jpg
Collectible India Metal LaXmi Ganesh Idol Set - Gold Plated Lakshmi Ganesha Idols Statue for Diwali Decoration Home Office...,4899,Home Furnishing,https://m.media-amazon.com/images/W/IMAGERENDERING_521856-T1/images/I/71Pv5vhoqYL._AC_UL320_.jpg
"Local Kala's Ceramic Milk jug vase/Eggshell vase to Keep Pampas Grass, Flowers, fillers for centerpieces, Side Table and H...",4899,Home Furnishing,https://m.media-amazon.com/images/I/81n8zCaUKFL._AC_UL320_.jpg
"KYARA ARTS Big Size Multiple Frames, Beautiful Wall Art Painting for Living Room, Bedroom, Office, Hotels, Drawing Room Wo...","48,500",Home Furnishing,https://m.media-amazon.com/images/I/912JXyOztzL._AC_UL320_.jpg
"NISHAN Singapuri Loban Sambrani Dhoop Cups, 24 Pcs BoX with Holder Plate, Lohban dhup Cup",4898,Home Furnishing,https://m.media-amazon.com/images/I/61P3ca-V0cL._AC_UL320_.jpg
"Generic Panchmukhi Hanuman Vahan Durghatana Nasak Pocket Yantra in Card - for Temple Home Purse, Multicolour, Standard (Ha...",4812,Home Furnishing,https://m.media-amazon.com/images/I/91U56nC7NxL._AC_UL320_.jpg
"VPK MDF Wood Analog Round Wall Clock Small Size 10 Inch, 25 X 25 cm Wenge-21","48,499",Home Furnishing,https://m.media-amazon.com/images/I/81FNp72m81L._AC_UL320_.jpg
"Wolpin Wall Sticker Kids Wallpaper (60 X 300 cm) Kids Room Alphabets Design, Blue","48,499",Home Furnishing,https://m.media-amazon.com/images/I/61FLD2lnnYL._AC_UL320_.jpg
Auroshikha Incense Sticks Combo - Set of 19,4822,Home Furnishing,https://m.media-amazon.com/images/I/71BHBOzJNHL._AC_UL320_.jpg
"Ramesh_Traders Dimond Colour(2 Horses 1 Plant) for Home Decor Items,Office,Living Room,Bedroom,Tv Table,Birthday Gift (Pac...","48,400",Home Furnishing,https://m.media-amazon.com/images/I/6107pG08y3L._AC_UL320_.jpg
Saraswati Idol for Decoration and Pooja,"48,450",Home Furnishing,https://m.media-amazon.com/images/I/71DHaIN6v0L._AC_UL320_.jpg
Decort- House Hold Decorations Rose Gold Steel Grid Photo Frame for Wall | 16 in X 20 in | 8 Wooden Clips Included | Rose ...,"48,850",Home Furnishing,https://m.media-amazon.com/images/I/618sOcEsM3L._AC_UL320_.jpg
"Delush Design Artificial Flowers (Multicolour, 144 Piece)",4800,Home Furnishing,https://m.media-amazon.com/images/I/511qHjYu4dL._AC_UL320_.jpg
Raksha Bandhan Rakhi Combo Set Brother - Rakhi Gifts for Bhaiya Bhabhi - Lord Ganesha Idol Statue/Special Greeting Card/Lu...,4899,Home Furnishing,https://m.media-amazon.com/images/I/71ddDO4YZ8L._AC_UL320_.jpg
"EISCO - Newton's Cradle (Collision Balls / Pendulum Balls), 18cmX15cmX17.5cm with 5 Steel Balls of 2.2cm Dia Each ,Perfect...","48,590",Home Furnishing,https://m.media-amazon.com/images/I/81Ihez+uKyL._AC_UL320_.jpg
"PRISTINDIA INTERNATIONAL Dream Catcher for Car's Interior Mirror, Wall Hanging and Wedding Ornament for Positive Vibes (Bu...",4899,Home Furnishing,https://m.media-amazon.com/images/I/61gHG1TuW8L._AC_UL320_.jpg
"Wall1ders 40 Cut Butterfly Golden, Mirror Stickers for Wall, Acrylic Mirror Wall Decor Sticker, Wall Sticker for Hall Roo...",4899,Home Furnishing,https://m.media-amazon.com/images/I/61bS5IE+ODL._AC_UL320_.jpg
"Decent Glass Terrarium Glass Bubble Bowl, Fish Bowl, Rose Bowl - Glass Round Vase, Events, Decorating, Home Decor, or Offi...","48,000",Home Furnishing,https://m.media-amazon.com/images/I/71vJOirkUSL._AC_UL320_.jpg
Aviraj Kasturi Incense Dhoop Cones for Pooja 1kg Pack Doop Cone I Kasturi Fragrance Yello Cones Non-ToXic,4800,Home Furnishing,https://m.media-amazon.com/images/I/71C8xYyvteL._AC_UL320_.jpg
"Saumic Craft Set Of 5 Framed Wall Paintings For Living Room Big Size , Home Decoration , Bedroom , Hall Large Size Wall De...","48,499",Home Furnishing,https://m.media-amazon.com/images/I/81Nt45bKngL._AC_UL320_.jpg
"Qatalitic Plastic Round Cartoon Emoji Smile Smiley Face Fridge Magnets (Multicolour, 3 cm Diameter)",4899,Home Furnishing,https://m.media-amazon.com/images/I/5140vGqsZVL._AC_UL320_.jpg
RoomDecor Wood Candle Holder/Candle Stand Pillar in Natural Look Set of 2 (Brown),"48,499",Home Furnishing,https://m.media-amazon.com/images/I/81cERbDkhVL._AC_UL320_.jpg
"SAF Set of 4 Camera, Recorder, Guitar, Headphone Musical Instrument UV Coated Home Decorative Gift Item Framed Painting 19...","48,889",Home Furnishing,https://m.media-amazon.com/images/I/61-XOw0HetS._AC_UL320_.jpg
"CHIVYA Digital LCD Voice Talking Function, LED Wall/Ceiling Projection, Alarm/Snooze/Temperature Display, 12hr/24hr, Bedsi...",4899,Home Furnishing,https://m.media-amazon.com/images/I/51VgClS8IDL._AC_UL320_.jpg
"SHREERANG Flower Press Kit, Multi Layer Flower Pressing Kit For Adults And Kids Making Dried Pressed Flowers Leaves For Di...","48,999",Home Furnishing,https://m.media-amazon.com/images/I/61UvuqfTvrL._AC_UL320_.jpg
"GRAY WALL Inglourious Basterds movie Framed Poster For Room & Office (10 Inch X 13 Inch, White)",4899,Home Furnishing,https://m.media-amazon.com/images/I/81DHmx3ftuL._AC_UL320_.jpg
RITUALISTIC Pastel Blooms Iron Wall Art (Multicolor) - Set of 5 |Home Decor | Painting | Divine | Intricate Designs,"48,499",Home Furnishing,https://m.media-amazon.com/images/W/IMAGERENDERING_521856-T2/images/I/71Qe0E4h38L._AC_UL320_.jpg
"ARTISKRITI Evil Eye Hanging for Home Entrance Door Decoration, Nazar Battu for Home Decoration",4899,Home Furnishing,https://m.media-amazon.com/images/W/IMAGERENDERING_521856-T2/images/I/71fVRk1jktL._AC_UL320_.jpg
Decent | MY HOOKAH Glass Metal Petite Hookah (10 INCH) (MULTI COLOURS) ASSORTED COLOURS,"48,999",Home Furnishing,https://m.media-amazon.com/images/W/IMAGERENDERING_521856-T2/images/I/81pCWALtKIL._AC_UL320_.jpg
Evelyn Analog Table Clock Classic Small Round Alarm Car Dashboard Time Desk Watch White Size 45mm,4899,Home Furnishing,https://m.media-amazon.com/images/W/IMAGERENDERING_521856-T2/images/I/71czxViCsYL._AC_UL320_.jpg
"Decals Design 'Pious Lord Ganesha' Wall Sticker (PVC Vinyl, 60 cm X 60 cm, Black)",4864,Home Furnishing,https://m.media-amazon.com/images/W/IMAGERENDERING_521856-T2/images/I/71VVwLWlMvL._AC_UL320_.jpg
GADGETS WRAP Vinyl Decal Sticker Sidhu Moosewala (Item Finish Size : 13cm X 13cm),4868,Home Furnishing,https://m.media-amazon.com/images/W/IMAGERENDERING_521856-T2/images/I/710zjLcIt5L._AC_UL320_.jpg
ARCADIA Modern Handcrafted luXury Metal Wall Decor Perfect for Living Room//Drawing Room//Hotel // Restaurant // (Color : ...,"482,999",Home Furnishing,https://m.media-amazon.com/images/W/IMAGERENDERING_521856-T2/images/I/61DKdWXXxAS._AC_UL320_.jpg
"OM Shree,Art and Craft Wooden Temple Beautiful Plywood Mandir Pooja Room Home Decor Office OR Home Temple (Red)",4899,Home Furnishing,https://m.media-amazon.com/images/W/IMAGERENDERING_521856-T2/images/I/61KyUnOZpTL._AC_UL320_.jpg
Indianara 3 Piece Set of Framed Kitchen Room Wall Hanging Decor(1067) Art Prints 8.7 INCH X 8.7 INCH Without Glass,"48,200",Home Furnishing,https://m.media-amazon.com/images/W/IMAGERENDERING_521856-T2/images/I/8109kJzHRfL._AC_UL320_.jpg
"Deer Face Acrylic Classic Stylish Wall Clock for Home Living Room Hall Office Bedroom Decor Medium Size, 60 cm X 60 cm (De...",4899,Home Furnishing,https://m.media-amazon.com/images/W/IMAGERENDERING_521856-T2/images/I/51MNHgXedFL._AC_UL320_.jpg
"Besnik Arts Metal Handmade Indian Design Akhand Jyot Diya for Diwali Puja, Festivals, Decoration, Mandir & Home Dcor 5 St...","48,299",Home Furnishing,https://m.media-amazon.com/images/W/IMAGERENDERING_521856-T2/images/I/71eWGZ8GbpL._AC_UL320_.jpg
PUJA Jitesh Arts Lord Krishna Arjun Geeta Updesh Painting For Wall With Frame With Glass 11inch X 14inch,4850,Home Furnishing,https://m.media-amazon.com/images/W/IMAGERENDERING_521856-T2/images/I/61-vowLSVoL._AC_UL320_.jpg
"Wall1ders 12 Rings 12 Circles Golden, Mirror Stickers for Wall, Acrylic Stickers, Wall Mirror Stickers, Wall Stickers for ...",4899,Home Furnishing,https://m.media-amazon.com/images/W/IMAGERENDERING_521856-T2/images/I/61cFzjEvN3L._AC_UL320_.jpg
Anikaa Jinny Engineered Wood Dressing Wall Mirrors/Wall Hanging Dressing Mirrors With Shelf/Decorative Wall Mirror/Dressin...,"48,999",Home Furnishing,https://m.media-amazon.com/images/W/IMAGERENDERING_521856-T2/images/I/61qeVkONKnL._AC_UL320_.jpg
"Light It Up Antique Vintage Style Brass Nautical Minor Ship Oil Lamps Lantern for Home Decoration,Candle Holder Diya Diyas...","48,999",Home Furnishing,https://m.media-amazon.com/images/W/IMAGERENDERING_521856-T2/images/I/317tXWReUPL._AC_UL320_.jpg
AuraDecor Fragrance Reed Diffuser|| Potpouri || Reed Diffuser Oil || Reed Diffuser Stick|| Home Fragrance. (Lavender),4899,Home Furnishing,https://m.media-amazon.com/images/W/IMAGERENDERING_521856-T2/images/I/81oTsJLW+kL._AC_UL320_.jpg
"Tallenge Kobe Bryant - LA Lakers - Black Mamba - NBA Basketball Great Fan Art Small Paper Poster (12 X 17inch, Multicolour)",4899,Home Furnishing,https://m.media-amazon.com/images/W/IMAGERENDERING_521856-T2/images/I/719+h8uGSRL._AC_UL320_.jpg
HELGA Set of 3 Decorative Gift Item Wall Painting For Living Room 12 Inch X 18 Inch Paintings,4899,Home Furnishing,https://m.media-amazon.com/images/W/IMAGERENDERING_521856-T2/images/I/51av4gI4MPL._AC_UL320_.jpg
"Dmoksh | Decorative Lord Ganesh/Ganesha Shadow Tea Light, Lamp, Holder for Diwali/Home Decor/Table Diya, PujaShadow Diwali...",4899,Home Furnishing,https://m.media-amazon.com/images/W/IMAGERENDERING_521856-T2/images/I/718+5VclOhL._AC_UL320_.jpg
"eCraftIndia Brass Panchdeep Diya for 5 Cotton Wicks with Wooden Holder, Brown and Golden, One Size (AKDIYA113)",4899,Home Furnishing,https://m.media-amazon.com/images/W/IMAGERENDERING_521856-T2/images/I/713z9n0bwXL._AC_UL320_.jpg
"the monument shop Indian Monuments Magnet Collection TAJ Mahal RED Fort India GATE QUTUB MINAR, Monuments of India 3D Frid...","48,000",Home Furnishing,https://m.media-amazon.com/images/W/IMAGERENDERING_521856-T2/images/I/81Qo7DH5rWL._AC_UL320_.jpg
"Royals Abstract Plastic Digital LCD Clock with Calendar, Temperature Sensor and Alarm (10.5 X 14 cm , Multicolour)",4899,Home Furnishing,https://m.media-amazon.com/images/W/IMAGERENDERING_521856-T2/images/I/61F71pPL39L._AC_UL320_.jpg
TenorArts Luffy Poster One Piece Anime Laminated Poster Framed Paintings with Matt Finish Black Frame (12inches X 9inches),4899,Home Furnishing,https://m.media-amazon.com/images/W/IMAGERENDERING_521856-T2/images/I/71kxv7Vd0WL._AC_UL320_.jpg
"GRAY WALL PleXi Jab We Met Movie Miinimal Art Framed Poster, multicolour, Print, 10inch X 13inch For Room Office Wall",4899,Home Furnishing,https://m.media-amazon.com/images/W/IMAGERENDERING_521856-T2/images/I/61kWBLF3jVL._AC_UL320_.jpg
9Dzine Clear Quartz Pendulum Dowser Stone for Reiki Healing Natural Clear Quartz Ball Dowsing Pendulum for Crystal Healing,4899,Home Furnishing,https://m.media-amazon.com/images/I/415eV0NVaqL._AC_UL320_.jpg
P Arts Wall Decor Hanging Sweet Home Wooden Welcome Board (9.5 X 18 inch),4848,Home Furnishing,https://m.media-amazon.com/images/I/71Cbg5NAfXS._AC_UL320_.jpg
"100Yellow Matte Finish Baby Poster For Pregnant Women | HD Quality Wall Poster Ideal For Bedroom, Living Room, Kids Room ...",4899,Home Furnishing,https://m.media-amazon.com/images/I/71FXgSC9ZYL._AC_UL320_.jpg
"Sanvatsar Home Decorative Lotus Rangoli & Lotus Diya Set | Corporate Gift, Diwali Gift, Diya for puja Home Decoration Ligh...",4899,Home Furnishing,https://m.media-amazon.com/images/I/513Gm2i1fUL._AC_UL320_.jpg
Vahvaa Lakshmi Kubera Coins Yantra Ashtothara Lakshmi Kubera Coins of 11 Pcs,4899,Home Furnishing,https://m.media-amazon.com/images/I/81UwVncWvjL._AC_UL320_.jpg
"KARIGAARI - Ideas Hand Crafted Resin Lord Ganesha Ji Dashboard Idol, Standard, Multicolour",4899,Home Furnishing,https://m.media-amazon.com/images/I/51YvHqfThFL._AC_UL320_.jpg
"Quality Glass Decorative Frameless Oval Wall Mirror (18 X 24 Inches, Silver) Unframed","48,500",Home Furnishing,https://m.media-amazon.com/images/I/61G8NV4qFmS._AC_UL320_.jpg
The Wishing Chair Mood Indigo Handpainted Stoneware Wall Plate / 10 Inches,4850,Home Furnishing,https://m.media-amazon.com/images/I/61ftpcNyXlL._AC_UL320_.jpg
Fashion Hub TI AMO Mandala Tapestry Cotton Wall Hanging Tapestry (84 X 54 inch Multicolour),4850,Home Furnishing,https://m.media-amazon.com/images/I/81Mh8N2Kt2L._AC_UL320_.jpg
"Webelkart Synthetic Premium Funny Quote Poster Frame for Wall, Office, Study Room Decoration (Multicolour, 10 X 10 Inch)",4899,Home Furnishing,https://m.media-amazon.com/images/I/81o9ivx6TZL._AC_UL320_.jpg
"SoulAbiti Presents One piece Monkey.D.Luffy All Gears Art ( 12-inch X 18-inch, Framed)",4899,Home Furnishing,https://m.media-amazon.com/images/I/81tuYRQPwIL._AC_UL320_.jpg
"Swara Agate Crystal Pyramid, Orgone Pyramid for Positive Energy, Chakra Healing, Meditation, Yoga, Natural Orgonite Pyrami...","48,299",Home Furnishing,https://m.media-amazon.com/images/I/71aqP0ZYB4L._AC_UL320_.jpg
"VIEDANSA Window Privacy Films, Decorative Window Film, Self Static Cling Vinly Glass Film for Bathroom Home Office Meeting...","48,599",Home Furnishing,https://m.media-amazon.com/images/I/71bJSoGxLvL._AC_UL320_.jpg
"UCRAVO 2 Meter Kitchen Backsplash Wallpaper, Aluminum Foil Self Adhesive Oil-Proof Wall Sticker Peel and Stick Heat Resist...",4899,Home Furnishing,https://m.media-amazon.com/images/I/71kfpcJcGKL._AC_UL320_.jpg
STASH PRO BROWN PAPER PACK OF 10,4800,Home Furnishing,https://m.media-amazon.com/images/I/81EnZufBprL._AC_UL320_.jpg
"PNF UV TeXtured Wooden Framed Poster of Swami Vivekananda (19844, Multicolour, 13.5X19 inch, Medium)",4800,Home Furnishing,https://m.media-amazon.com/images/I/719b8UVx1oL._AC_UL320_.jpg
Rangoli 3D Butterfly Multicolor Come with Magnet and Gumming Cubes for Hanging Pack of 48 pcs,4899,Home Furnishing,https://m.media-amazon.com/images/I/618UmpmE4tL._AC_UL320_.jpg
Plastic Wall Clock for Home Living Room Bedroom and Office (Round 25.4 X 25.4 cm) (Cadbury Design) Black & Brown with Glass,4899,Home Furnishing,https://m.media-amazon.com/images/I/71EKZg6aQNL._AC_UL320_.jpg
RUDRADIVINE Brass Vastu Aura Booster Neutralize IR UV GS CE for Increase Positivity Energy (Color : Golden),4899,Home Furnishing,https://m.media-amazon.com/images/I/515GgnSoW-L._AC_UL320_.jpg
S2S Artificial Mogra Flowers I Heavy Door Hanging Toran I Bandhanwar for All Festivals Decoration,4899,Home Furnishing,https://m.media-amazon.com/images/I/41GIbX1aUqL._AC_UL320_.jpg
Reshamm Pre-Energized Green Jade Zibu Coin for Wealth Money Cash flow Natural (Non Synthetic) Abundance Coin with Angel N...,"48,999",Home Furnishing,https://m.media-amazon.com/images/I/71CBq5qcLnL._AC_UL320_.jpg
Kreyam's Loban Aroma Incense Sticks Agarbatti 400gm,4899,Home Furnishing,https://m.media-amazon.com/images/I/61H4yFgnGzL._AC_UL320_.jpg
"OREVA Plastic Round Shape Simple Small Wall Clock (20.5 X 4 X 20.5 cm, P Green, AQ-1217)",4890,Home Furnishing,https://m.media-amazon.com/images/I/8140e-WcJCL._AC_UL320_.jpg
"Art n Store: Lord Vishnu and Goddess Lakshmi Giving Blessing, Glitter Work Painting with Plane Brown Frame (30 X 23.5 X 1....",4850,Home Furnishing,https://m.media-amazon.com/images/I/61+vO7-FeAL._AC_UL320_.jpg
LABZIO Home - Glass Flower vase: Test Tubes Arranged in a Circular Wooden Base.,"48,000",Home Furnishing,https://m.media-amazon.com/images/W/IMAGERENDERING_521856-T1/images/I/91hIZL+pcyL._AC_UL320_.jpg
OutonTrip RAW Cone Metal Aluminium Tube (Silver),"48,299",Home Furnishing,https://m.media-amazon.com/images/W/IMAGERENDERING_521856-T1/images/I/91LyJ7yGoGS._AC_UL320_.jpg
"Amazon Brand - Solimo 12-inch Contemporary Plastic & Glass Wall Clock - Designer (Silent Movement, Black Frame)","48,100",Home Furnishing,https://m.media-amazon.com/images/W/IMAGERENDERING_521856-T1/images/I/51DTKkxCFQL._AC_UL320_.jpg
"OXYSHINE Adiyogi Shiva Statue for Car Dash Board, Pooja & Gift, Mahadev Murti, Idol, Lord Adiyogi Shankara for Home & Offi...",4899,Home Furnishing,https://m.media-amazon.com/images/W/IMAGERENDERING_521856-T1/images/I/7158L6cNrPL._AC_UL320_.jpg
AMFIN (Pack of 8) Happy Birthday Printed Pastel Color Candle with Holder for Birthday Cake Topper Accessories / Candles f...,4899,Home Furnishing,https://m.media-amazon.com/images/W/IMAGERENDERING_521856-T1/images/I/41Mc2MhjI7L._AC_UL320_.jpg
"Moira Metal Kuber Kunji Key (Standard, Gold)",4860,Home Furnishing,https://m.media-amazon.com/images/W/IMAGERENDERING_521856-T1/images/I/61T9Bt1xEKL._AC_UL320_.jpg
NAWAB Mandarin Essential Aroma Diffuser Oil (100ml),"48,497",Home Furnishing,https://m.media-amazon.com/images/W/IMAGERENDERING_521856-T1/images/I/41jOTV2hJpL._AC_UL320_.jpg
Collectible India Brass Traditional Golden Kerala Diya/Oil Lamp Stand- Deepak for Temple (Set of 2),4849,Home Furnishing,https://m.media-amazon.com/images/W/IMAGERENDERING_521856-T1/images/I/51g8gMV5UvL._AC_UL320_.jpg
Rangoli Vinyl Wall Sticker Multicolour Vinyl Medium Size 40cm or 50 cm Pack of 1 Sticker,4899,Home Furnishing,https://m.media-amazon.com/images/W/IMAGERENDERING_521856-T1/images/I/71rD2a6jKYL._AC_UL320_.jpg
AFTERSTITCH Kung Fu Monks Set 4 Big Size Cute Baby Monk Buddha Idols Statues Showpiece (8 cm Height) - Car Dashboard-Home ...,"48,499",Home Furnishing,https://m.media-amazon.com/images/W/IMAGERENDERING_521856-T1/images/I/51zB3MFkjBL._AC_UL320_.jpg
"NAITIK CREATION Shri Saraswati Yantra Metal Classic Decorative Showpiece | Shree Yantras for Table Top, Desk, Pooja Room (...",4899,Home Furnishing,https://m.media-amazon.com/images/W/IMAGERENDERING_521856-T1/images/I/71BcR5MfJlL._AC_UL320_.jpg
"Navgrah Lakdi (Brown , Pack of 2)",4899,Home Furnishing,https://m.media-amazon.com/images/W/IMAGERENDERING_521856-T1/images/I/91JI0z6YDaL._AC_UL320_.jpg
JAAMSO ROYALS Kitchen Grocery Oil Proof Sticker High Temperature Cooktop Tile Wall Sticker (30 CM X 90 CM),4899,Home Furnishing,https://m.media-amazon.com/images/W/IMAGERENDERING_521856-T1/images/I/61KpB+V2c7L._AC_UL320_.jpg
PAPER PLANE DESIGN UV TeXtured Modern Art Print Framed Painting Set Of 3 For Home Decoration - Size 35 X 2 X 50 cm,4899,Home Furnishing,https://m.media-amazon.com/images/W/IMAGERENDERING_521856-T1/images/I/71SQrXPa-lL._AC_UL320_.jpg
SAF Set of 3 Bamboo Stick Flower UV Coated 6MM MDF Home Decorative Gift Item Painting 12 inch X 27 inch SANFC12102,"48,499",Home Furnishing,https://m.media-amazon.com/images/W/IMAGERENDERING_521856-T1/images/I/61tfEQPWmIL._AC_UL320_.jpg
Rajasthan Art And Craft Wood Home Temple (Brown),"48,599",Home Furnishing,https://m.media-amazon.com/images/W/IMAGERENDERING_521856-T1/images/I/611pqDviqOS._AC_UL320_.jpg
TickRight Mini Cute Red Heart Wooden Pegs Photo Clips Note Memo Holder (20 Pieces),4899,Home Furnishing,https://m.media-amazon.com/images/W/IMAGERENDERING_521856-T1/images/I/41HYpmcmwRL._AC_UL320_.jpg
Urban Hamlet Metal & Crystal Tea Light Candle Holder Stand/Centrepiece Table Candle Holder/for Home decore/Wedding,"48,499",Home Furnishing,https://m.media-amazon.com/images/W/IMAGERENDERING_521856-T1/images/I/515SwoT+yPL._AC_UL320_.jpg
"Heilen Biopharm Clovebud Essential Oils,15 ml Food Grade (Edible) Clove bud",4849,Home Furnishing,https://m.media-amazon.com/images/W/IMAGERENDERING_521856-T1/images/I/71j3+bmbQiL._AC_UL320_.jpg
FRAMING MEMORIES Venetian Multi Glass Beveled Round Wall Mirror 30 Inches(Framed),"484,999",Home Furnishing,https://m.media-amazon.com/images/W/IMAGERENDERING_521856-T1/images/I/614l10UbnNS._AC_UL320_.jpg
SC CREATIVES Set of 3 Modern Womens in Boho Style Framed Art Prints Painting l Arylic Glass 16 X 12 Inches Wall Art l Wall...,"48,599",Home Furnishing,https://m.media-amazon.com/images/W/IMAGERENDERING_521856-T1/images/I/51vD6cxHY4L._AC_UL320_.jpg
Artysta Warli Forests?Hand-Painted Earthen Terracotta Vase - Vases Flower Vase Terracotta Decorative for Home Terracotta...,"48,199",Home Furnishing,https://m.media-amazon.com/images/W/IMAGERENDERING_521856-T1/images/I/71x93IXR4OL._AC_UL320_.jpg
BS AMOR 50pcs Bulk Rose Leaves Artificial Greenery Fake Rose Flower Leaves for DIY Bouquets Centerpieces Party Decorations...,4899,Home Furnishing,https://m.media-amazon.com/images/W/IMAGERENDERING_521856-T1/images/I/91vNxMxiurS._AC_UL320_.jpg
Natraj Albums Leo 120 Pocket 4X6 New Slide in pp Pack Album (Photo Size Supported: 4X6 Size) Album (Photo Size Supported: ...,4899,Home Furnishing,https://m.media-amazon.com/images/W/IMAGERENDERING_521856-T1/images/I/710nWqZk30L._AC_UL320_.jpg
"Sticker Hub Paintable Musical Symbol Wooden Laser Cut for Decoration DIY Prodcuts for Kids, Parties, Art and Craft Pack of...",4899,Home Furnishing,https://m.media-amazon.com/images/I/51i6zCU2bQL._AC_UL320_.jpg
Home Centre Grace Double Sided Table Mirror,4899,Home Furnishing,https://m.media-amazon.com/images/I/51010aWm7xL._AC_UL320_.jpg
"SphinX Golden Colored Plastic Bells for Crafts/Decoration/Festive Decor (Check Sizes Carefully) - (10, A2R)",4899,Home Furnishing,https://m.media-amazon.com/images/I/61Ag9+MDfTL._AC_UL320_.jpg
Beautiful Dark Flower Fridge Sticker Decorative Refrigerator Door Wallpaper Poster self Adhesive Vinyl Fridge wrap(PVC Vin...,"48,199",Home Furnishing,https://m.media-amazon.com/images/I/61XPSUy++YL._AC_UL320_.jpg
"Amazon Brand - Solimo 12-inch Wall Clock - Designer (Silent Movement, Black Frame)","48,100",Home Furnishing,https://m.media-amazon.com/images/I/31-E8iuCvWL._AC_UL320_.jpg
"MadsBoX Feng Shui Galloping Horse Polyresin, Polystone Statue Showpiece, Corporate Gift, Figurine and Statues for Interior...","48,999",Home Furnishing,https://m.media-amazon.com/images/I/81+uMEV3ApL._AC_UL320_.jpg
CRAFTCASTLE Sheesham Wood Book Stand/Holder/Rest/Keep for Home/Work Space/Religious Places Rehal Stand ( 15 inches),"48,299",Home Furnishing,https://m.media-amazon.com/images/I/61PIWpk57VL._AC_UL320_.jpg
SKIN POSTER - Window Films Privacy Glass Film Self Adhesive Decorative Film for Bathroom/Door Window/Heat Control/Sideligh...,"48,499",Home Furnishing,https://m.media-amazon.com/images/I/61eq-dpmMHL._AC_UL320_.jpg
god & god's Large Wall Sticker JUST Peel & Stick Size 50 or 60 cm Pack of 1 (Code GS442,4899,Home Furnishing,https://m.media-amazon.com/images/I/91YqBF8KC9L._AC_UL320_.jpg
"Vimoksha Organic Dhoop Sticks - Fragrance Incense Sticks for Home - 60 Min Burning Time - Free Stand - Best for Pooja, Gif...",4899,Home Furnishing,https://m.media-amazon.com/images/I/71jeZrktnTL._AC_UL320_.jpg
Behoma Drop Hanging Lantern with Metal Frame and Glass for Home Decoration | Decorative Lantern for Table-top and Wall-han...,"48,450",Home Furnishing,https://m.media-amazon.com/images/I/61ixeE5IvmL._AC_UL320_.jpg
Anbhudan | ATTACK ON TITANS WALL DECOR | PACK OF 18 Manga wall collage kit |Anime wall poster 6 * 4 inches (300 GSM)| Eren...,4829,Home Furnishing,https://m.media-amazon.com/images/I/61k3PhPuOAL._AC_UL320_.jpg
JABRESHWAR CRYSTAL Green Aventurine Crystal Abundance and Prosperity Stone Money Switch Word of Prosperity Natural Stone G...,4850,Home Furnishing,https://m.media-amazon.com/images/I/91SQ81-DgtL._AC_UL320_.jpg
"Gifts Off Luv Couple Cutout Photo Frames/Standee Caricature MDF Wood Personalized Gift/customized gifts for birthday gift,...","48,299",Home Furnishing,https://m.media-amazon.com/images/I/61wmA9vqiDL._AC_UL320_.jpg
"Parag Fragrances Ruh Gulab Dhoop Sticks 220 Gm / 100% Natural & Hand Made Dhoop Sticks for Long Lasting Home Fragrance, Me...",4899,Home Furnishing,https://m.media-amazon.com/images/I/71fR0yhznnL._AC_UL320_.jpg
PetromaX Glass Lamp Oil Candlelight for Home Decoration,4800,Home Furnishing,https://m.media-amazon.com/images/I/81G8e5MYzWL._AC_UL320_.jpg
SoilMade Mahakaleshwar Shivling Multicolor Shivling Size ApproX 8 cm,4899,Home Furnishing,https://m.media-amazon.com/images/I/61-EO0y1kbL._AC_UL320_.jpg
D2C 7 Chakras Energy Centers Wall Decal Set | Self Adhesive | Spiritual Gift for Yogis | Meditation Wall Decal Sticker Siz...,4899,Home Furnishing,https://m.media-amazon.com/images/I/614Si2Ql1-L._AC_UL320_.jpg
"Two Moustaches Brass 4.5 Inches Varahi Statue, Varahi Amman Statue, Brass God Idols, Golden, Standard, Pack of 1","48,690",Home Furnishing,https://m.media-amazon.com/images/I/81tgt2wfvfL._AC_UL320_.jpg
Ayyappan Traders Varagi Amman 8 Handed Brass Statue | Lord Vishnu's Varaga Avatar Idol Statue | Varaga Devi Brass Idol | V...,"48,399",Home Furnishing,https://m.media-amazon.com/images/I/81NYRA0D7VL._AC_UL320_.jpg
Ajanta 397 Plastic Wall Clock (White_9.8 Inch X 0.3 Inch X 9.8 Inch),"48,000",Home Furnishing,https://m.media-amazon.com/images/I/61nPPMf0WoL._AC_UL320_.jpg
"ABS HERBALS : Rangoli Sticker, kolam Sticker for : Wall, Tiles, Glass, Floor, Steel Stickers (Yellow) , (Modal : YP4, Size...",4850,Home Furnishing,https://m.media-amazon.com/images/I/41IjL2SyqPL._AC_UL320_.jpg
"MARBOGLASS India Glass Handicraft Mini Swan Family for Home Decorative Show Pieces Items(Green), 6X7 CM (DK-67GRN)",4899,Home Furnishing,https://m.media-amazon.com/images/I/812lpd4LL6L._AC_UL320_.jpg
Smoking Pack of 10 BOOKLETS RED Regular Small 70MM Size Rolling Paper (60 Leaves Per Pack),4899,Home Furnishing,https://m.media-amazon.com/images/I/31LgOrfnSxL._AC_UL320_.jpg
"Shilp Saga Home Decor Showpieces Buddha Statue for Home Decor Decorative Showpiece (Golden - 28CM), Resin","48,599",Home Furnishing,https://m.media-amazon.com/images/W/IMAGERENDERING_521856-T2/images/I/31gF98FuZIL._AC_UL320_.jpg
