Rank,Name,Ratings,Price
836,"Shree Haridas Polyester Fancy Transparent Sheer Print Tissue Net Window Curtain Parda for Drawing Room , Living Room/Bedro...",5,4599
837,"Trident TRISAFE Towel Set, 2 Bath Towels for Men and Women, 400 GSM, Soft, Highly Absorbent, Quick-Dry, Easy Care, Allure ...",3.9,4599
838,"CK CREATION Polyester All-Weather 120 GSM Printed Lightweight Reversible AC Dohar Blanket Quilt - (Blue Cross line, Single)",4.2,"45,799"
839,"Fareto Newborn Baby Lacy Muslin Cotton Godari Cradle Bed (Multicolour, 0-12 Months, Pack of 3)",4,"45,299"
840,MY NEWBORN Baby AC Blanket -2 Pcs (Blue and Pink) | New Born Wrapper | 0-6 Months | Skin-Friendly | Soft Hooded Swaddle | ...,4.1,"45,800"
841,BSB HOME Premium Cotton Elastic Fitted Bedsheets with 2 QueenSize Pillow Covers | Double Bed with All Around Elastic 180 T...,5,"45,999"
842,"GLUNÂ® Waist or Half Checkered Apron for Kitchen, Industries Use withSidePocket Red",4..1,4599
843,"Alliance Floral Foliage 160 TC Glace Cotton Double Bedsheet with 2 Pillow Covers, Size 90X100 Color Purple",5,4599
844,SKINGO Satin Silk Printed Pillow Covers for Hair and Skin Pack of 2-with Satin Scrunchies for Women Stylish | |Silk scrunc...,4.8,4569
845,"Nylon Cord for Vertical Blinds, Venetian Blinds, Chick Blinds & Wooden Blinds (Dark Brown, 25 Meters)",4.2,4530
846,"SAVOY CONCEPTS Cotton Feel Glace Cotton Elastic Fitted Printed Queen Size Double Bed Bedsheet with 2 Pillow Cover(60"" x 7...",4..1,4599
847,"Parda Sansar Polyester & Polyester Blend Solid Window Curtain, Window - 4x5 Feet, Black, Pack of 2",4.1,4599
848,"JY Queen Pillows for Sleeping Bed Pillows Hotel Quality , Soft Down Alternative Pillows , Hypoallergenic Pillow for Side a...",3.5,4599
849,Lukzer (Pack of 2 Stretchable Cushion Cover for Couch Home Decorative Sofa Throw Pillow Case with Hidden Zipper (Multicolo...,4,4549
850,"Trident Bath Towel, Cabana Stripe Towel, 1 Piece Bathroom Towel, 500 GSM, 100% Cotton, Extra Large Beach Towel, Highly Abs...",4.2,4599
851,"GLOW HOME Chatai Mats for Home, Chattai Mat for Sleeping on Floor/Chatai Plastic Mat for Floor, Plastic Mat for Sleeping, ...",4..1,4599
852,"spinrific Cotton Chindi Braided Floor Rug Boho Bedside Living Room Carpet Rug, Multi-Coloured, Pack of 1",2.9,4599
853,Kalap Floral Plain White Cotton Cloth Materiel Soft White Plain Dress Making and Home Fabric Running Jaipuri Hand Block Pr...,3.9,4599
854,Target20 Polyester Waterproof Adjustable Kitchen Apron Freesize For Men and Women Chef with Front Pocket (Pack of 2),3.7,"45,499"
855,"ATMAH Coir Doormat (Summer Birds, Multicolour, 45cm X 75cm)",4,4599
856,"Yellow Weaves Plastic 0.30mm PVC Classic AC Transparent Curtain - 1 Curtain with 8 Hooks (Transparent, 4.5 X 7 ft or 54 X ...",3.9,4500
857,Star Beddings Premium Kids Loving All Around Elastic Fitted Single/diwan Bed Sheet 60x90 inches Set with 1 Pillow Cover (N...,4..1,"45,199"
858,Soheta Microfiber Absorbent Hair-Drying Quick Dry Shower Caps Bathrobe Magic Warp Super Quick-Drying Bath Cap Salon Towel...,3.8,4599
859,"JUPON Premium Silk Darkening Door Curtain (Beige, 44 X 84 Inches) - Pack of 2 Piece, Blackout",4.3,"45,099"
860,"Dutchcoop âˆ«âˆ« Beautiful 240 TC Polycotton Prime Flower Design Diwan Set with 8 Pieces, One Single Bed Sheet with 5 Cushions...",4,"45,299"
861,"Sun Rise Van Heusen Chenille 5 Seater Sofa Cover Set (3+1+1, Beige, Standard)- 10pcs",4.3,"45,299"
862,"AVIRAL Velvet Homesajja Modern Diwan 1 Sheet, 2 Bolster With Dori And 5 Cushion Covers (Standard, Black And Grey) - Set Of...",4,"45,999"
863,"MYRA Collection Anti Slip Round Shaggy Fluffy Fur Rug and Carpet for Living Room, Bedroom White",3.8,"45,999"
864,Kuber Industries Floral Cotton 6 Seater Dinning Table Cover (Brown),4,4579
865,RD TREND King Size Glace Cotton All Over Elastic Fitted Double Bedsheet with 2 Pillow Covers - Dark Green,3.9,4599
866,"WSKART Stainless Steel Lightweighted Gold Color Curtain Bracket Diamond Design Clamp Window Hardware, Set of 2 Pcs F518/S1...",4..1,4500
867,SHOP BY ROOM Waffle Weave Cotton Quick Dry Kitchen/Table/Roti Napkin (18 x 26 inch/Extra Large; Assorted Colour) -Set of 3,4.1,4599
868,BhaiJi Bedsheet 180 TC Kids Glace Cotton Cartoon Print Bed Sheet Double Bed Queen Size - Multi Good Night Moon Stars,3.5,4599
869,OYO BABY - Baby Dry Sheet for New Born Babies | Infant Waterproof Bed Protector Sheet for Baby | Mattress Pads (Small - (7...,4,4585
870,"Peach Goma Cat Customised Pillow Cushion , Custom Couple Pillow Gifts , Mochi Cat Custom | Best Pillow Gift for Couples , ...",4.1,4599
871,"Nivedha Mattress-Organic Silk Cotton/Kapok/Semal/Ilavam Panju Classic Pillow (27 X 17 Inches),White Striped Pillow.",4,"45,500"
872,"Contrast Living phirojs Cotton Printed Napkin Table Napkin/Kitchen Napkin/Table Linen/Dinning Table Napkin(50 X 50 Cm, 20x...",4.3,4599
873,"BSB HOME Prime Collections 100% Cotton Feel Double/Queen Size Bedsheets with 2 Pillow Covers Cotton, 180tc Floral Grey Bed...",4..1,4599
874,"ONESTOÂ® Handwoven Jute Natural Reversible Rugs Round Braided Floor Carpet Mat for Living Room, Bedroom, Dining, Office, Re...",3.9,"45,049"
875,JAW Beautiful 250TC 100% Cotton Floral Double Elastic Fitted Bedsheet with Two Pillow Covers - King Size Bedsheet with Gor...,4.1,"45,999"
876,"Waco Creation Polyester Blend Leaves Curtains, 48x84 Inch, Green, 3 Pc",4.2,"45,399"
877,GLOXY Stainless Steel Brackets Parda Holder with Support 1 Inch Curtains Rod Pocket Finials Designer Door and Window Curta...,3.6,"45,499"
878,RD TREND Polycotton Printed Single Bedsheet with 1 Pillow Cover (18 X 28 Inch) (Green),3.7,4595
879,HOMIO Cotton Elastic Fitted Double Bedsheet with 2 Pillow Covers (76x72 Inches) - Jamaican Chevron,4.4,"45,099"
880,"MINISO Door Mat,Super Absorbent Bathroom Mat 40 * 60CM,Durable Welcome Mat,Low Profile Floor Mat,Front Doormat,Non Slip En...",4,4550
881,Dreamweavers 100% Cotton Honeycomb Premium Bathrobe Waffle Weave I Double Sided I for Men I Free Size (White),3.9,"45,000"
882,"Amazon Brand - Solimo Chabelle Polyester Printed Cushion Covers, Set of 5, 16 x 16 Inch",2.4,4529
883,"Jewear Cotton Floral Curtain, 7 Feet, White, And Mustard Yellow , Pack Of 2(Programmable)",4.4,"45,900"
884,Happy Matty Reusable Washable White Soft Comfortable Unisex Adults Extra Absorbent Quick Dry Sheet Playmat (99x69) Cm Larg...,4.2,"45,450"
885,"JB HOME Anti Slip Door Mats or Rugs - Half Sunflower Shaggy Floor Mats - Designer Mat for Living Room Bedroom Bathroom, 18...",4,"45,499"
886,"AJISH Extra Absorbent Reusable Waterproof Sheet for Baby/Baby Bed Protector/Dry Sheet - Navy Blue, Extra Large 140 x 200c...",3.6,"45,099"
887,"next Day art Portable Polyester Mosquito Net for Double Bed Home & Travel, Lightweight Pop-Up Tent for Beds(Orange)",5,"45,200"
888,"KNSS Handloom 100% Pure Cotton Towels XXXL Size 36/72Inch(90/180cm) 3/6feet Heavy Quality Multi Colour (2), 600 GSM",4.1,4550
889,"Hush Standard Pillow | Softex Fiber Filling | Medium Soft Feel The Zero Headache Polyester Bed Pillow, - Set of 2 Pillows...",4,"45,780"
890,"Khooti Jute Cushion Cover, 18x18 (Natural Linen) (Pack of 5)",4,"45,699"
891,"DOOMSDAY 2 Pieces Curtain Rod Brackets Fixing Holders, Adhesive Adjustable Curtain Rod Bracket Holder, Stick On Adhesive C...",4..1,4599
892,LORETO â€?A QUALITY LINEN BRAND Printed 144 TC Cotton Bedsheet for Double Bed with 2 Pillow Covers - White & Grey,4,"45,399"
893,VEEMIZO Bed Making Tool Can Tuck Sheets Bed Tucker Bed Lifter Helps Lift and Hold Mattress Wedge Elevator Tool Mattress Li...,5,4525
894,BOS MEDICARE SURGICAL Natural Rubber Air Cushion Piles Inflatable Rings 40cm,3.2,4555
895,"Choudhary Carpet Home Decore Persian Acrylic Carpet (blue1 Color 5x7 Feet, 1 Piece)",4.3,"45,641"
896,"Mars Exports - Wooden, Steel Curtain Rod Finials Brackets, End Caps, Accessories, Holder Full Set - for 25 mm (1 inch) Rod...",5,"45,499"
897,Mars Home Centre Cotton Ultrasonic 300 Tc Solid King Size Quilted Bed Cover/Bedsheet with 2 Pillow Covers (Luxurious)-PR (...,4.5,"45,000"
898,FERIO Brass Finish Zinc Curtain Finials for Door and Window Accessories 1 inch Rod Set of 3 ( 6 Pcs) Curtain Brackets / Ho...,4.5,"45,999"
899,"RD TREND Glace Cotton 180 TC Single Flat Bed Sheet(Size-90 inch x 60 inch) with One Pillow Cover, Grey Flower",3.7,4595
900,Kuber Industries Polyester 6 Pieces Curtain Tie Back Tassel Set (Grey) CTKTC33480,4.3,4599
901,"HS Enterprises Printed Polycotton 8 Pieces Diwan Set Combo - 2 Diwan Bedsheet, 10 Cushion Covers, 4 Bolster Covers",4..1,"45,100"
902,"AmazonBasics Cotton Washcloth/Face Towel - 448 GSM - Pack of 24, Lavender",4.4,"45,500"
903,MOM CARE Fleece Winter Blanket for Newborn Baby Soft Warm Fluffy Single Layered Pack of 1 Dark Blue 0-2years,5,"45,200"
904,SHOPHOX Glace Cotton Elastic Fitted Printed Queen Size Double Bed bedsheet with 2 Large Pillow Covers | Bedspread / Bed Co...,4..1,4599
905,"Trendify Cotton Hand Towel Set (White, 40 cm x 60 cm) - Set of 6",4,"45,199"
906,Encasa Dining Table Runner for 4 Seater - Polyester Twill Fabric - Foil Digital Print - Size 28x150 cm - Decorative Cloth ...,4.3,4580
907,"Fabron India Microfiber Super Soft Anti Skid Solid Bathroom Rugs (Coffee, 40x60 cm, 23mm)",3.6,4599
908,"HOKIPO Large 45X75 PP Welcome mat Anti Slip Floor mat for Entrance, Main Door mat Entry Mat, Green (IN525)",4.6,4599
909,"KTPlus Sandwich Pillow, Adjustable Memory Foam Pillow, Bamboo Pillow for Sleeping, Cervical Pillow for Neck Pain, Neck Sup...",4.4,"45,599"
910,Roseate Box Microfibre Door Mat (40x60 cm) Anti Slip Floor mats for Home/ Kitchen/ Office Entrance (Blue) Pack of 1,2.9,4599
911,"Saral Home Easy Living Soft Cotton Multi Purpose Runner -(Red, 45X180 CM)",4.2,4599
912,DREAM CARE Reversible 3 Layers Polyester 3 Seater Quilted Sofa Cover with Side Pockets Grey & Navy Blue,4..1,"45,999"
913,Linenaffairs Hollow Fibre Pillow for Sleeping Pack of 2- Grey Print Pillow - 16 x 24 Inch,4.1,"45,298"
914,"Amazon Brand â€?Umi Velvet 4 Seater Table Runner and Bed Runner,13 x 60 Inches",4..1,4599
915,PILLOW KING Plain White Pillow- 68x43cm Pillow Set of 2,4..1,
916,"Urban Magic Gold - 130TC Microfiber Purple, Red Geometric Triangular Printed Fitted Double Bedsheet with 2 Pillow Covers -...",4..1,"45,499"
917,XMBUGÂ® || Beautiful Set of 8 Pieces Diwan with 1 Single Bedsheet 2 Bolster Covers and 5 Cushions Covers | 60 x 90 Inches I...,3.9,"45,999"
918,Jiggly-Poo Baby Pillows for New Born 0-12 Months for Head Shaping with rai Seeds/Head-Shaping Mustard Seeds Baby Pillow (s...,3.6,4599
919,KAKUMANU Handloom 100% Pure Cotton Towels XXXL Size 36/72Inch(90/180cm) Multi Color (Pack of 4),5,"45,099"
920,"TCLPVC Bamboo Curtain (Brown, 48 X 60 Inches), Cordless",3.9,"45,500"
921,"KUDIZE Disposable Non Woven Face and Body Towel for Hospital, Hotel, Travelling, Spa & Beauty Parlor 70 GSM (25 X 50 INCH...",4.3,4575
922,"Elastic Fitted Cotton Feel Super Soft Glace Cotton Double Bed Bedsheet with 2 Pillow Cover Each Bedsheet for Bedroom, Gues...",2.7,4599
923,LASER WINGS Fiber Cushion/Pillow Fillers (12 X 18 INCHES) Pack of 2,4.4,"45,299"
924,Hanielz Coir Rope mat 17â€?x 30â€?( 43 cm x 76cm) | Natural Coir Mat,4.7,"45,499"
925,"BSB HOME 220 GSM Microfiber Reversible AC Comforter/Blanket for Winter/Quilt/Duvets for King Size Bed (230X250 cm, Light P...",3.9,"45,999"
926,"Oasis Home Collection Cotton Solid Round Table Cloth (Red, Pack of 1) 2 Seater",3.9,4599
927,"MM FOAM Life Companion Pillow - 100% Natural Latex,Thin Pillows,Set of 2 (25.5 x 16.25 x 4.75 inches)",4.1,"45,800"
928,"Galaxy Home Decor Premium Velvet Fabric Emboss Curtains for Door 7 Feet, Pack of 1, Brown (1Pc, Brown, 7 Feet), Washable",4.3,"45,499"
929,SHRI MADHURI Craft 240 TC Single Bed Organic Cotton Jaipuri Razai Bed Blanket Ac Quilt for Winter Soft Light Weight Rajast...,4.3,"45,200"
930,CASA-NEST Rectangular Anti-Slip PVC Solid Plain White Lace (60x108 inch) 8-10 Seater Centre Table Cover with Exclusive Bac...,4,4591.4
931,AASTIK Water Absorbing Doormat Non-Slip Floor mat for Bathroom Kitchen Bedroom Entrance with Water Proof Washable Rubber m...,3.7,4599
932,"Buganda Memory Foam Bath Mat Rug, Ultra Soft and Non-Slip Bathroom Rugs, Water Absorbent and Machine Washable Bath Rug for...",3.6,4549
933,Trunkin' Embroidered Table Runner Multicolor - 89*31 cm,4..1,"45,649"
934,Kuber Industries Men's Cotton Handkerchief (Multicolor) -Pack of 6,3.5,4529
935,"Fresh From Loom Chenille Velvet 500 TC Bed Cover (Brown_Double), 1 Double Bed King Size Bedsheet with 2 Pillow Cover, Size...",3.8,"45,199"
936,"HOMEMONDE Cotton Cushion Cover 16 x 16 Inches - Set of 2 Sofa Pillow Covers for Living Room, Bedroom Couch and Chair, ( Gr...",4.3,4599
937,JAMUWAL Glace Cotton 160 TC Diwan Cover Set (Green),3.3,4599
938,INDIAN CRAFT CASTLE Cotton Decorative Hand Made Cushion Covers Print Small Printed Design Sofa Cover Throw Pillow Designed...,4,4599
939,AMAB Madurkathi Mat | Korai Mat | Korai Pai for Sleeping | River Grass Mat | Seagrass Mat Portable Eco-Friendly Foldable K...,5,"45,200"
940,"Arka Home Products Pure Cotton Muslin Cloth (Natural, Bleached, Pre-Washed) White (2m x 1m)",4.3,4500
941,"OuTVEEN Polyester God Radha Krishna Printed Curtain for Temple Room Use Curtain, Pack of 1 Piece (Multicolor) (4 x 5 Feet ...",4.5,"45,000"
942,BSB HOME? 100% Microfiber Ultrasonic 280 Tc Solid King Size Quilted Bed Cover/Bedsheet/Bedspreads with 2 Pillow Covers/Cas...,4.6,"45,999"
943,"Mattress Cover 100% Cotton, Washable for Single Bed with Zip/Chain",4,4599
944,"HOKIPO Rubber Back Dirt Trapper Doormats for Entrance Big Size, Black, 48x78 cm",4,4599
945,Luxury Waxed Canvas Shop Apron | Heavy Duty Work Apron for Men & Women with Pocket & Cross-Back Straps | Adjustable Tool A...,4.6,"45,999"
946,"YUKANY Premium Tara Polyester Threads String Hanging Long Door Curtain for Living Room, Multicolour, 4 X 7 Feet, 1 Piece, ...",3.9,4599
947,MOM & SON Nappy Changing Mat/Sleeping mats/Water Proof Bed Protector with Foam Cushioned for New Born Baby Sheets (Colours...,4.2,4599
948,Flexon Dye Powdered Fabric Dye (Black)- 50g,3.6,4500
949,"BEAR GRIPS Duro 7 Striped Double-Colored Door, Home and Office mat Anti-Slip PVC Backing for dust Removal, wear-Resistant ...",4.4,"45,340"
950,"Kuber Industries Microfiber 50TC Body Pillow with Zippered Cover, Standard, Grey, 1 Piece 50 TC",3.6,"45,499"
951,Fabindia Cotton Printed Jaipuri Double Quilt-Tropical 1.5m x 2.25m,Get,"45,790"
952,"Shivam Enterprises Hand Block/Batik Printed Cotton Square Table Cloth (Gold | White Color Base, Pack of 1)",4.8,4599
953,"Vendola Rajasthani Satin 250TC Cushion Pillow Covers , Multicolour, Set of 5 (16X16 Inches, Lotus Cow)",4.2,"45,999"
954,"Royalking Floral Carpet (Red, Cotton, 5 x 6 feet), Pack of 1",3.7,"45,099"
955,Kriva Chair Cover Set of 4 | Elastic Fitted Dining Seater Cushion Covers | Elastic Protector | Stretchable Slipcover | Hyp...,5,"45,599"
956,"Handnit Water Absorbent Check Cloth,Cleaning Towel, Kitchen Napkins, Roti Napkin, Table Napkins, Superior Cotton, Duster, ...",3.7,4520
957,Khillayox Unisex Microfiber Large Size Bath Towel - 400 GSM/Extra Soft and Super Absorbent Bath Towels for Men and Women S...,3.9,4599
958,"BRICK HOME Floweret Stretchable/Spandex Printed Sofa Seat Protector, Pack of 2",4,4599
959,"Kanwar sa Microfiber Square Cushion Filler 16 inches X 16 inches, Sofa Pillow Set of 5",4..1,"45,499"
960,"MINSALESï¿½Spring Wire for Window Net Curtain Cord Kit with 10 Hooks for Hanging net Curtain, Voile, Party Decoration, Garde...",4.2,4599
961,"Cbadni Decor Plastic Curtain Rings Eyelet Rings (1.5 Inches) with Lock Pearl Color, Pack of (18)",4..1,4599
962,WL Printed Coir Mat 40x60 cm,4.4,4550
963,Khillayox Cotton Hand Towel (350 GSM/14 x 21 Inch) Set of 12 Pieces Medium Size Towel for Men's & Women's_Multicolor,3.5,4599
964,Adore Stuff Bedding and Mosquito Net Set with Sleeping Bag Combo Pack for 0-6 Month Babies - Green Heart Color,4.6,4599
965,"Faburaa Jute Table Linen, Table Runner for Dining Table (Grey, 12x72 Inch, 4-6 Seater)",4.8,"45,000"
966,Mylo Essentials Maternity Wedge Pillow - Soft PU HD Foam Pillow for Pregnant Women - Maternity Pillow for Back Pain - Anti...,3.8,4579
967,"Riftree Chenille Anti-Skid Muslim Islamic Jainamaz/Prayer mat, 4x2 feet or 117 x 69 cms (Brown)",3.9,4599
968,"RD TREND Polyester & Polyester Blend Floral Window Curtain, 4 x 5 ft, Aqua, Pack of 2 (PC-221, Eyelet, Washable)",3.8,4599
969,KK Home Store Decor Exclusive Royal Look Cotton Reversible Use Both Side Heavy Fabric 500 TC Floral Design 5 Seater Sofa C...,3.8,"45,999"
970,"Sk 1 pc ESD Safe Cleanroom Sticky Mat | 2 Feet x 3 Feet | 1 Mat, 30 Peelable Sheets",4.3,4599
971,Bombay Dyeing Iris Plus Series Queen Size Pure Cotton Beedsheet with Two Pillow Cover - Pink,Get,"45,949"
972,"Amazon Brand - Umi Satin Floral Cushion Covers Set of 5 Pieces (16X16 Inches, Kaas)",4.3,"45,999"
973,R.R.LALA Cotton Macrame Hand-Woven Knitted Square Pillow Cushion Cover 40x40 cm Ivory Pack of 1 Piece Color,4.1,4599
974,LOPUNNY New Perfect Collection Pink DOTT Print Poly Cotton 250 TC 1 Single Bedsheet with 5 Cushion Cover & 2 Bolster Cover,4..1,"45,299"
975,BSB HOME Premium 100% Microfiber Elastic Fitted Bedsheets with 2 Pillow Covers | Double Bed with All Around Elastic 180 TC...,4,"45,299"
976,"Inira Trendz Polyester Floral Window Curtain, 5 Feet, Purple, Wine, Pack of 1,Eyelet",3.6,4599
977,"HSR Collection Chenille Velvet Bolster Cover, Bolster Pillow Cover Set of 4, Round Pillow Cover Set of 4-32 x 16 inches | ...",4.2,4599
978,Jayvaam Sofa Cover with Cushion Cover and Table Cover - 3 Seater and 2 Seater Sofa Covers with Arm Set 16 Pcs - 3+1+1 Pane...,4.4,"45,499"
979,"TheYaYaCafe Canvas Cotton 180 TC Cushion Cover, 12 x 12 Inch, Black",4,4599
980,"Amazon Brand â€?Umi Polycotton Curtains for Door, Bedroom, Living Room,Room Darkening Curtain Set of 2 Curtains with Grommet",3.8,4599
981,"Somya Enterprises Chenille Muslim Islamic Prayer Mat/Janamaz Mat,Musallah (Maroon, 2x4 Feet)",4..1,4500
982,"MSR 116 Set of 10 Vertical Blinds Hanger for Windows(Bedroom, Bathroom, Kitchen, Balcony) etc (White, 10)",3.9,4500
983,"Styles Closet Polyster Round Ceiling Mosquito Net(Double Bed,6.5 * 6.5 ft) (Purple)",3.8,"45,599"
984,"Textilekart Cotton 150 TC Solupuri Bedsheet (Multicolour) Standard, Reversible Pack of 1",3.4,4599
985,"Arsh Fabs Modern Design Polyester Shaggy Bedside Runner, Soft Rug for Bedroom Living Room Kitchen (Mouse, 2x6 feet)",4,"45,599"
986,NISHOMES Packet Namkeen/Chocolate Printed Pillow for Decoration Same Print Both Side Size - 12x18 Inches Multicolor,4.8,4599
987,"Amazon Basics Lightweight Super Soft Easy Care Microfiber Solid Fitted Sheet Set with 14"" Deep Pockets, Twin, Celadon Green",4.6,"45,500"
988,Stylo Culture Banarsi Brocade Table Runner for Dining Table 4 Seater Yellow Gold Peacock Floral Traditional Table Top Deco...,4.3,"45,795"
989,"HOKIPO Large 45x75 Natural Coconut Coir Inside Outside Mats for Entrance Main Door Mat, Multi-Color (IN-487)",4.3,4599
990,Kuber Industries Hanging Cotton 2 Pieces Cotton Washbasin Napkin/Hand Towel for Kitchen and Bathroom (Multi) - CTKTC45547,3.7,4549
991,"indoAmor Silk Decorative Golden Striped Throw Pillow Cover Bedroom & Living Room Cushion Cover Set Sofa (16X16 Inches), Se...",4.2,"45,099"
992,Zawexar Â® Microfiber 500 GSM Bath Towels | (70x140) Extra Soft Plush & Quick Dry High Absorbency Large Size Towels for Bat...,4..1,4599
993,EVOHOME Â® Super Soft Plain Solid Polar/Fleece Heavy Single Bed Woolen Blanket 500 TC Quilt/Rajai/Comforter Blanket Single ...,3.8,"45,999"
994,Portico New York Printed Magnum Super Soft King Size Bedsheet with 2 Pillow Covrs,3.7,"45,999"
995,"Kaameri Bazaar Valentines Day Gift Combo Cushion Filler 12""x12"" with Filler,Teddy, Artificial Rose & Photo Magnet - Valent...",3.9,"45,299"
996,"AKIN TOWEL Cotton Multipurpose Cleaning Kitchen Towels Dish Napkin Machine Washable Checked Dish, Tea Towels (Multicolour,...",3.9,4599
997,Naturals Fabrics Premium Cotton GOTS-Certified Highly-Absorbent Pure Handloom Sustainable and Customizable Bath Towels (Pa...,3.6,4599
998,"MOMSEASYÂ® New Born Baby Bed Sheet Protector, Baby Urine Protector Sheet, Baby Dry Sheet Combo and Baby Born All Products C...",4.2,4570
999,"YUKANY Sheer Leaf Transparent (2 Cream Plain + 2 Cream Leaf) Net Curtains, 5 Feet, Pack of 4",4.2,"45,199"
1000,EarlyMart Cotton Comfort 144 TC Rajasthani Jaipuri Traditional Printed Double Bed Bedsheet with 2 Pillow Covers (Double_03...,3.5,"45,999"
1001,TheYaYaCafe Valentine Gifts for Husband Wife Canvas Cotton Good Things in Life are Better with You Throw Pillow/Cushion Co...,3.3,4585
1002,"Cushows Memory Foam Orthopedic Decorative Square Cushion Filler for Sofa, Chair, Bed, Couch & Car - [White] ; 20"" inch x 2...",4.2,"45,199"
1003,"ATMAH Coir Floral Door Mat - 40x 60cm, Slight variations in color",4.1,4549
1004,Femfairy 210 Tc Satin Solid Double Bedsheet (Queen) 90x100 inches 1 Bedsheet with 2 Pillow Covers for Home/Hotels/Guest Ho...,3.8,4599
1005,EMBROCOÂ® Cotton 12x12 Inches Cushion Fillers/Pillows - Set of 5,4.2,"45,499"
1006,Kuber Industries Cotton Bath Towel|Super Absorbent Towel|Bath Towel for Men and Woman|Lightweight & Odour Free|Brown,3.2,4599
1007,CASANEST Washable Jute Table Cover 6-8 Seater Pack of 1 Heat Resistant Table Cover for Kitchen Table/Dining Table Wedding ...,4.1,4599
1008,"Kwitchy Baby Cotton Mattress with Mosquito Net and Sleeping Bag Combo (0-6 Months, Pink)",4.1,"45,199"
1009,"Mandhania Solapur Chaddar Single Blanket Cotton,Rayon& Viscose Pack of 1 - Green",3.6,"45,250"
1010,"Amazon Brand - Solimo Memory Foam Pillow with Pillow Cover, King",3.3,"45,500"
1011,"SPREAD SPAINÂ® 100% Cotton Luxury Reversible Bathmat Super Absorbent Bathrug, Floor Mats, Non-Slip, Rug for Home, Kitchen a...",4,4550
1012,Webring Baby Waterproof Plastic Sheet Double Bed Full Size/Baby Adult Waterproof Protection Sheet for Mattress 78 cm x 72 ...,4..1,4599
1013,"Linenwalas Microfibre Mattress Padding/Topper for 5 Star Hotel Feel- White- 72"" X 78""",4.2,"450,000"
1014,"JAIPUR PRINTS 100% Cotton Rajasthani Jaipuri Traditional King Size Double Bedsheet with 2 Pillow Covers (Queen Size, Multi...",3.9,"45,299"
1015,"Cazimo Soft 100% Cotton Knitted Throw Blanket - 50 x 60 inches, Ivory",4.2,"45,999"
1016,FRESH FROM LOOM Sheer Curtains 9 Feet Long Door and Window | Net Curtain | Semi Transparent Tissue Screens Parda | Eyelet ...,4.1,"45,796"
1017,AYUS Super Soft Silicone Bathroom Mat Diatomite Door Mat Anti-Slip Bath Mat Quick Drying Absorbent Mat for Home and Kitche...,4..1,4599
1018,"Shyam Textiles Velvet Cute Smiley Sunflower Emoji Cushions with Fibre Filling Pillows | Cushion | Head Rest Use in Car, Ki...",4..1,4599
1019,"HOMECROWN Floral Pattern Cotton Blend Table Cover for Centre Table and 4 Seater Dining Table (60x40 Inch, Brown)(Rectangul...",3.8,4599
1020,"indoAmor Stripes Pattern Silk Cushion Covers (Black, 16x16 inches) - Set of 5 Pieces",4.1,"45,099"
1021,1 to 2 Years Baby Head Support Pillows Safe for Baby Kid 30-cm,3.1,"45,000"
1022,"WISELIFE 100% Cotton Luxury Bath Towel For Men & Women | Blue Bath Towel | Full Size Extra Large Towel (Pack of 1, 450 Gsm)",4,4525
1023,BSB HOME Premium Cotton Flat Double Bedsheets with 2 King Size Pillow Covers | Double Bed Breathable | Wrinklefree | Ultra...,4..1,"45,299"
1024,"ANICOZ Microfiber Hotel Quality Premium Fiber Soft Rectangular Cushion, Pillow Filler for Bed, Sofa, 12 x 24 Inch, White, ...",3.9,"45,599"
1025,"Sai Arpan Polyester Radha Krishna Printed Door Curtains || for Living Room, Hall Room, Bed Room || Long & Heavy || Durable...",5,4599
1026,Stylewell Set Of 1 (9 Mtr Roll and 4cm Width) 3-Line Zig Zag Gold Gota Trim Laces and Borders for Bridal Dresses Suits Sar...,4,4599
1027,Divik Crafts Jaipuri Printed Diwan Set with Two Bolester and Three Cusions Covers,4.6,4599
1028,"Heart Home Microfiber Square Throw Cushion Filler Bed and Couch Cushion Indoor Decorative Cushion, 12""x12""-Pack of 3 (Whit...",5,4599
1029,"Smart Shophar Steel Supreme Curtain Ring 1.5 Inches Silver Pack of 96 | Curtain Rod/Pipe | Heavy Plastic Ring, Hook, Ring ...",4,"45,199"
1030,Rabhnoor Damask Microfiber Fitted Elastic Queen Bedsheet (Pack of 1) D-30(Multicolor),4..1,4599
1031,"aRDENMEAD Cushion Cover Set of 2 Decorative Throw Pillow Covers with Embroidery. Blue Cushion Covers, Sofa Cushion Covers ...",4.3,4599
1032,"abracadabra Baby Bolsters for Side and Neck Support with Washable Cover, Size 35 cm X 10 cm, Set of 2 (Bambi & Friends)",3.6,4599
1033,UMEA DECOR Single Bed Bedsheet with Two Pillow Cover - Poly Cotton Single Printed Bedsheets for Bedroom Living Room - Sing...,3.8,4599
1034,"Emrish Enterprises Latest Laces & Borders Material (Width 1.5 cm) Qty 9 Meter for Trims,Borders,Embroidery Lace,Applique,F...",4.5,4599
1035,"Shree Ganesh Polycotton Fabrics Printed Single Bedsheet Without Pillow Cover (60x84 Inch, Pink)",4.5,4599
1036,SHOPHOX Smiley Emoji Cushions with Fibre Filling size-12 inch Velvet Soft Smilie Pillows Set of 5 Pieces Use in Kids & Gir...,3.6,"45,299"
1037,"Palatial Lifestyles Face Towels Set of 10, Superior Ring-Spun 100% Cotton, Size- 30x 30 cm (2 Each of Baby Pink,Yellow, Se...",3.9,4599
1038,"STITCHNEST Floral Printed Canvas Cotton Cushion Covers, Set of 5 ( 18 x 18 Inches )",4.2,4599
1039,"Encasa Homes Chenille Textured Fabric Decorative Soft Rich Cloth with Plain Colours for Sofa, Furnishing, Upholstery, Curt...",4.1,4500
1040,KK Home Store Decor Exclusive Royal Look Cotton Reversible Use Both Side Heavy Fabric 500 TC Floral Design 5 Seater Sofa C...,3.8,"45,999"
1041,BSB HOME Premium Forever Modern Style Glace Cotton Floral Luxurious Beautiful Soft Comfort Designer Floral Pattern 1 Doubl...,5,4599
1042,Jashan Prime Collection Combo Pack of 6 King Size Pillow Covers | 200TC Soft Brushed Glace Cotton -Long Lasting & Wrinkle ...,3.2,"45,999"
1043,ACZO FEEL Double Bed Blanket Mink Blanket for Heavy Winter Ac Solid Double Bed Blanket Super Soft Light Winter Blanket (Mu...,3.3,"45,999"
