Rank,Name,Ratings,Price
1,BSB HOME Premium Cotton Elastic Fitted Bedsheets with 2 King Size Pillow Covers | Double Bed with All Around Elastic 180 T...,3.7,"45,999"
2,"UrbanLeaf Super Soft Microfiber Designer Hand Towels (Multicolours) - 4 Pieces, 400 GSM",4.2,4599
3,"HSR Collection Microfiber Wash Basin Hanging Hand Kitchen Towel Napkin with Ties (44x24 cm, Pack of 4, Multicolor), 200 GSM",3.8,4599
4,"Lukzer 6PC Elastic Stretchable Dining Chair Cover Universal Protective Slipcover (Beige Lining Design / 6Covers), Polyester",4.1,"45,299"
5,Kuber Industries Table Cloth|Center Table Cover|Round Table Cover|Table Cover 4 Seater|Gold,3.9,4529
6,WE CLEVER Polyester Spandex Printed Chair Cover Pack of 4 Stretch Removable Washable Short Dining Chair Cover Protector Se...,3.9,"45,999"
7,Classic Mosquito Net for Double Bed | King Size Foldable Premium Machardani | Extra Mosquito Protection | Polyester 30GSM ...,4.2,"45,000"
8,Wolpin Anti-Slip Kitchen Cabinet Drawer Shelf Mat Liner Sheets (45 cm x 3 m Roll) Waterproof Strong Table Mat for Bathroo...,4.1,4599
9,Kuber Industries 2 Pieces Cotton Luxurious Pillow Cover|Ultra Soft Satin Striped Pillow Case|Breathable & Wrinkle Free|Pac...,3.8,4559
10,"Novo Baby Monthly Milestone Blanket | 1 to 12 Months | Best for Newborn Boy & Girl, multicolor, Cotton, skin friendly",4.6,4589
11,Kuber Industries Center Table Cover|Cotton Center Table Cover for Living Room|Table Cloth for 4 Seater|Maroon,4.2,4538
12,Kuber Industries Table cloth|Transparent Center Table cover|Round Table Cover|Table Cover 4 Seater|,3.7,4529
13,Roseate Egyptian Super Soft (40x60 cm) Microfibre Solid 2000 GSM Bath Mat Super Absorbent Anti Skid Mats for Bathroom/ Bed...,4,4599
14,Sellsfly Hair Towel Wrap Absorbent Towel Hair-Drying Bathrobe Magic Hair Warp Towel Super Quick-Drying Microfiber Bath Tow...,4.2,4599
15,"AAZEEM Durable Door Mat for Home | Cotton Door Mat for Bedroom | Door Mat for Kitchen | Multicolor | Standard Size Mat, Pa...",3.6,4599
16,Khillayox Microfiber Small Size Face Towel/Handkerchief/Rumal - 400 GSM/Extra Soft and Super Absorbent Face Towels for Wom...,3.9,4599
17,"Wakefit Hollow Fibre Pillow (White and Grey, 68.58 Cm X 40.64 Cm, Microfiber)",4.5,4542
18,"haus & kinder 100% Cotton French Riviera Beau Papillon Modern Bedsheet with 2 Pillow Covers, 186TC, Size 100 Inch by 90 In...",4.2,"45,999"
19,"Story@Home Room Darkening Thermal Insulated Eyelet Noise Reducing Blackout 2 Piece Faux Silk Ring top Door Curtain, 7 fee...",4.2,"45,398"
20,"Yaanthiv's Bath Towels, Pack of 4 Cotton Towels (Full, 4), 300 GSM",3.8,4599
21,"Haus & Kinder Garden Floral Magic Print, 100% Cotton Double Bedsheet with 2 Pillow Covers, 186 TC, Size 100 Inch by 90 Inc...",4.1,"45,999"
22,"Mother Sparsh Natural Mosquito Repellent Fabric Roll-on for Babies, 3-Way Protection from Mosquitoes, Fleas and Ants (12m...",3.9,4598
23,"MYTHOS Cotton Multi Color Striped Hand Towels High Absrobent Set of 12 , 12X 18 inch",3.5,4599
24,Kuber Industries Transparent Table cloth|Center Table cover|Round Table Cover|Table Cover 4 Seater|,3.6,4589
25,Welspun 100% Cotton Bath Towel Quick Dry HIGH Absorbency Attractive Border (Solid 70CMX137CM)-SEA Green,4,4599
26,"AmigosÂ® 100% Cotton Curtains for Door Bedroom, Living Room and Kids Room, Home DÃ©cor Fashion Printed Set of 2 Curtains wit...",4,"45,999"
27,SPIEx-cell Excell loomtex Presents Diamond_Sofa Cover of Exclusive Royal Look Velvet Sofa Cover Set of Heavy Fabric 500 TC...,3.5,"45,299"
28,"Vintageware Handcrafted Wooden Kitchen Tissue Paper Roll Holder Stand (Gem Top) | Kitchen Accessories Item | Tissue Paper,...",4.2,4599
29,MY NEWBORN 3-in-1 Hooded Baby Blanket Wrapper - Pack of 2 (Solid Pink and White) | Towel for Baby Boy and Girl | All Seaso...,4.1,"45,800"
30,BSB HOME Premium Cotton Elastic Fitted Bedsheets with 2 QueenSize Pillow Covers | Double Bed with All Around Elastic 180 T...,4.1,"45,299"
31,"Amazon Basics Reversible Microfiber Comforter - Single Large, Black, Pack of 1",4.1,"45,900"
32,Home Sizzler 144 TC Microfibre Kid's Giraffe Double Bedsheet with 2 King Size Pillow Covers (Yellow),4,"45,199"
33,"MAFATLAL 100% Cotton, Super Absorbent Large Size 2 Piece Bath Towel Set, 450 GSM",4..1,"45,199"
34,Sk Online Services Foldable Polyester Single Bed Foldable Mosquito Net/ Macchardani For Adults With Base| 30Gsm Mosquito N...,3.9,"45,999"
35,Kuber Industries PVC Anti Skid Welcome Door Mat (Blue)-CTLTC11177,3.8,4598
36,linenaffairs Micro Filled Grey Print Print Cotton Pillow/Takiya Combo Set of 2 for Bed Room - 20x30 Inch,4.3,4599
37,"Amazon Brand - Solimo Floral Flakes 144 TC 100% Cotton Double Bedsheet with 2 Pillow Covers, Blue",4.1,"45,400"
38,"Homefab India Royal Silky Grommet Door Curtain - 7 feet, Coffee - 2 Piece",4.1,"45,199"
39,Superminis Digital Print Cotton Bedding Set Thick Base Foldable Blue with Mosquito Net and Head Pillow - Zip Closure (Gree...,4,"45,599"
40,"VERDIOZ White Embroidery Cotton Mosquito Net for Double Bed Machardani, Mosquito Net for Bed King Size, for Adult | Kids |...",4.1,"45,199"
41,"SVH Bathroom mat Water Absorbent mats Diatomite Door Mat Anti-Slip Bath Mat Quick Drying Absorbent mat for Home, Kitchen (...",4.3,4599
42,Kuber Industries Cotton 5 Seater Sofa Cover with Center Table Cover|Premium Cotton Fabric & Side Flower Design|Cutting Edg...,3.8,4549
43,Crafties Art Double S Shaped Wrought Iron Tissue roll Holder (Big S Napkin Holder),4.3,4599
44,BSB HOME Premium Cotton Elastic Fitted Bedsheets with 2 King Size Pillow Covers | Double Bed with All Around Elastic 180 T...,3.9,"45,299"
45,"Amazon Brand - Solimo Microfibre Reversible Quilt Blanket/Comforter, Double, 120 GSM, Sandy Beige and Deep Teal",4.2,"45,000"
46,KANUSHI Industries Apron For Kitchen Waterproof With Side Pocket- Set of 2 (APRN-2-SCL-BLUE+BLACK-SID) (APRN-2-SCL-BLUE+BL...,3.9,4599
47,Kuber Industries Kitchen Drawer/ Cabinet Shelf Mat|Flower Design With PVC Material|Adjustable Size 5 MTR Roll (Cream)-KUBM...,4.1,4599
48,Huesland by Ahmedabad Cotton Pillow Cover Set (2 Pcs) - 18 x 27 inches,4.1,4599
49,Rakhi Pillow Microfiber Soft White Pillows Set of 2 16 x 24 Inches Or 40 x 60 cm Well-Filled Pillows for Sleeping.,4..1,4599
50,Divine Casa 120 GSM Polyester Reversible Lightweight Printed Single Bed AC Dohar Blanket - A Dark Blue and Grey,4.3,"45,599"
51,Leaf Dew 100% Cotton 500 GSM Large Full Size Hand Towels Set of 6 for Bathroom & Kitchen 60 X 40 cm (Grey & Navy Blue),4.1,"45,194"
52,Dolphers Waterproof Plastic Mattress Protection Sheet for Baby and Adult - Double Bed/King Size - 7.5 x 6.5 feet - Blue,4.1,4599
53,"VINAYAKAMART Ganesh Backdrop for Decoration Cloth, Size 8x5 feet (VINAYAKA 6)",4.4,4599
54,"PINK PARROT Dupion Silk 150TC Cushion Cover, 16x16 Inch, Multicolour, Set of 5",4.3,"45,299"
55,Miho Bamboo Wood Table Placemat (6 Pcs) | Heat Resistant Hot Pot Coaster | Cup Mat Tea Coaster Dining Table Accessory | Ki...,4.2,"45,999"
56,"Yellow Weaves Pvc Rectangular Dining Table Placemats - Black Grey, Set Of 6(Polyvinyl Chloride)",4.2,4599
57,"Home Sizzler 1 Piece 100% Blackout Eyelet Polyester Door Curtain, 7ft, Black",4.3,4599
58,Fareto Baby Mattress with Mosquito Net(0-6 Months) (Peach),4.2,4599
59,"Tex Homz Artificial Grass Mat Carpet for Balcony - Floor Mat (Green, Polypropylene, 45 X 70 CM)",3.9,4599
60,"Amazon Brand - Solimo Premium Anti-Slip Microfibre Bathmat - 80cm x 50cm, Dusty Lilac",4.4,"45,000"
61,"RENVA Doormats Quick Drying Bathroom Mats & Water Absorbent Door Mat for Home ,Water Absorbing Non-Slip Bathroom Floor mat...",4.5,4599
62,"BabySphere Nappy Changing Mat one side cotton plastic cushioned Bed Protector Waterproof sheets, Washable, Reusable,(Pack ...",3.8,4599
63,"MY NEWBORN Baby Bath Towel (Multicolour, Set of 5) | 0 - 12 Months | Boy Girl Baby Wrap | Hooded Baby Towel Soft Fabric | ...",3.9,"45,000"
64,"Cloth Fusion 100% Cotton 500 GSM Bath Towels | Extra Soft & Absorbent Large Size Towels for Bathing | Set of 2, (Teal & Navy)",4.1,"45,299"
65,"Home Sizzler 2 Piece Garden Panel Eyelet Polyester Window Curtains - 5 Feet, Maroon",4.2,4599
66,"Kuber Industries Cotton Oval Door Mat for Porch/Kitchen/Bathroom/Laundry Room,(Black) 54KM3948",3.3,459
67,Kuber Industries 400 GSM Cotton Bath Towel|Super Absorbent Towel|Bath Towel For Men And Woman|Lightweight & Odour Free|WHITE,3.2,4539
68,"ELEVANTO Women's Collection Half Sleeve Soft Terry Cotton Bathrobe (Free Size, Maroon)",3.8,4599
69,"The White Willow Memory Foam Infant Baby Pillow for Preventing Head for Flat Head Syndrome Ideal for 0-12 Age -( 9.8"" L X ...",3.9,"45,399"
70,"Amazon Brand - Solimo Animal Farm Microfibre Printed Quilt Blanket/Comforter, Single, 120 GSM, White, reversible",4.4,"45,400"
71,"la' amour Prime Collection Offered 180TC Single Bedsheet Size, 60X90 with 1 Matching Pillow Covers Size, 17X27 Color-White...",3.6,4599
72,Kuber Industries Lining Design Wardrobe Kitchen Drawer Cupboard Cabinet Shelf Mat|Water Proof DustProof||5 MTR Roll|Size 5...,3.8,4599
73,"ZOSOE Cervical Contour Memory Foam Pillow, Orthopedic Pillow for Neck Pain, Orthopedic Contour Pillow Support for Back, St...",4.8,4599
74,"UNIBLISS Cotton Floral Rajasthani Jaipuri Traditional Double Bed Bedsheet with 2 Pillow Covers (Blue, King Size)",3.3,"45,299"
75,HomeCloud Magnetic Curtain Tiebacks Curtain Drape Holdbacks Clips Rope Holder Buckles for Home Bedroom Office (1 Pair 2pc...,3.8,4599
76,"Kuber Industries Floral Design Virgin Viny Soft Microfibre Dining Table Placemat Set, Pack of 6, Gold, Polyester",3.7,4599
77,Kuber Industries Kitchen Drawer/Cabinet Shelf Mat|Flower Design with PVC Material|Adjustable Size 5 MTR Roll (Cream)-CTKTC...,3.9,4599
78,Ahmedabad Cotton Pillow Cover / Case Set (2 Pcs) - 18 x 27 inches,4.1,4599
79,"Voltonix Bathroom Mat,Door mat Door Mat Quick Drying Water Soak Bathroom Mats Anti Slip Big Size Water Absorbing Floor Was...",4.7,"45,099"
80,"Zollyss Silicone Dish Drying Mat for Kitchen Counter, Extra Large Counter Mat, Heat Resistant Slip-Proof Tray Folding Drai...",3.9,4599
81,BSB HOME Premium Double Bedsheet with 2 Pillow Covers - 160 TC Supersoft Microfiber - Breathable & Wrinkle Free - 3 Pcs Se...,3.4,4599
82,Solo Desire Super King Size Elastic Fitted Bedsheet Glace Cotton 108x108 inch with 2 Pillow Cover(78*72+10 inch Mattress)...,4.5,"45,999"
83,"FOVERA Adjustable Bed Wedge Memory Foam Pillow with 7 Ways of Elevated Inclines for Acid Reflux, GERD, Snoring, Heartburn,...",4.2,"45,690"
84,"Sathiyas Cotton Bath Towel 480 GSM (Set of 5, Blue, White, Green, Pink, Orange, 85 cm X 165 cm)",4.2,"45,635"
85,"Sleepsia Pillows for Sleeping - Ultra Soft Two Bed Pillows for Side, Front and Back Sleepers (White, 2 Piece) 24"" X 16"" (S...",3.5,4599
86,"NISCHAY Stainless Steel Curtain Bracket Finials /Holders for Window/Door with Support (Silver Pack of 12), Pair of 6 (CB-5...",3.9,4599
87,Fashion String 144 TC Microfibre Blue Double Bedsheet with 2 King Size Pillow Covers,3.7,4599
88,REVEXO Plastic Table Rectangular Placemat Mat (44X29 cm) - Set of 6,3.9,4599
89,"KEXES Non Slip Shower Mat with Friction and Suction Cup Anti Slip Bath Mats with Drain Hole in Middle for Shower Stall, Ba...",2.6,4599
90,"Huesland by Ahmedabad Cotton 144 TC Cotton Bedsheet for Double Bed with 2 Pillow Covers - Grey, Black & White",4.2,"45,399"
91,"Wakefit Fitted Bedsheet, Elastic Fitted Bedsheets Queen Size, Bedsheet for Double Bed Elastic Fitted,144 TC 100% Cotton Pr...",4.4,"45,199"
92,"Sterling Mosquito Net for Single Bed, Mosquito Net Queen Size Bed, Foldable macchardani Single Bed 4x6 Size Bed (Royal Blue)",3.9,"45,250"
93,INFERNO Anti-Slip | Quick Drying Bathroom Soak mats | Floor Rugs & Water Absorbing Floor Mat | Anti-Skid Foot Mat | Door C...,3.9,4599
94,"Urban Space 100% Cotton Curtain for Door, Bohemian Curtain 7 feet Long Curtain with Eyelets , 1 Piece Curtain ( Door 7 fee...",4.3,4599
95,"Divine Casa Microfibre All-Weather 120 GSM Reversible Single Bed Quilt Comforter Blanket - (Blue and Orange 1, Geometric)",4.2,"45,999"
96,"Home Ecstasy 100% Cotton Double Bedsheets with 2 Pillow Covers Cotton, 140tc Floral Yellow Bedsheets for Double Bed Cotton...",4.1,"45,599"
97,"Kuber Industries Mattress Protector Sheet|Water Resistant & DustProof|Breathable Fabric, Size 198 x 198 cm (Pink, Plastic)",3.5,4528
98,"JY Hotel Quality Conjugated Polyester Fiber Filler Cushion (16 X 16 Inches, White) - Set of 5",3.8,4599
99,Huesland by Ahmedabad Cotton 144 TC Cotton Bedsheet for Double Bed with 2 Pillow Covers - Beige & Green,3.9,4595
100,"Amazon Brand - Solimo PVC Wardrobe and Kitchen Cupboard cum Shelf Mat Liner, Floral, 5 Meters, Blue ,Polyvinyl Chloride",4.1,4500
101,Toddylon Baby Bedding Set for New Born Play Gym Bed (0-6 Months) Blue,4,4599
102,Heart Home Square Microfiber Filled Cushion Filler|Soft & Fluffy Pillow|Washable & Odorless|Dust Mite Resistant |Ideal Siz...,3.3,4599
103,"Recron Certified Bliss Fibre Pillow - 43 cm x 69 cm, White",4.1,4549
104,"BSB HOMEÂ® 100% Cotton 160 TC Small Leaf Printed Double Bedsheets with 2 King Size Pillow Cover, (90X90 Inches, 7 x 7.5 Fee...",4..1,4599
105,"ST SAPROSE Â® Polypropylene Round Trivet (3 PCS Set, Size: 23 cm) Pot MAT, Side Table Mat, Machine Washable Small Place Mat...",4.5,4550
106,"Woodonick Decorative Wooden Tissue Paper Rack Napkin Holder with Toothpick Stick & Holder for Dining Table, Tissue Paper S...",4.9,4599
107,"BSB HOME Cotton Pillow Cover / Case Set (2 Pcs) - 18""x28"" inches, Grey&White",3.8,4599
108,"BRANDONN Fleece Newborn's 3-in-1 Wrapper, Baby Blanket, Bathgown (Dott Kitty)",4.3,4599
109,"Sleepsia Large Fluffy Ultra Soft Hotel Pillows for Sleeping 17"" X 27"" Comfortable Machine Washable Down Alternative-Microf...",3.7,"45,150"
110,Sakoraware Water Absorbent kitchen mat for wet utensils Microfiber Dish Drying Mat for Kitchen Utensils |dish splash proof...,4.3,"45,699"
111,"Kuber Industries Horse Design PVC 6 Piece Dining Table Placemat Set with Tea Coasters (Brown-CTKTC032183, Standard, Polyvi...",3.8,4539
112,"DAILZ Ethnic Velvet Touch Abstract Chenille Carpet - 55""x80"", Maroon",3.8,"45,499"
113,Home Dressing New Born Baby Soft Head Support Pillow with Mustard Seeds (New Born 0-9 Months Age Group) (Yellow),4.2,4599
114,"Yellow Weaves Jute Texture Cushion Covers, 16 X 16 Inches, Beige, Set of 5",4.3,4549
115,Kuber Industries Multipurpose Textured Super Strong Anti-Slip Mat Liner|1.5 MTR Roll & Easy To Cut|Size 150 x 45 CM (Brow...,3.7,4529
116,"Stratize Mattress Lifter Tool - Mattress Wedge Elevator, Bed Making Aid, Change The Sheets Instantly, Save Time and Energ...",4.6,4599
117,"RANGBHAR Handloom Cotton Single Bedsheet Without Pillow Covers, Woven Striped Bedcover, 60 x 90 inch, Green",4.1,4599
118,The White Willow Cervical Pillow Orthopedic Memory Foam Cooling Gel Regular Size Contour Neck and Shoulder Pain Relief Sup...,4,"45,399"
119,"HEELIUM Small Hand Size Bamboo Towel (40 x 65 CM), Antibacterial & Ultra Soft, 600 GSM, Set of 2 (Blue, Grey)",4.4,4599
120,"haus & kinder Victorian Summer Dream, 100% Cotton, 186 Thread Count, Double Bedsheet with 2 Pillow Covers (Multicolor)",4,"45,999"
121,STAR WORKShelf liner Star Work 30x300 Cms Shelf Liners for Kitchen Shelves | Cabinet Cupboard Liner Sheets | Wardrobe Mat ...,3.8,4599
122,"Amazon Brand - Solimo Ditsy Dale 144 TC 100% Cotton Double Bedsheet with 2 Pillow Covers, Blue",4.2,"45,400"
123,"Creative Idea Â® Traditional As Well As Polyester Antiskid Modern Rangoli Door Mat for Home Decoration (24x24 Inch, Brown)",3.1,4599
124,"Kuber Industries PVC Dot Print Both Sided Bed Server Food Mat, Bedsheet Protector For Home 36""x36"" (Brown) 54KM4339",4,4599
125,First Kick Baby Blankets New Born Combo Pack of Hooded Wrapper Sleeping Bag and Baby Bath Towel for 0-6 Months Baby Boys a...,4.4,"45,499"
126,JY Breathable Cotton Fabric Sleeping Pillow with Grey Cotton Filling - Medium Hard | Pack of 2 |,3.9,4599
127,"Elegant Homes Cotton Flowered 5 Seater Sofa Cover (Coffee, Brown , Standard)- Set of 6",3.7,"45,150"
128,"RED CRUSH Plastic Floral Floor Mat for Decorations (Multicolour, 6 X 6 ft)",3.6,4599
129,amazelo cart Polypropylene Anti Skid Door Mat for Entrance - Modern Stylish Washable Floor Rug Bath Mats for Home Office B...,4.4,"45,399"
130,"haus & kinder Serene Floral Art, 100% Cotton Bedsheet with 2 Pillow Covers, 186 TC, Size 100 inch by 90 inch Double Size (...",3.8,"45,999"
131,"Lukzer (3 Seater/180cm-230cm, Dark Blue Lining Elastic Universal Stretchable Sofa Cover with 2 Free Cushion Cover,Polyester",3.5,"45,499"
132,"Kuber Industries Hanging Cotton 2 Pieces Cotton Washbasin Napkin/Hand Towel for Kitchen and Bathroom (Multi) - Ctktc45537,...",3.5,4549
133,"Amazon Brand - Solimo Premium Anti-Slip Microfibre Bathmat - 60cm x 40cm, Light Taupe and Steel Grey, Pack of 2",4.3,"45,150"
134,Netfly Mosquito Net Mesh Planet Mosquito Net For Window 3/4Feet(90/120Cm) 35/47Inches 1 Year Guarantee Already Stitched Wi...,3.9,4599
135,"northwest trap & Canvas Cotton Duck Canvas Cloth, 10Oz., Natural Color, 60"" Width",4.2,4599
136,"OYO Baby Mustard Seeds (Rai) Pillow Cotton,New Born Baby Cotton Soft Fabric Musterd Seeds Rai Pillow for Baby Head Shaping...",4.6,4549
137,"Home Ecstasy Cotton Fitted King Bedsheets with 2 Pillow Covers Cotton, 140tc Geometric Yellow Bedsheets for King Bed Cotto...",4.1,"45,199"
138,BSB HOMEÂ® Premium Cotton Mattress Cover/Protector with Zipper Chain|Provides All Around Protection with 360Â° Encasing |Diw...,4,"45,999"
139,"Yellow Weaves PVC Wardrobe/Drawer/Kitchen Shelf Liner Mat (Brown, 5 Meter Roll), Polyvinyl Chloride",4.1,4599
140,"Kuber Industries Microfiber Square Chair Pad Seat Cushion for Car Pad, Office Chair, Indoor/Outdoor, Dining Living Room, K...",3.9,4519
141,"AEROHAVENâ„?Set of 5 Abstract Decorative Hand Made Jute Throw/Pillow Cushion Covers - (Multicolor, 16 Inch x 16 Inch)",4.1,4599
142,"JY Coccyx Seat Cushion for Office Chair, Desk Chair Car Seat Cushion for Tailbone Pain, Orthopedic Memory Foam Coccyx Seat...",3.7,4599
143,BSB HOME Premium Cotton Feel Elastic Fitted Bedsheets with 2 King Size Pillow Covers | Double Bed with All Around Elastic ...,4.4,"45,599"
144,"RANGBHAR Handloom Cotton Double Bedsheet Without Pillow Covers, Woven Striped Bedcover, 90 x 100 inch, Green",4,4599
145,"Fernish Decor Jute Round Rug (Beige, 3 Feet, 1 Piece)",4.3,"45,599"
146,"RANGBHAR Handloom Cotton Double Bedsheet Without Pillow Covers, Woven Striped Bedcover, 90 x 100 inch, Blue",4.2,4599
147,"Zoliva Memory Foam Cervical Contour Pillow for Neck Pain and Spondylitis, Back Support, Side Sleepers (1), pack of 1, White",4.1,"45,499"
148,"RANGBHAR Handloom Cotton Single Bedsheet Without Pillow Covers, Woven Striped Bedcover, 60 x 90 inch, Orange",4.2,4599
149,"Sharma Clothing Mustard Seeds (Rai) Pillow Cotton,Baby Head Shaping Takiya Detachable Mustard/Rai Seed Pouch for Easy Wash...",3.9,4599
150,"BALLEY Unique Cute Elephant Cartoon Blue Printed Canvas Jute Cushion Covers, Set of 5 (12 x 12 Inches)",4.3,"45,199"
151,"Colorish 120 TC Cotton Blend Mandala Printed Floral Jaipuri Bedsheet for Double Bed King Size with 2 Pillow Covers, Sea Green",4,4599
152,"Meliora Hand Press Manual Water Pump Dispenser for 20 Litre Drinking Bottle or Can for Home, Office or Outdoor (Support Al...",3,4599
153,"Kuber Industries PVC Wooden Print Both Sided Bed Server Food Mat, Bedsheet Protector For Home 36""x36"" (Dark Brown) 54KM4342",3.9,4599
154,"PIXEL HOME DECOR Apron with Oven Mitt and Pot Holder with Kitchen Towel (Pink Blossom), 60cmx85cm",4.3,4570
155,"RD TREND King Size Microfiber Cotton Feel All Over Elastic Fitted Double Bedsheet(72 X 78 X 8 Inch) with 2 Pillow Covers, ...",4,4599
156,"SHADES OF HOME - Heavy Fabric Velvet Protective Sofa Cover 3 Seater , Grey",4.1,"45,998"
157,"SHAVIN PVC Solid Transparent 15mm Thick AC Door Curtain 7FEET (54in X 84in, White, Waterproof)",3.6,4506
158,SHISHIR Handloom Bhagalpuri Cotton Chadar/Topsheet/Thin Layer Blanket 250 TC Pure White Premium (Single Size) Pack of 1,3.8,4550
159,"SARAL HOME EASY LIVING Saral Home Microfiber Striped Anti-Skid Set Of 2 Bathmats (Brown,35X50 Cm)",4,4549
160,"AEROHAVEN Set of 5 Multi Colored Decorative Hand Made Jute Cushion Covers - CC14 - (16 Inch x 16 Inch, Multicolor)",4.2,4599
161,HOTKEI Pack of 6 Wine Color Elastic Stretchable Dining Table Chair Seat Cover Protector Slipcover for Dining Table Chair C...,3.9,"45,499"
162,Kuber Industries Kitchen Drawer/ Cabinet Shelf Mat|3D Checks Design With PVC Material|Adjustable Size 10 Mtr Roll (Brown)-...,3.9,4549
163,"THE WOOD WHITE Soft Microfiber Hug Pillow for Sleeping 18 x 54 inch, Full Body Pillow, Long Pillow for Bed, Pregnancy Pill...",4,"45,499"
164,aRDENMEAD Set of 2 Decorative cottonThrow/Pillow Cushion Covers with Terry Embroidery. Cotton Cushion Cover Set for You So...,4.4,4599
165,Shankara Reversible Striped Multicolor Cotton Blend Heavy Door Mat Bath Mat Combo for Home Decor Indoor and Outdoor Usage...,3.8,4599
166,"Kuber Industries PVC Double Bed Sheet, Pink, 6.5 * 6 Feet - Ctktc22295(Polyvinyl Chloride)",3.6,4520
167,Kuber Industries LPG Cylinder Cover|3 Layered Quilted Cotton & Water Resistant|Hut Design Plus Perfect Fit (Blue),4.4,4549
168,CARTSHOPPER Memory Foam Bathroom Door Mat 80 cm X 50 cm Coral Velvet Super Non-Slip Rapid Water Absorption Soft and Comfor...,4,4599
169,"HSR Collection Chenille Bolster Pillow Cover Set of 2, Round Pillow Cover Set of 2-32 x 16 inches | Maroon",3.9,4599
170,"Special You haldi Backdrop Decoration Cloth with Yellow net Curtain Fabric for Ceremony Photo Shoot, Wedding Party , Stage...",3.8,4599
171,"Amazon Brand - Solimo Premium Anti-Slip Microfibre Bathmat - 80cm x 50cm, Dusty Turquoise",4.5,"45,000"
172,"JY Cotton Floor Cushion - Soft & Thick Cotton Filler - Large Size Sitting Cushion for Sofa, Reading Book, Living Room, Bal...",3.7,4599
173,"VARNIRAJ IMPORT & EXPORT WITH V LOGO Car Travel Inflatable Car Bed Mattress with Two Air Pillows, Car Air Pump and Repair ...",3.6,"45,999"
174,"Amazon Brand - Solimo 120 TC 100% Cotton Double Bedsheet with 1 Pillow Covers, Autumn Leaves (Maroon)",4.1,"45,100"
175,Kuber Industries Chair Pad|Chair Cushion Pad|Chair Cushion Square Chair Pad/Cushion|Quilted Microfiber Fabric|Soft & Comfo...,3.8,4599
176,"Kuber Industries Dining Table cover 6 Seater|Table Cloth|Table Cover For Home, Restaurant|Bamboo Design (Brown)",4.2,4599
177,"Bhavyam Water Absorbent mats for Bathroom Kitchen,Soft Non Slip Memory Foam Bath mat for After Shower,Comfortable Washable...",3.9,"45,000"
178,Kuber Industries PVC Gold Bordered Rectangular 6 Seater Dining Table Cover (Transparent),3.8,4598
179,"BLOCKS OF INDIA Hand Block/Batik Printed Cotton Rectangular Table Cloth for 6 Seater Dining Table (60 Inch X 90 Inch, Pink...",4.2,"45,299"
180,"Destiny Egg Seater, Cushion Seat Flex Pillow, Gel Orthopedic Seat Cushion Pad for Car, Office Chair, Wheelchair, or Pressu...",3.4,4599
181,Wolpin Anti-Slip Kitchen Cabinet Drawer Shelf Mat Liner Sheets (45 cm x 3 m Roll) Waterproof Strong Table Mat for Bathroo...,4.6,4599
182,"FAMOUS ART INDUSTRIES Tissue Paper Freestanding Tissue Dispenser for Kitchen Countertops, Dining, Picnic Table, Indoor & O...",4.2,4547
183,"Kuber Industries Table Runner Virgin Vinyl, Soft Fabric Design Might Be Vary as per Availability (Gold)",3.8,4588
184,"Kuber Industries PVC 6 Piece Refrigerator Drawer Mat Set - White (KI0062694), Polyvinyl Chloride",4.1,4578
185,TIB Floral 100% Cotton Elastic Fitted Bedsheets King Size - King Size Bedsheet with Elastic Fitted Size 78 x 72 - Yellow B...,4,"45,599"
186,"Primeway Polyester Microfibre Dish Drying Mat, 240 GSM, 40x36cm, Black",4.1,4595
187,"Story@Home Cotton 450 GSM Ultra Soft, Super Absorbent, Antibacterial, Gym, Workout, Yoga Hand Towel (Blue, Set of 2)",4.1,4599
188,Saral Home Cotton Printed Rug Set of 2 (Grey 45x70 & 50x80 Cms),4.3,4599
189,"Kuber Industries Traditional Carpet/Pooja Mat|Square Shape & Soft Velvet Material|Maditation Prayer Mat|Size 60 x 60 CM,Pa...",4.1,4579
190,"la' amour Prime Collection Offered 180TC Single Bedsheet Size, 60X90 with 1 Matching Pillow Covers Size, 17X27 Color-Pink ...",3.6,4599
191,"ECOTEX - Cotton Blackout Curtains 7 Feet Long for Door, Set of 2, Baige Color",4.4,"45,299"
192,Bedspun Flora Collection Combo Pack of 4 Double Bedsheet with 8 Pillow Covers | 150 TC Soft microfiber - Long Lasting and ...,3.7,"45,996"
193,"Kuber Industries Flower Printed PVC Stain Resistant, Anti-Skid, Waterproof 6 Pcs Placemats with 6 Pcs Tea Coasters Set for...",3.8,4599
194,"Car Seat Headrest Neck Rest Cushion, Car Seat Neck Pillow 100% Pure Memory Foam Neck Pillow with Breathable Removable Cove...",3.6,"45,500"
195,"ALDIVOÂ® Gift for Mother | Gift for Mom | Gift for Maa | Combo Pack (12"" x 12"" Cushion Cover with Filler + Printed Coffee M...",4.4,"45,299"
196,"TS WITH TECHSUN Super Absorbent Floor Mats, Quick-Drying Bathroom Carpets Rugs, Super Absorbent Toilet Bath Mats, Rubber N...",4,4599
197,RELOZA Water Absorbing Mat for Bathroom | Super Absorbent Quick Dry Rubber Backed Anti-Slip Floor Mat Non Slip Bath mat (M...,4.3,"45,499"
198,VYAKOM EXPORTS Grey Microfiber Hair Towel Wrap Absorbent Towel Hair-Drying Bathrobe Magic Hair Warp Towel Super Quick-Dryi...,3.9,4599
199,"PINK PARROT Dupion Silk 150TC Cushion Cover, 16x16 Inches, Set of 5",4.3,4599
200,"Akin Towel Royal Multicolour Cotton Hand Towel 50 GSM, Set of 6",4,4599
201,First Kick Baby Blankets Newborn Combo Pack of Hooded Soft Wrapper Cum Towel for Baby Boys and Baby Girls Pack of 3,4.2,"45,499"
202,"BLUE GRASS Bordered Round Transparent 4 Seater Dining Table Cover (Silver Lace, 60 Inches,Vinyl, Pack of 1)",4.2,4599
203,"Urban Space Cotton Curtains For Door Bedroom, Living Room Printed Set Of 2 Curtains With Stainless Steel Rings ( Humming B...",4.5,"45,499"
204,"Kuber Industries Microfiber Square Chair Pad Seat Cushion for Car Pad, Office Chair, Indoor/Outdoor, Dining Living Room, K...",3.8,4599
205,"Status Contract Iris Polypropylene Runner with Anti Skid Backing, Pack of 1 Piece",4.1,"45,599"
