Rank,Name,Ratings,Price
627,Kuber Industries Circle Design Cotton 4 Seater Center Table Cover - Cream - CTKTC22318,4.2,4529
628,"Homerz Shelf Liners for Kitchen Shelves, Shelf Liners for cupboards, Shelves Covers Sheets mat roll for Wardrobe, Drawer m...",4.6,4599
629,"Kuber Industries Checks Print Apron|Checks Design & Waterproof Material|Designer Front Pocket|Size 75 x 50 CM, Pack of 2 (...",3.8,4549
630,"Amazon Brand - Solimo 120 TC 100% Cotton Single Bedsheet with 1 Pillow Cover, Royal Elegance (Grey)",3.6,"45,100"
631,"Fun Homes Microfiber Anti Slip 3 Pieces Door Mat 14""x21"" (Red)",3.7,4599
632,AXL's 1 Meter Metal Patti/Yard Stick/Scale/Rod For Fabric Measurement,4.3,4599
633,Kuber Industries Flower Cotton 7 Piece 5 Seater Sofa Cover with Center Table Cover (Cream) - CTKTC22287,3.7,4509
634,"Handtex Home Rectangular Artificial Polyester Grass Doormat (Green, 40x60 cm)",3.6,4599
635,"HSR Collection Premium Cotton Hand Towel Set of 6 Piece- 120 GSM, Multicolor",4,4599
636,"BSB HOME Cotton Printed 160 TC Standard | Regular | King Size Pillow Cover Set of 4 Piece (18x28 Inches, Blue, Yellow and ...",3.9,4599
637,ST SAPROSE Â® Polypropylene Round Coaster Set (6 PCS Set) Machine Washable Absorbent Size: 5 inch Diameter (OVERGEAN-TAN Me...,4.1,4575
638,"BE BETTERESSENCE Mulberry Silk Pillow Case & Cover for Hair & Skin, Anti Aging, Anti Hair Fall, Anti Acne, Hypoallergenic ...",4.3,"45,899"
639,"MY ARMOR Bear Reading Pillow, Bed Rest Pillow with Support Arms, Perfect Back Support for Reading/Working/Watching TV in B...",5,"45,999"
640,Shophox Smiley Emoji Cushions with Fibre Filling size-12 inch Velvet Soft Smilie Pillows Set of 4 Pieces Use in Kids & Gir...,3.6,"45,299"
641,"Renva Water Absorbent mats for Bathroom Kitchen,Soft Non Slip Memory Foam Bath mat for After Shower,Comfortable Washable D...",3.6,4599
642,Comfort Lifestyle 240 TC High Pitched Satin Stripes Glace Cotton Diwan - 1 Single Bedsheet with 5 Cushion Covers and 2 Bol...,3.6,"45,699"
643,"BabyPro Lab Tested - Certified (Set of 8) Baby Proofing Corner Protectors with Strong 3M Adhesive, for Sharp Edges of Bed,...",4.4,4500
644,"Space Fly SILVERLINE Love Touch Very Soft Fresh Loom 300 GSM 100% Cotton Face Hanky, Face Towel, Handkerchiefs (Multi Dark...",3.8,4500
645,"Ecotribe Premium Cotton Kitchen Apron With Center Pocket, Free Size - Set of 1",4.1,4599
646,Bombay Dyeing 104 GSM Microfiber Pink Double Bedsheet with 2 Pillow Covers,4..1,"45,399"
647,Sri Yagnaa - Backdrop Cloth for Pooja Decoration - Traditional Background Curtain Cloth for Festival (5x8 Ft) (Plain Big B...,4..1,4599
648,HuFF PuFF Baby Dry Sheet Washable Instandry Extra Absorbent Bed Protector Dry Sheet Skin Friendly and Heat Free Mattress -...,4.3,4549
649,"Urbano Homz Single Bedsheet with One Pillow Cover, Bedsheet for Single Bed, 7.4 Feet X 5 Feet,White, Cotton",3.9,4599
650,MOM'S HOME Organic Cotton Baby Quilt Light Winter Blanket- 0-3 Year-110x120 cm - Jungle Safari,4.1,"45,999"
651,BSB HOMEÂ® 200 TC 100% Cotton Feel Bedsheet for Double Bed with Two King Size Pillow Covers Soft/Breathable Wrinkel Free - ...,3.7,"45,299"
652,"MINISO Anti Slip Bath Mat,Super Soft Floor Mat for Home,Super Absorbent Door Mat for Bathroom,40 * 60cm(Coral)",4,4530
653,PUNO Stainless Steel Kitchen Hot Mat/Hot Utensil Stand/Hot mats for Dining Table/Hot Pot Stand/hot mat for Kitchen(2 Piece),3.8,4599
654,"Yagviz Car Seat Headrest Pillow,Head Neck Support Detachable,Premium Seat Head Pillow,180 Degree Adjustable Both Sides Tra...",3.7,"45,999"
655,"SHADES OF HOME - Premium Suede Velvet Blackout Curtain for Bedroom, 7 Feet, Set of 2, Rose",3.9,"45,299"
656,Bombay Dyeing 104 GSM Microfiber Cream Double Bedsheet with 2 Pillow Covers,4..1,"45,399"
657,"P.R.COTTONS: Cotton Kitchen Towels, 5pcs, 45x70CM, 200GSM Multi Color! Multi Purpose Towel for Kitchen,Car,Windows,Drying ...",4.3,4599
658,Haus and Kinder Cotton Fitted Cot Crib Sheet | Bed Sheet for Newborn Baby Crib Mattress | Deep Pocket All Round Elastic at...,4.6,"45,299"
659,JVK 6D Designer Superfine Exclusive Velvet Carpet | Rug | Living Room | Bedroom | Hall | School | Temple | Bedside Runner...,4.2,4599
660,Growth Alley Hair Towel Wrap Absorbent Hair Drying Bathrobe Magic Hair Wrap Towel Super Quick-Drying Head Towel For Women...,3.9,"45,200"
661,LEZANA 12 Pcs Cotton Pillow Cover Set (6 Pairs) | 220 TC Supersoft Brushed Cotton - Breathable & Wrinkle Free - 12 Pcs Set...,3,"45,599"
662,Store TOMATUS 6 PCS Silicone Tableware Insulation Mat Tea Coaster Non-Slip Placemat High Temperature Resistant Insulation ...,3.8,4599
663,"KINGLY Italian Velvet Chevron Blossom 7 Seater Furniture Protectors Sofa Set Cover Set With 4 Arm (4+3 , English Silver)-1...",4.3,"45,299"
664,RKPM Cute Kitchen Waterproof Cooking Apron for Women Girlfriend Mix Print 3 Pcs,3,4599
665,"REFINAAR Orthopedic Lumbar Support & Coccyx Seat Memory Foam Cushion, Pillow for Computer/Office Chair",4..1,"45,999"
666,"Tranquebar Curtain Co. 'Anya'- Premium Cotton Door Curtains with Geometric Print: 7 Feet, Blue & Yellow - 1 Piece, Room Da...",3.9,"45,300"
667,"Hiputee Velvet 800TC Pillow, Standard, Grey-Blue, Pack of 1",4,"45,999"
668,"Ikea TOFTBO Microfibre Bath mat (Beige, White melange, 40x60 cm)",4.4,4549
669,"Trending Products Villa Oven Gloves Heat Proof Microwave Heating Silver Coated Extra Long Oven Mitts, Heat Resistant for K...",4.2,4599
670,"Trance Home Linen Cotton Quilted Mattress Protector Double Queen Size| Water Resistant - Breathable , Soft and Cool Quilte...",4.1,"45,499"
671,"HOKIPO Classic Contemporary Chatai Mat (Black, Madurkathi, Rivergrass, 6x3 Feet)",4,4599
672,"CRT Round Mirror Laces Border for Women's Dresses, Dupatta, Bridal Dresses, Saree, Lehengas, Palazzo, Anarkali Suits, Blou...",3.4,4599
673,BIRMON Chair Cover Set of 6 | Elastic Stretchable Dining | Protective Slipcover | High-Tenacity Print | Removable Washable...,3.9,"45,199"
674,"MSR 116 Vertical Blinds/Curtains and Shades for Home Furnishing(Balcony,Kitchen,Bedroom,Bathroom etc) Cream (4ft(W) * 4ft(...",4,"45,600"
675,Divine Casa Microfibre Mild Winter 110 GSM Printed Reversible Single Bed Quilt Comforter Blanket - (Dazzling Blue and White),4.2,"45,999"
676,DVH Sales Kitchen Sheets For Shelves Waterproof Cupboard Mats Roll For Anti Slip Mat For Kitchen Cabinet Shelf Liners Shee...,3.3,4599
677,"GiftsOnn Peach and Goma Mochi Cat Pillow Cushion, Gifts for him, Boyfriend, Girlfriend, Valentines Gift for Girlfriend, Va...",5,4599
678,"AmazonBasics Microfiber Sheet Set - (Includes 1 bedsheet, 1 Fitted Sheet with Elastic, 2 Pillow Covers) King, Yellow Scallop",3.9,"45,000"
679,Doctor Towels Doctor Towels (Pack Of 1 - French Blue) Worlds First Banana & Cotton Towel (Patent Pending) With Antimicrobi...,3.9,"45,549"
680,MOM & SON U-Shape Panda New Born Baby Head Shaping/Neck Support Velvet Sleeping Pillow (0-6 Months),4,4599
681,Dolphers Waterproof Plastic Mattress Protection Sheet for Baby and Adult - Single Bed Size - 6 ft x 4.5 ft - Golden Brown,4,4599
682,"SRA Metal Curtain Bracket ( 1 inch, Gold ) - Pack of 2",4,4549
683,"Rangoli Tonal 100% Cotton Kids Bathrobe, 400 GSM | Ultra soft, Super Absorbent Hooded Bathrobe for Boys and Girls",4,"45,199"
684,"HNESS Bath Mat, Door mat Quick Drying Water Soak Bathroom Mat & Water Absorbent Door Mat, Floor Mat, Doormat, Bathroom Car...",3.5,"45,999"
685,superbottoms 2 Dry Feel Swaddle Wrap with 3X Thicker Premium Wet Wipes | Dry Feel Layer Inside | Easy to Wear Wrapper | 9...,3.8,"45,897"
686,pepme Cotton Cushion Cover Tufted Triangle Design Hand-Woven 16 inch Bohemian Pillow Case Living Room Decorative Throw Sof...,4.1,"45,000"
687,"MONTISAÂ® Chatai Mat, Madurkathi Mat/Korai Mat/Straw Mat/Rivergrass Mat/Seagrass Mat Portable Eco-Friendly Natural Handmade...",4.1,4599
688,"SARAL HOME EASY LIVING Saral Home Decorative Jute & Cotton Printed Table Mat (Pack Of 4 Pc, 38X38 Cm), White",4.3,4549
689,selinta Hair Towel Wrap Absorbent Towel Hair-Drying Bathrobe Magic Hair Warp Towel Super Quick-Drying Microfiber Bath Towe...,4,4599
690,"AVI Microfiber Pillow, 16 Inch X 24 Inch, White, 1 Pieces",4.3,4599
691,"HOKIPO Â® Fabric Cotton Jacquard Table Runner for Centre Table (IN-20, 13x60 Inches)",3.9,4599
692,Expressions Polar Electric Bed Warmer - Electric Under Blanket - Double Bed Size (150cms x 160cms) with 3 Heat Settings & ...,4.1,"45,599"
693,"SHIV KIRPA Cotton Heavy Fabric 500 TC Floral Design 3 Seater Sofa Cover Use Both Side, Living Room, Drawing Room, Bedroom,...",4.6,4599
694,MSenterprises Cushion Covers Set of 5 Beige Burnt Emboss Velvet 40X40 cm (16X16),4.2,4599
695,DECORDEC Turkish Kilim Runner Rug Long & Reversible for Home/Kitchen/Living Area/Bedside Carpet (1.5 x 5),4,"45,699"
696,"DEBIKÂ® | 2 Pack PVC Waterproof & Dustproof Apron For Dishwashing, Coffee, Dog Grooming, Cleaning Fish, Project-Industrial ...",3.3,"45,299"
697,Incredible Hub Iron Kitchen Tissue Paper roll Holder | Towel Holder | Stand-up Kitchen Tissue Stand Roll Contemporary Pape...,4.1,4599
698,"AmazonBasics Faux Angora Fringed Blanket - Grey, 50"" x 60"" (Polyester, breathable, Pack of 1)",4,"45,900"
699,"Casa Copenhagen - Egyptian Cotton Emerald 10 Pcs Face Towel (30 X 30 cm) Colour : - IbazaBlue, Grey Violet , Granite Grey...",4.6,4599
700,"Deevine Craft jymarketing Jy Home Floor Square Cotton Cushion (18 x 18 x 4 Inch, Multicolour)",4,4599
701,"Yellow Weaves Non Slip PVC Bath/Shower mat with Anti Slip Suction Cups (78 X 37 cm, Blue)",4.1,4599
702,Ab Home Decor Glace Cotton Satin Striped Premium Plain Color Bedsheet for Double Bed King Size with Two Pillow Covers (90 ...,4.1,"45,499"
703,"Deevine Craft Soft Fiber, Racron Polyester Synthetic Cotton Filling for Cushion, Pillow, Teddy Bear, Toy Stuffing Pillow C...",3.4,4598
704,Tickles Blue Monkey Soft Stuffed Toy Curtain Holder Clip for Living Room,4.3,"45,569"
705,"BSB HOME Prime Collections 100% Cotton Feel Double/Queen Size Bedsheets with 2 Pillow Covers Cotton, 180tc Half Cricle Bla...",4.5,4599
706,"Bhoomi Impex 400 Thread Count 100% Egyptian Cotton Pillow Cases Light Blue Solid - 20 X 36 Inch - Pillowcase Set of 2, Lon...",4.2,4599
707,"Ash Mats Grass G1 Ivory Floor Mat, 4x6 Feet",4.1,4599
708,EVOHOME Â® Super Soft Plain Embossed Mink Heavy Single Bed Woolen Blanket 500 TC Quilt/Rajai/Comforter Blanket Single Bed W...,3.7,"45,999"
709,pravyta Anti Skid Mat for Bathroom Stand Up Floor Bath Mat for Bathtub Anti Slip Shower Mat |Soft-Pebble| 60x40 cm (Multic...,3.5,4599
710,DOHAR Rajasthani Traditional Light Weight Pure Cotton Double Bed Soft Jaipuri AC Quilt/Razai Floral Print (Size 85X100 inc...,Get,"45,999"
711,Kuber Industries PVC AC Curtain |Eyelet Rings & Waterproof Material|.30 MM Thickness & Mold Mildew Free|Size 7 Feet (Trans...,3.8,4599
712,Kuber Industries PVC Soft Leather 6 Pieces Dining Table Placemat Set (Gold) -CTLTC11352,4,4599
713,BEAUTRISTRO Printed Hair Cutting Sheet Apron Hairdressing Gown Cape Hair Cutting Barber Cloth Salon Accessories,3.7,4599
714,"Sharma Clothing Baby's Soft Cotton Plastic Sleeping Mat,Changing Mat,Waterproof Bed Protector with Foam Cushioned Changing...",3.7,4599
715,"Kuber Industries Chair Pad|Chair Cushion Pad|Chair Cushion for Office, Home or Car Sitting|Pack of 2 (Grey)",3.7,4599
716,Akshya Elastic Fitted King Size Bedsheet with 2 Pillow Cover (108 x 108) inches | Elastic Fitted bedsheets King Size(Cotto...,4,"45,999"
717,"Device of Owl with BABY DESIRE Cotton Standard Carry Bed Cum Baby Sleeping Bag, Green, 1 Piece",4.1,4599
718,Shophox Smiley Emoji Cushions with Fibre Filling size-12 inch Velvet Soft Smilie Pillows Set of 4 Pieces Use in Kids & Gir...,3.6,"45,299"
719,"Gouri textiles Striped Satranji Rug (Multicolour, Cotton, 7.5 Ft x 5 Ft)",3.8,4599
720,Bzcarts Zinc Antique Brass Designer Heavy Curtain Supports for Door and Window Curtain Brackets|Holder|Knobs for 1 Inch Rod,4.1,"45,499"
721,"Glow Home Pack of 6 ( 2 pcs Each of 3 Colors ) ,100% Pure Cotton Print Hand Towels , 300 GSM , Soft Luxury Material, Highl...",4.4,4599
722,"PICKKART Faux Fur Throw Pillow Covers-16"" x 16"",Set of 3 - Soft Cushion Cases - Fuzzy Fluffy Cozy for Sofa Bed Decor Couch...",4.6,4599
723,FRESH FROM LOOM Sheer Curtains 7 Feet Long Door and Window | Net Curtain | Semi Transparent Tissue Screens Parda | Eyelet ...,3.3,"45,420"
724,BSB HOME New Resham Collection 240TC Cotton Printed 1 Double Bed-Sheet with 2 Matching Free King Size Pillow Covers-(230x2...,5,"45,299"
725,TAPUJI Quick Drying Water Soak Bathroom Mats Anti Slip Big Size Water Absorbing Floor Washable Anti Skid Foot Mat (Multico...,3.7,4599
726,"Prostuff.in Bed Sheet Fasteners, Mattress Sheet Holders Double Sided Hook Loop Dots, Non-Slip Sticky Back Tape for Bedding...",2.7,4500
727,"HOKIPO Shining Dining Placemats Set of 6 Washable Dinner Mats, Satin Brass (AR-3943-SBRS)",4.1,"45,299"
728,Nagar International Baby Bedding Set with Mosquito Net Cotton Mt-01 Blue New Born to 5 Months Baby,4,"45,300"
729,Roseate Velvet Cushion Cover (16x16 Inch) Throw Pillow Covers Gold Line Soft Decorative Square Cushion Covers for Couch/ C...,4.4,4599
730,"Discount4product Modern 10 Piece Strings Acrylic Crystal Bead String Curtains For Decoration, Multicolour(lined), Washable",4,"45,999"
731,"Griiham Sofa Cover Set for 5 Seater Sofa - (3+1+1) 3 Seater & 2 Seater Fully Covered , 10pcs Floral Abstract Design Slipco...",3.7,"45,500"
732,"Status Interieur Semi Circle/D-Shape Entrance Floor Door Mats Home Decor Non-Slip Carpet for Bathroom, Bedroom, Balcony, L...",3.8,4599
733,"BEAR GRIPS Memory Foam Bathroom Door Mat, Non-Slip, Anti Skid, Ultra Soft, Super Water Absorption,Thick and Easy to Dry (S...",4.4,"45,700"
734,More Essentials Paper Napkins - 100 Sheets,3.9,4599
735,HEYOL Cabinet mats Waterproof Non Slip Kitchen Drawer mat Shelf Liners for Kitchen Shelves ( 30cmx 3 Meter Multicolour ),4..1,4599
736,ZYAX Sparkle Maxx Pool Clarifier & Conditioner Fast & Effective for Swimming Pool & Spa Turns Cloudy Water Into Sparkling ...,3.9,"45,400"
737,"Kreeva Velvet Floral 6 Piece 5 Seater Sofa Cover and Chair Set (3+1+1), Onion Purple",4.2,"45,499"
738,Kuber Industries Premium Sofa Cover with Center Table Cover|Chikankari Cotton Fabric|6 Pieces Cotton 5 Seater Sofa Cover S...,3.9,4509
739,Metron Ortho Bed Wedge Pillow for Acid Reflux for Sleeping Back Rest or Leg Elevator |Multipurpose Uses |Can be used on be...,4.8,"45,995"
740,NEW LEAF Premium Cotton Elastic Fitted Bedsheets with 2 King Size Pillow Covers | Double Bed with All Around Elastic 180 T...,4.1,"45,599"
741,ROYAL TREND Net Transparent Curtain Drape | Semi Sheer Panels for Home and Office Decor | Eyelet Curtains for Living Room ...,4.5,4599
742,"RD TREND Microfiber 210TC Elastic Fitted Single Bed Sheet(Size-48inch x 72 inch x 6 inch) with 1 Pillow Cover, White Box",4,4599
743,"IMPEXART PVT LTD Cotton 250TC Cushion Covers , 12 x 20 Inch, 30 x 50 cm, Orange",4.3,"45,599"
744,Kuber Industries PVC AC Curtain |Eyelet Rings & Waterproof Material|.30 MM Thickness & Mold Mildew Free|Size 9 Feet (Trans...,3.8,4599
745,"Gurnoor 180 Jute Handmade Decorative Throw Pillow/Cushion Cover (Blue, 16 x 16inches)- Set of 5",4,4599
746,"Sashaa World Tufted Colored Striped Bath Mat (50X80 Cm, Multi, 70% Cotton, 30% Polyester)",4.4,4599
747,"Avinya Cotton Feel Glace Cotton Elastic Fitted Printed Single Size Bed Bedsheet with 1 Pillow Cover(72""x 48""x 6) (Black)",4..1,"45,299"
748,"JBG HOME STORE 2 Piece Flower Sheer Transparent Tissue Net Panel Eyelet Polyester Fancy Door Curtains - 8 Feet, White",4,"45,999"
749,HOMEMONDE Cotton Curtain 7 Feet Door with Hand Block Print Decorative Eyelets Pack of 2 (3.7ft x 7ft Orange),4.4,"45,199"
750,BSB HOMEÂ® 3D Printed 144 Tc Microfiber Bedsheet for Single Bed (90X60) with 1 King Size Pillow Covers (20X30) Inches (Red),3.6,4599
751,"Trance Home Linen Pure Cotton 400 TC King Fitted Bedsheet with 2 Pillow Covers (King 78x72, Silver Grey)",4.2,"45,999"
752,Sun Shield Zinc Alloy Antique Mandir Wine Gold Finish Curtain Bracket Window Curtains Holder Support for Window & Door Fit...,4.1,"45,499"
753,"Braids Zesture Home 6D Floral Design Brown Multipurpose Living Room, Bedroom, Kitchen, Picnic, Praying Modern Carpet/Area ...",3.7,4599
754,"Spring Wire Rod/Cord for Window Net, Curtains, Blinds, Drapes & Door with Pre-installed Eye hooks (40 Inch, Black)",4,4500
755,TheCoolio 300pcs of Assorted Blind (POP) Rivets in Three Sizes,4.2,4590
756,"Gurukirpa Traders 100% Cotton Solapur Chaddar Reversible Single Bed Blanket Heavy Quality, Red Maroon Brown Multicolor, Pa...",5,4599
757,"VOMZER 144 Tc 100% Soft Microfiber Solid & Plain Bedsheet for Double Bed with 2 Pillow Covers, Size 95 inch x 90 inch- (Grey)",3.5,"45,299"
758,"Amazon Brand - Solimo Polar Fleece Blanket, Double (100 x 90 inch), Light Blue, fade_resistant",4,"45,500"
759,India Furnish Silk Dupion Quilt Design Cushion Cover Set - Standard (Blue) (IFCS15071),4.4,"45,000"
760,"Geet Homes- Printed Kitchen Floor Mat & Runner with Anti Skid Backing, Set of 2 (40 x 130 & 40 x 60 cm) (Wooden Grass)",4..1,"45,149"
761,VMC Waterproof Vinyl Apron Industrial PVC Adjustable Apron for Unisex (Burgundy),5,4550
762,"Ecrites Cotton Pillow Covers Set of 4 ,Pillow Cases Set of 4, Flower Printed Pillow Covers (Blue, 17 x 27 inches)",3.5,4599
763,Men Women Hotel Restaurants Cooking Kitchen Chef Apron (Pack of 1),5,4570
764,Future homez 250 GSM Pure Cotton Pure Cotton Eyelet Door Curtain 7Feet Set of 1,4.4,"45,099"
765,Amazinghind Mosquito Net for Baby Cradle Swing/Mosquito Net for Baby Jhula with Side Zip Opening (0-3 yrs) (Blue) (White N...,3.5,4599
766,"Trance Home Linen Pure Cotton Printed King Fitted Bedsheet with 2 Pillow Covers (78 x 72 inch , Aangan Blue)",4.1,"45,599"
767,"Trance Home Linen Pure Cotton Printed King Fitted Bedsheet with 2 Pillow Covers (78 x 72 inch , Aangan Blue)",4.1,"45,599"
768,Stylista Transparent 32 inches LED/LCD tv Cover,3.6,4599
769,"aRDENMEAD Table Runner for 6 Seater Dining Table,Centre Table Fine Cotton with Embroidery | Decorative Center Table Runner...",4..1,4599
770,"Dreamscape Twill 100% Cotton Double Bedsheet with 2 Pillow Covers Set, 180tc Floral Pink Bedsheets for Double Bed Cotton (...",4.2,"45,699"
771,Electromark ESD Safe anti static apron Blue MEDIUM SIZE,3.9,4599
772,"BSB HOMEÂ® 100% Cotton Ultrasonic 280 Tc Solid King Size Quilted Bed Cover/Bedsheet with 2 Pillow Case, (Luxurious, Dark Gr...",3.9,"45,999"
773,"FITMAT Memory Foam Mattress Topper (72"" X 78"" X 2"",White) Orthopedic Mattress Topper with High Density Memory Foam Premium...",4.2,"459,800"
774,"HOKIPO Large 40x120cm Natural Coconut Coir Mat for Entrance Big with PVC Backing, Multi-Color (IN-490)",4.3,"45,099"
775,"Heart Home Rubber Anti Slip Welcome Door Mat for Home Entrance, Office, Shop (Grey)-HHEART15374",3.7,4599
776,"RUSTIC LINEN Multipurpose Velvel Microfiber Rug, Carpet, Aasan, Chatayi Size 2 x 6 Feet, (Maroon)",3.8,4599
777,"Dormyo Contour Cervical Memory Foam Pillow, Queen Size with only Inner Cover Without Zipper (Multi, 20"" X 11"" X 3.75"") no ...",4.1,"45,499"
778,kk home store decor Royal Look Velvet Sofa Cover Set with Heavy Fabric Floral Design 5 Seater Sofa Cover with 6 Handle Cov...,4.1,"45,999"
779,"Trendy Home 18x18 Hypoallergenic Cushion Stuffer for Home & Office Use, Cushion Fillers for Sofa Pillows (Machine Wash, Wh...",4.4,"45,999"
780,"Red Crush Doormat Pvc Plastic Durable Stick Turf Mat (35X60 cm, Green)",3.6,4599
781,Bathroom mat Water Absorbing Non Slip Floor mat Pack of 6,3.4,
782,"Maharsh Pu Leather Dining Table Mat Waterproof Heat Insulation Placements (Maroon, 6)",4.5,4599
783,Switchon Polyester Printed Free Size Chef's Cooking Kitchen waterproof Apron for Men -Black 23x30 inch (57x77cm),3.8,4545
784,VHD Sales Kitchen Sheets for Shelves Waterproof Wallpaper Cupboard mats roll for Wardrobe Anti Slip mat for Kitchen Cabine...,3.4,4599
785,"THE HOME TALK Handmade Cotton Carpets | Tribal Contemporary Decorator | Area Rug Bedside Runner Bedroom, Center Table, Liv...",4.1,"45,399"
786,Wesofy Ruffled Satin Pillow Covers for Hair and Skin| Silk Satin Pillowcase 2 Pack with 3 Silk Scrunchies|18w X 28l Inch S...,4.5,4599
787,BSB HOME Premium 160 TC Super Soft Glace Cotton Floral Breathable & Wrinkle Free Bedsheet with 2 Pillow Covers (Dark Grey ...,3.6,"45,299"
788,"Braids Floral Persian Carpets (Red, Maroon, Chenille, 4.5 feet x 6 feet)",3.8,4599
789,"BedZone 120 TC Cotton Blend Mandala Printed Jaipuri Bedsheet for Double Bed King Size with 2 Pillow Covers, Blue",4..1,4599
790,"GIFT JAIPUR EK hajaro Me Meri Bahna he Printed Cushion Pillow with Filler, Mug, Keychain Combo | Birthday Rakhi Rakshaband...",4.1,"45,000"
791,"Loom Creations Cotton 240 x 130 cm Chadar, Yellow",3.7,4599
792,Rajvin Home Decor Export Quality Look rubber Soft Anti-Skid Washable Multi Purpose Mat & Runner Set Kitchen Combo mat (18x...,3.7,"45,699"
793,"Outfit Collections Baby Blankets for New Born Super Soft Hooded Wrapper, Sleeping Bag for 0-6 Months Boys and Girls Babies...",3.9,4599
794,Elevanto Premium Collection Half Sleeve Terry Cotton Bathrobe-Free Size(Purple),3.7,4599
795,MAFATLAL Extra Soft & Super Absorbent (450GSM/70X140 CMS) Cotton Bath Towel Number of Pieces-1,4..1,"45,099"
796,BSB HOMEÂ® Prime Collection Combo Pack of 2 Single Bedsheets with 2 Pillow Covers | 180 TC Soft Brushed Glace Cotton -Breat...,4.3,4599
797,"UPDHANM Supersoft Abstract Diwan Of Single Bed Sheet With 5 Cushion Cover And 2 Bolster Cover Set Of 8Pcs white, Super Soft.",3.7,"45,299"
798,"Saral Home Chenille 3 Seater Sofa Cover Throw (Beige, 140x210 cm)",4.1,"45,099"
799,Swalloworld Designer Designer Superfine Exclusive Velvet Carpet | Rug | Living Room | Bedroom | Hall | School | Temple | B...,5,"45,999"
800,RECTITUDE Bath Mat with Anti Slip Suction Cup for Bathtub and Shower Bathroom Non-Slippery PVC Rubber (Square- 48x48 cm),4,4599
801,"Super Home Luxurious Attractive Design Chenille 4 Seater Center Table Cover (52x36 Inch,132cmX91cm)_Brown",3.8,4599
802,"Sky-ESD Safe Cleanroom Sticky Mat - [2 Feet x 3 Feet][1 Mat, 30 Peelable Sheets] Pack of 1",4.6,4599
803,SRHandloom Pure Cotton Anti Skid Door Mat/Bath Mat - (Multicolor) - Set of 3,3.2,4599
804,"Shahi Concept XXXL King Size Bedsheet || 110x120 inch, 10 Feet Bedsheet || Super King Size with 2 Pillow Covers || 240 TC ...",3.9,"45,999"
805,GLOY HomeÂ® Cotton Table Runner (14x72 Inch) - The Style of Our Table Linen and Dining Rooms and Eating Areas Flawlessly (M09),4..1,"45,049"
806,"Kanwar sa Microfiber Square Cushion Filler 16 inches X 16 inches, Sofa Pillow Set of 5",4..1,"45,499"
807,"MINSALESï¿½Spring Wire for Window Net Curtain Cord Kit with 10 Hooks for Hanging net Curtain, Voile, Party Decoration, Garde...",4.2,4599
808,"Cbadni Decor Plastic Curtain Rings Eyelet Rings (1.5 Inches) with Lock Pearl Color, Pack of (18)",4..1,4599
809,WL Printed Coir Mat 40x60 cm,4.4,4550
810,Khillayox Cotton Hand Towel (350 GSM/14 x 21 Inch) Set of 12 Pieces Medium Size Towel for Men's & Women's_Multicolor,3.5,4599
811,Adore Stuff Bedding and Mosquito Net Set with Sleeping Bag Combo Pack for 0-6 Month Babies - Green Heart Color,4.6,4599
812,Mylo Essentials Maternity Wedge Pillow - Soft PU HD Foam Pillow for Pregnant Women - Maternity Pillow for Back Pain - Anti...,3.8,4579
813,"Riftree Chenille Anti-Skid Muslim Islamic Jainamaz/Prayer mat, 4x2 feet or 117 x 69 cms (Brown)",3.9,4599
814,"RD TREND Polyester & Polyester Blend Floral Window Curtain, 4 x 5 ft, Aqua, Pack of 2 (PC-221, Eyelet, Washable)",3.8,4599
815,"Habere India-All the Cultures Fabricating India - Crochet Bath Mat, Super Absorbent 100% Cotton & Quick Dry Bath Rug for B...",3.3,4599
816,"Chozha 's 3 in 1 Baby Bed, Sleeping Bag & Carry Nest, Cotton Baby Bedding for New Born & Infant,for Baby Carrying & Sleepi...",5,4599
817,"RUSTIC LINEN Super Soft Brushed Microfiber Cotton Curtains for Door,Bed Room,Living Room,Set of 2 Curtains with Grommet, 7...",3.9,"45,999"
818,"Recron Certified Medipillow Fibre Pillow - 43 cm x 69 cm, White",2.9,"45,259"
819,BLOCKS OF INDIA Hand Block Printed Cotton Linen Cushion Cover (16 x 16 inches) (Green Pink Motifs),5,"45,899"
820,VEL TEXTILE Cotton Bath Towel (Green),3.7,4500
821,Elegant Home Decor Tissue Box & Napkin Holder Dispenser Rickshaw Design for Kitchen/Dining Room/Dinner Table/Bathroom,4.2,4599
822,"Amazin Homes 3D Digital God Bhagwan Printed Print Polyester Knitting Door Curtain for Home, 4 x 7ft, Multicolour",4.3,4599
823,"DDECOR - Bamboo 100% Cotton Double Bedsheet with 2 Pillow Covers, Brown",4,"45,899"
824,"Status Contract PVC Rubber Outdoor Door Mat for Home/Bathroom/Bedroom/Office/Main Door/Rainy Season (Black, 38x58 cm)",4.1,4599
825,"AEROHAVEN Cotton blend Decorative Throw Pillow/Cushion Covers (16 x 16 inch, Multicolour) - Set of 5",4.1,4599
826,"Doctor Towels MUSA Terry Bath Towel - World's First Banana Yarn + Cotton Towel (Patent Pending) | Anti-Microbial Treated, ...",2.9,"45,949"
827,THE HOME STYLE 350TC Super Soft Glace Cotton AC Comforter King Size Double Bed with 1 Flat Bedsheet-90x100 Inch and 2 Pill...,4,"45,999"
828,"ROMEE Soft Velvet Febric Solid Plain Cushion Covers 16x16 inch, Set of 5 - Brown",4.1,"45,499"
829,"Amazin Homes 3D Digital Printed Balaji God Curtains for Home Polyester Knitting Door Curtain (White 4 x 7 feet, Knitting, ...",4.2,"45,400"
830,"Oasis Home Collections Cotton Check 2 Seater Square Table Cloth (40 X 40 Inches, Black , Pack of 1)",3.9,4599
831,IM FAB Kid's Cartoon Design Canvas Cotton Cushion Cover (16x16 Inch) - Set of 5 pcs- Multicolor,4.3,"45,299"
832,BSB HOME Cotton Flat Double Bedsheets with 2 King Size Pillow Covers | Double Bed Breathable | Wrinklefree | Ultrasoft 200...,5,"45,299"
833,"Kuber Industries Cotton 2 Piece Hand Gloves Set - Cream, Standard",3.2,4599
834,"Khooti Rectangular Velvet Cushion Cover, 12x18 (Teal Green)(Pack of 1)",3.7,4596
835,"Crownish Microwave Silicone Heat Resistant Grilling BBQ Insulated Gloves for Cooking, Baking, Smoking & Potholder (1)",2.9,4599
